abstract,web_url,snippet,lead_paragraph,print_section,print_page,source,multimedia,headline,keywords,pub_date,document_type,news_desk,section_name,byline,type_of_material,_id,word_count,uri,subsection_name
,https://www.nytimes.com/1855/12/01/archives/fell.html,,,,3.0,The New York Times,[],"{'main': 'Fell.', 'kicker': '1', 'content_kicker': None, 'print_headline': 'Fell.', 'name': None, 'seo': None, 'sub': None}",[],1855-12-01 05:00:00+00:00,article,,Archives,"{'original': '', 'person': [], 'organization': None}",Archives,nyt://article/00ec201a-3746-5a66-86a9-3e4fc805548b,0,nyt://article/00ec201a-3746-5a66-86a9-3e4fc805548b,
,https://www.nytimes.com/1855/12/01/archives/article-2-no-title.html,,,,4.0,The New York Times,[],"{'main': 'Article 2 -- No Title', 'kicker': '1', 'content_kicker': None, 'print_headline': 'Article 2 -- No Title', 'name': None, 'seo': None, 'sub': None}",[],1855-12-01 05:00:00+00:00,article,,Archives,"{'original': '', 'person': [], 'organization': None}",Archives,nyt://article/10c647d7-bee1-56d0-b2a3-859f54cbbd48,0,nyt://article/10c647d7-bee1-56d0-b2a3-859f54cbbd48,
"The Late Edward Neville. The Coroner's Jury in this case returned a verdict yesterday, that Mr. NEVILLE ""Came to his death by being drowned off the Peak-slip ferry-boat Onelaska, on the morning of the 9th inst., while laboring under a temporary absence of mind,"" or, in plain English, that he committed suicide while laboring under a depression of spirits from financial embarrassments.  ",https://www.nytimes.com/1855/12/01/archives/long-island.html,,,,8.0,The New York Times,[],"{'main': 'LONG ISLAND.', 'kicker': '1', 'content_kicker': None, 'print_headline': 'LONG ISLAND.', 'name': None, 'seo': None, 'sub': None}",[],1855-12-01 05:00:00+00:00,article,,Archives,"{'original': '', 'person': [], 'organization': None}",Archives,nyt://article/2261a49a-f2cd-55b0-a956-4753b665ed27,0,nyt://article/2261a49a-f2cd-55b0-a956-4753b665ed27,
"The news from Sweden brought by the last arrivals proves, anew, that European diplomacy is the most active, just when little or nothing of its doings is permitted to reach publicity. Whilst the attention of the world has been fixed upon  ",https://www.nytimes.com/1855/12/01/archives/the-swedish-alliance.html,,,,4.0,The New York Times,[],"{'main': 'The Swedish Alliance.', 'kicker': '1', 'content_kicker': None, 'print_headline': 'The Swedish Alliance.', 'name': None, 'seo': None, 'sub': None}",[],1855-12-01 05:00:00+00:00,article,,Archives,"{'original': '', 'person': [], 'organization': None}",Archives,nyt://article/29ed823d-4614-53b5-ab68-8c404b4e512b,0,nyt://article/29ed823d-4614-53b5-ab68-8c404b4e512b,
,https://www.nytimes.com/1855/12/01/archives/freight-car-on-fire.html,,,,3.0,The New York Times,[],"{'main': 'Freight Car on Fire.', 'kicker': '1', 'content_kicker': None, 'print_headline': 'Freight Car on Fire.', 'name': None, 'seo': None, 'sub': None}",[],1855-12-01 05:00:00+00:00,article,,Archives,"{'original': '', 'person': [], 'organization': None}",Archives,nyt://article/2ef177bc-33f7-57aa-a330-007e467543ea,0,nyt://article/2ef177bc-33f7-57aa-a330-007e467543ea,
Removes his Residence to N.Y,https://www.nytimes.com/1855/12/01/archives/front-page-1-no-title.html,Removes his Residence to N.Y,,,1.0,The New York Times,[],"{'main': 'Front Page 1 -- No Title', 'kicker': None, 'content_kicker': None, 'print_headline': 'Front Page 1 -- No Title', 'name': None, 'seo': None, 'sub': None}",[],1855-12-01 05:00:00+00:00,article,,Archives,"{'original': '', 'person': [], 'organization': None}",Archives,nyt://article/44cd56ae-8a27-52d2-b163-4ee495781fb4,0,nyt://article/44cd56ae-8a27-52d2-b163-4ee495781fb4,
,https://www.nytimes.com/1855/12/01/archives/religious-notices.html,,,,5.0,The New York Times,[],"{'main': 'RELIGIOUS NOTICES.', 'kicker': '1', 'content_kicker': None, 'print_headline': 'RELIGIOUS NOTICES.', 'name': None, 'seo': None, 'sub': None}",[],1855-12-01 05:00:00+00:00,article,,Archives,"{'original': '', 'person': [], 'organization': None}",Archives,nyt://article/4608804c-11a8-54c7-ac80-9df1dc60e9a4,0,nyt://article/4608804c-11a8-54c7-ac80-9df1dc60e9a4,
,https://www.nytimes.com/1855/12/01/archives/front-page-3-no-title.html,,,,1.0,The New York Times,[],"{'main': 'Front Page 3 -- No Title', 'kicker': '1', 'content_kicker': None, 'print_headline': 'Front Page 3 -- No Title', 'name': None, 'seo': None, 'sub': None}",[],1855-12-01 05:00:00+00:00,article,,Archives,"{'original': '', 'person': [], 'organization': None}",Archives,nyt://article/4c5422a2-b23c-5a37-b732-7fb9aefd34cd,0,nyt://article/4c5422a2-b23c-5a37-b732-7fb9aefd34cd,
"The trial of Baker, which has now reached its fourth day, was resumed this morning at 11 o'clock. The Court-rom was crowded, as heretofore, with a most interested audience. On the remorest benches in the Sessions-room, men were piled heap over heap, overlooking the sea of heads in the body of the Court.  ",https://www.nytimes.com/1855/12/01/archives/the-stanwix-hall-tragedy-testimony-of-peter-barlow-jarob-ackerson.html,,,,2.0,The New York Times,[],"{'main': ""THE STANWIX HALL TRAGEDY.; Testimony of Peter Barlow, Jarob Ackerson and Leon Oliver--Singular Narrative of William J. Mitchell--Evidence of Charley Lozier--Evidence of Merrill the Hack-driver--Exciting Scene in Court--Remarkable Demonstration. COURT OF OYER AND TERMINER. Beford Ben Juden Rec??lt Trial of Lewis Baker for the Homicide of William Poole. CYRUS SHAY'S CROSS-EXAMINATION."", 'kicker': '2', 'content_kicker': None, 'print_headline': ""THE STANWIX HALL TRAGEDY.; Testimony of Peter Barlow, Jarob Ackerson and Leon Oliver--Singular Narrative of William J. Mitchell--Evidence of Charley Lozier--Evidence of Merrill the Hack-driver--Exciting Scene in Court--Remarkable Demonstration. COURT OF OYER AND TERMINER. Beford Ben Juden Rec??lt Trial of Lewis Baker for the Homicide of William Poole. CYRUS SHAY'S CROSS-EXAMINATION."", 'name': None, 'seo': None, 'sub': None}",[],1855-12-01 05:00:00+00:00,article,,Archives,"{'original': '', 'person': [], 'organization': None}",Archives,nyt://article/4c76bad5-1335-5e46-b682-2ffb5b03e23c,0,nyt://article/4c76bad5-1335-5e46-b682-2ffb5b03e23c,
"In this City, on Friday evening, Nov. 30, THOMAS A. MAHAN, in the 25th year of his age. The friends of the family are invited to attend his funeral on Sunday, Dec, 2, at 2 o'clock, from his late residence, No. 336 Broome-st. In this City, on Friday, Nov. 30. S. VALENTINE, son of Homer and Susan G. Tillon, aged 3 years 6 months and 13 days.  ",https://www.nytimes.com/1855/12/01/archives/died.html,,,,8.0,The New York Times,[],"{'main': 'DIED.', 'kicker': '1', 'content_kicker': None, 'print_headline': 'DIED.', 'name': None, 'seo': None, 'sub': None}",[],1855-12-01 05:00:00+00:00,article,,Archives,"{'original': '', 'person': [], 'organization': None}",Archives,nyt://article/4f23f7f3-b7c2-5577-9b9d-7cc83a4a3e2e,0,nyt://article/4f23f7f3-b7c2-5577-9b9d-7cc83a4a3e2e,
"The bark Lucia Maria arrived here to-day from Buenos Ayres, with dates to Sept. 23. She is bound for Salem. The barks Gipsy from New-York. arrived at Buenos Ayres Sept 2, and the Hannibal. from the same place, Sept. 16.  ",https://www.nytimes.com/1855/12/01/archives/revolution-in-buenos-ayres.html,,,,4.0,The New York Times,[],"{'main': 'Revolution in Buenos Ayres.', 'kicker': '1', 'content_kicker': None, 'print_headline': 'Revolution in Buenos Ayres.', 'name': None, 'seo': None, 'sub': None}",[],1855-12-01 05:00:00+00:00,article,,Archives,"{'original': '', 'person': [], 'organization': None}",Archives,nyt://article/5551d1b9-5051-5b59-b944-dc089ce9775a,0,nyt://article/5551d1b9-5051-5b59-b944-dc089ce9775a,
"IMPORTANT DECISION.--The BENWOOD INJUNCTION DISSOLVED.--The difficulty between the Baltimore and Ohio Railroad Company and the City of Wheeling in regard to the right of the latter to form a connection at Benwood with the Central Ohio Railroad, and the stringent injunction against the Company obtained in violation of all law and justice from one of the inferior Courts of Virginia are matters familiar to our readers.  ",https://www.nytimes.com/1855/12/01/archives/front-page-2-no-title.html,,,,1.0,The New York Times,[],"{'main': 'Front Page 2 -- No Title', 'kicker': '1', 'content_kicker': None, 'print_headline': 'Front Page 2 -- No Title', 'name': None, 'seo': None, 'sub': None}",[],1855-12-01 05:00:00+00:00,article,,Archives,"{'original': '', 'person': [], 'organization': None}",Archives,nyt://article/5620141d-aa1d-5a62-ad59-1f96519d4906,0,nyt://article/5620141d-aa1d-5a62-ad59-1f96519d4906,
,https://www.nytimes.com/1855/12/01/archives/thanksgiving-in-keatucky.html,,,,4.0,The New York Times,[],"{'main': 'Thanksgiving in Keatucky.', 'kicker': '1', 'content_kicker': None, 'print_headline': 'Thanksgiving in Keatucky.', 'name': None, 'seo': None, 'sub': None}",[],1855-12-01 05:00:00+00:00,article,,Archives,"{'original': '', 'person': [], 'organization': None}",Archives,nyt://article/5b6cb6c9-2a68-575e-aadc-c0a1e7e6b926,0,nyt://article/5b6cb6c9-2a68-575e-aadc-c0a1e7e6b926,
,https://www.nytimes.com/1855/12/01/archives/marine-intelligence.html,,,,8.0,The New York Times,[],"{'main': 'MARINE INTELLIGENCE.', 'kicker': '1', 'content_kicker': None, 'print_headline': 'MARINE INTELLIGENCE.', 'name': None, 'seo': None, 'sub': None}",[],1855-12-01 05:00:00+00:00,article,,Archives,"{'original': '', 'person': [], 'organization': None}",Archives,nyt://article/636a03b1-6954-55e9-89dd-bf61e109f086,0,nyt://article/636a03b1-6954-55e9-89dd-bf61e109f086,
,https://www.nytimes.com/1855/12/01/archives/st-andrews-day.html,,,,1.0,The New York Times,[],"{'main': ""St. Andrew's Day."", 'kicker': '1', 'content_kicker': None, 'print_headline': ""St. Andrew's Day."", 'name': None, 'seo': None, 'sub': None}",[],1855-12-01 05:00:00+00:00,article,,Archives,"{'original': '', 'person': [], 'organization': None}",Archives,nyt://article/63e700db-e052-5486-bbd8-26e8d4434ac5,0,nyt://article/63e700db-e052-5486-bbd8-26e8d4434ac5,
"An injunction was put on the Grocesr Bank at 9 o'clock this morning. The other Banks refuse to take their bills. It is said there is an over-issue of bills by the Cashier, PLINY E. KINGMAN. The injunction is laid until Dec. 4.  ",https://www.nytimes.com/1855/12/01/archives/the-grocers-bank-of-boston.html,,,,4.0,The New York Times,[],"{'main': ""The Grocer's Bank of Boston."", 'kicker': '1', 'content_kicker': None, 'print_headline': ""The Grocer's Bank of Boston."", 'name': None, 'seo': None, 'sub': None}",[],1855-12-01 05:00:00+00:00,article,,Archives,"{'original': '', 'person': [], 'organization': None}",Archives,nyt://article/66fbee97-04a5-5bce-8253-0a521387eca9,0,nyt://article/66fbee97-04a5-5bce-8253-0a521387eca9,
"The weather is cold and clear. The thermometer at 6 o'clock this morning stood at 24?? above zero. Yesterday, a large number of boats were lying still between Herkimer and St. Johnsville. They were so close as nearly to touch each other for the whole distance.  ",https://www.nytimes.com/1855/12/01/archives/the-weather-and-the-canals.html,,,,4.0,The New York Times,[],"{'main': 'The Weather and the Canals.', 'kicker': '1', 'content_kicker': None, 'print_headline': 'The Weather and the Canals.', 'name': None, 'seo': None, 'sub': None}",[],1855-12-01 05:00:00+00:00,article,,Archives,"{'original': '', 'person': [], 'organization': None}",Archives,nyt://article/6766b927-8686-5dc2-bc55-bd9058a1ebb5,0,nyt://article/6766b927-8686-5dc2-bc55-bd9058a1ebb5,
"The Atlantic arrived late, last evening with a week's later European news, which, in a political point of view, is by no means important. A brief telegraphic dispatch, published in the London journals, announces that the Turks have gained another decisive victory over the Russians in Asia Minor.  ",https://www.nytimes.com/1855/12/01/archives/the-news-from-europe.html,,,,4.0,The New York Times,[],"{'main': 'The News from Europe.', 'kicker': '1', 'content_kicker': None, 'print_headline': 'The News from Europe.', 'name': None, 'seo': None, 'sub': None}",[],1855-12-01 05:00:00+00:00,article,,Archives,"{'original': '', 'person': [], 'organization': None}",Archives,nyt://article/70c59a9a-c232-54ed-8b97-524bc219658e,0,nyt://article/70c59a9a-c232-54ed-8b97-524bc219658e,
,https://www.nytimes.com/1855/12/01/archives/railroads.html,,,,7.0,The New York Times,[],"{'main': 'RAILROADS.', 'kicker': '1', 'content_kicker': None, 'print_headline': 'RAILROADS.', 'name': None, 'seo': None, 'sub': None}",[],1855-12-01 05:00:00+00:00,article,,Archives,"{'original': '', 'person': [], 'organization': None}",Archives,nyt://article/78848256-9255-57a0-8d2a-dc12bf618246,0,nyt://article/78848256-9255-57a0-8d2a-dc12bf618246,
"The Board of Canvassers reassembled yesterday morning at 11 o'clock, the President in the Chair. Fifteen Supervisors were present, and a large lobby in attendance. Supervisor VARIAN, of the Twenty-first Ward, read the returns of his Ward.  ",https://www.nytimes.com/1855/12/01/archives/board-of-county-canvassers-seventeenth-day.html,,,,3.0,The New York Times,[],"{'main': 'Board of County Canvassers.; SEVENTEENTH DAY.', 'kicker': '1', 'content_kicker': None, 'print_headline': 'Board of County Canvassers.; SEVENTEENTH DAY.', 'name': None, 'seo': None, 'sub': None}",[],1855-12-01 05:00:00+00:00,article,,Archives,"{'original': '', 'person': [], 'organization': None}",Archives,nyt://article/79c8aaab-a71d-58bf-8f04-2e5eb5149414,0,nyt://article/79c8aaab-a71d-58bf-8f04-2e5eb5149414,
Revolutionary movement in favour of Vivanco,https://www.nytimes.com/1855/12/01/archives/the-news-by-the-george-law.html,Revolutionary movement in favour of Vivanco,,,4.0,The New York Times,[],"{'main': 'The News by the George Law.', 'kicker': None, 'content_kicker': None, 'print_headline': 'The News by the George Law.', 'name': None, 'seo': None, 'sub': None}","[{'name': 'glocations', 'value': 'Peru', 'rank': 1, 'major': 'N'}]",1855-12-01 05:00:00+00:00,article,,Archives,"{'original': '', 'person': [], 'organization': None}",Archives,nyt://article/79fa15d5-4712-5f4e-ad2c-6bd4af7503d1,0,nyt://article/79fa15d5-4712-5f4e-ad2c-6bd4af7503d1,
,https://www.nytimes.com/1855/12/01/archives/academy-of-music.html,,,,4.0,The New York Times,[],"{'main': 'Academy of Music.', 'kicker': '1', 'content_kicker': None, 'print_headline': 'Academy of Music.', 'name': None, 'seo': None, 'sub': None}",[],1855-12-01 05:00:00+00:00,article,,Archives,"{'original': '', 'person': [], 'organization': None}",Archives,nyt://article/7c3e9829-dc79-588b-aedc-4a2927aa5a1b,0,nyt://article/7c3e9829-dc79-588b-aedc-4a2927aa5a1b,
"Mr. P. LYNCH, in a note which we gave to the public a few days since, took occasion to remonstrate with us for ""turning into ridicule the efforts now being made by the Irish in America to rescue and redeem their beloved native land.""  ",https://www.nytimes.com/1855/12/01/archives/the-lrish-in-america.html,,,,4.0,The New York Times,[],"{'main': 'The lrish in America.', 'kicker': '1', 'content_kicker': None, 'print_headline': 'The lrish in America.', 'name': None, 'seo': None, 'sub': None}",[],1855-12-01 05:00:00+00:00,article,,Archives,"{'original': '', 'person': [], 'organization': None}",Archives,nyt://article/7deea88d-fdd3-5b31-873c-44f0cffe9791,0,nyt://article/7deea88d-fdd3-5b31-873c-44f0cffe9791,
"U. S . CIRCUIT COURT. The great ejectment case of Brown vs. Schoonmaker, was decided yesterday by Judges NELSON and Betts in this Court, in favor of the defendants, thus quieting the title to extensive parts of this City in and about Fifth-avenue.  ",https://www.nytimes.com/1855/12/01/archives/article-1-no-title.html,,,,3.0,The New York Times,[],"{'main': 'Article 1 -- No Title', 'kicker': '1', 'content_kicker': None, 'print_headline': 'Article 1 -- No Title', 'name': None, 'seo': None, 'sub': None}",[],1855-12-01 05:00:00+00:00,article,,Archives,"{'original': '', 'person': [], 'organization': None}",Archives,nyt://article/806c1e3a-a158-55aa-87ad-266ff31a24b9,0,nyt://article/806c1e3a-a158-55aa-87ad-266ff31a24b9,
"At an early hour yesterday the two sloops engaged for the purpose of raising the sunken schooner, the Eudore Imayen, took their stations, one on either side of the vessel. The day was remarkably propitions for the work in hand. Scarcely a ripple disturbed the surface of the water, and the air considering the season was mild and balmy.  ",https://www.nytimes.com/1855/12/01/archives/the-eudora-tragedyproceedings-yesterdaythe-wreck-partly-raised.html,,,,4.0,The New York Times,[],"{'main': 'The Eudora Tragedy--Proceedings Yesterday--The Wreck Partly Raised.', 'kicker': '1', 'content_kicker': None, 'print_headline': 'The Eudora Tragedy--Proceedings Yesterday--The Wreck Partly Raised.', 'name': None, 'seo': None, 'sub': None}",[],1855-12-01 05:00:00+00:00,article,,Archives,"{'original': '', 'person': [], 'organization': None}",Archives,nyt://article/831449b1-cbe0-5fcf-9df4-b8a5eedc3b0b,0,nyt://article/831449b1-cbe0-5fcf-9df4-b8a5eedc3b0b,
,https://www.nytimes.com/1855/12/01/archives/married.html,,,,8.0,The New York Times,[],"{'main': 'MARRIED.', 'kicker': '1', 'content_kicker': None, 'print_headline': 'MARRIED.', 'name': None, 'seo': None, 'sub': None}",[],1855-12-01 05:00:00+00:00,article,,Archives,"{'original': '', 'person': [], 'organization': None}",Archives,nyt://article/834ede3b-d16a-5b95-b6c9-33fe6db55e5c,0,nyt://article/834ede3b-d16a-5b95-b6c9-33fe6db55e5c,
"Though we Yankees are accused, by superficial and flippant Europeans, of being a nation of long-faced worshippers of the almighty dollar, possessed of neither a capacity for art, nor an appreciation of humor, yet we now and then contrive to get off a joke;  ",https://www.nytimes.com/1855/12/01/archives/a-new-engine-in-politics.html,,,,4.0,The New York Times,[],"{'main': 'A New Engine in Politics.', 'kicker': '1', 'content_kicker': None, 'print_headline': 'A New Engine in Politics.', 'name': None, 'seo': None, 'sub': None}",[],1855-12-01 05:00:00+00:00,article,,Archives,"{'original': '', 'person': [], 'organization': None}",Archives,nyt://article/86d45168-d50a-5e29-9a45-68835350ebf1,0,nyt://article/86d45168-d50a-5e29-9a45-68835350ebf1,
"The statement that Senate TRUMBULL, of Illinois, is here without any evidence of his election, is nature. Although Governor MATTESON refused the usual certificate of election, he has a certificate signed by the officers of both branches of the legislature and the President of the Joint Convention.  ",https://www.nytimes.com/1855/12/01/archives/latest-intelligence-antinebraska-confident-prospects-of-the.html,,,,4.0,The New York Times,[],"{'main': 'LATEST INTELLIGENCE; ANTI-NEBRASKA CONFIDENT. PROSPECTS OF THE ORGANIZATION. By Telegraph to the New-York Daily Times. IMPORTANT FROM WASHINGTON. The Reeall of the Nicarngua Minister. The Difficulty between England and Spain.', 'kicker': '1', 'content_kicker': None, 'print_headline': 'LATEST INTELLIGENCE; ANTI-NEBRASKA CONFIDENT. PROSPECTS OF THE ORGANIZATION. By Telegraph to the New-York Daily Times. IMPORTANT FROM WASHINGTON. The Reeall of the Nicarngua Minister. The Difficulty between England and Spain.', 'name': None, 'seo': None, 'sub': None}",[],1855-12-01 05:00:00+00:00,article,,Archives,"{'original': '', 'person': [], 'organization': None}",Archives,nyt://article/8801b717-7f83-54b0-af4a-745b1add6902,0,nyt://article/8801b717-7f83-54b0-af4a-745b1add6902,
Marcoleta recalled,https://www.nytimes.com/1855/12/01/archives/dismissal-of-the-nicaragua-ministerthe-steamfrigate.html,Marcoleta recalled,,,4.0,The New York Times,[],"{'main': 'Dismissal of the Nicaragua Minister--The Steam--frigate Mianesota--Illness of Senator Douglas.', 'kicker': None, 'content_kicker': None, 'print_headline': 'Dismissal of the Nicaragua Minister--The Steam--frigate Mianesota--Illness of Senator Douglas.', 'name': None, 'seo': None, 'sub': None}",[],1855-12-01 05:00:00+00:00,article,,Archives,"{'original': '', 'person': [], 'organization': None}",Archives,nyt://article/9238b245-9b88-541c-953c-3edb24771279,0,nyt://article/9238b245-9b88-541c-953c-3edb24771279,
"The U. S. Mail steamship George Law, Commander WM. LEWIS HERNDON, U. S. N., left Aspinwall at 10 o'clock on the evening of the 20th inst., and arrived at Quarantine at 10 o'clock on the evoning of the 29th, having experienced heavy northerly gales since passing Cuba.  ",https://www.nytimes.com/1855/12/01/archives/der-wm-lewis-herndon-usn-lo-news-from-the-south-pacific-further.html,,,,2.0,The New York Times,[],"{'main': '?der WM. LEWIS HERNDON, U.S.N., lo?; NEWS FROM THE SOUTH PACIFIC. Further Detatls of the Indian War in Oregon. AFFAIRS ON THE ISTHMUS. $1,939,592 in Freight from California.', 'kicker': '1', 'content_kicker': None, 'print_headline': '?der WM. LEWIS HERNDON, U.S.N., lo?; NEWS FROM THE SOUTH PACIFIC. Further Detatls of the Indian War in Oregon. AFFAIRS ON THE ISTHMUS. $1,939,592 in Freight from California.', 'name': None, 'seo': None, 'sub': None}",[],1855-12-01 05:00:00+00:00,article,,Archives,"{'original': '', 'person': [], 'organization': None}",Archives,nyt://article/9501cc6e-d3c3-56fc-a3fe-a3aa5b17d890,0,nyt://article/9501cc6e-d3c3-56fc-a3fe-a3aa5b17d890,
Award of Premiums,https://www.nytimes.com/1855/12/01/archives/one-week-later-from-europe-denmark-and-the-sound-dues-the-american.html,Award of Premiums,,,1.0,The New York Times,[],"{'main': ""ONE WEEK LATER FROM EUROPE.; DENMARK AND THE SOUND DUES. THE AMERICAN DIFFICULTY. Breadstuffs Slightly Improved - Cotton Market Quiet. INTERESTING FROM ITALY AND SPAIN. General Canrobert's Reception At Stockholm. CONSOLS 87 7 - 8 to 88. OPENING OF THE BELGIAN CHAMBERS. ARRIVAL OF THE ATLANTIC. ANOTHER TURKISH VICTORY IN ASIA. NO CRIMEAN NEWS. Closing of the Paris Exposition. THE EMPEROR'S SPEECH."", 'kicker': None, 'content_kicker': None, 'print_headline': ""ONE WEEK LATER FROM EUROPE.; DENMARK AND THE SOUND DUES. THE AMERICAN DIFFICULTY. Breadstuffs Slightly Improved - Cotton Market Quiet. INTERESTING FROM ITALY AND SPAIN. General Canrobert's Reception At Stockholm. CONSOLS 87 7 - 8 to 88. OPENING OF THE BELGIAN CHAMBERS. ARRIVAL OF THE ATLANTIC. ANOTHER TURKISH VICTORY IN ASIA. NO CRIMEAN NEWS. Closing of the Paris Exposition. THE EMPEROR'S SPEECH."", 'name': None, 'seo': None, 'sub': None}",[],1855-12-01 05:00:00+00:00,article,,Archives,"{'original': '', 'person': [], 'organization': None}",Archives,nyt://article/a3322237-ce4a-5566-bbaa-cdaec6844cb6,0,nyt://article/a3322237-ce4a-5566-bbaa-cdaec6844cb6,
"The following list consists of prominent Houses in each the of Business: DRY GOODS. American and Foreign Silks. BOWEN, McNAMRE  CO., (Imp.  Job.) 112 Broadway. Berlin Wool, Embroidery Silks, Fringes, Gimps, Buttons, Ladies' Dress Trimmings, Gold and Silver Articles for Regalia.  ",https://www.nytimes.com/1855/12/01/archives/newyork-city-business-directory.html,,,,3.0,The New York Times,[],"{'main': 'NEW-YORK CITY BUSINESS DIRECTORY.', 'kicker': '1', 'content_kicker': None, 'print_headline': 'NEW-YORK CITY BUSINESS DIRECTORY.', 'name': None, 'seo': None, 'sub': None}",[],1855-12-01 05:00:00+00:00,article,,Archives,"{'original': '', 'person': [], 'organization': None}",Archives,nyt://article/aa8dbdda-c930-5d20-b888-95d520ecfd05,0,nyt://article/aa8dbdda-c930-5d20-b888-95d520ecfd05,
,https://www.nytimes.com/1855/12/01/archives/insurance.html,,,,6.0,The New York Times,[],"{'main': 'INSURANCE.', 'kicker': '1', 'content_kicker': None, 'print_headline': 'INSURANCE.', 'name': None, 'seo': None, 'sub': None}",[],1855-12-01 05:00:00+00:00,article,,Archives,"{'original': '', 'person': [], 'organization': None}",Archives,nyt://article/b3b8c7df-d889-5973-9c45-43d1acf41846,0,nyt://article/b3b8c7df-d889-5973-9c45-43d1acf41846,
"We have accounts from Independence to-day, stating that the armed Free-States men had attempted to drive Mr. COLEMAN, a Pro-Slavery settler. from his claim, near Hickory Point. Mr. COLEMAN killed one of his assailants, when a mob gathered together, drove him and other settlers off, and then burned down their houses.  ",https://www.nytimes.com/1855/12/01/archives/troubles-in-kansas-between-the-free-states-and-proslavery.html,,,,4.0,The New York Times,[],"{'main': 'Troubles in Kansas between the Free States and Pro-Slavery Settlers--The Military called out.', 'kicker': '1', 'content_kicker': None, 'print_headline': 'Troubles in Kansas between the Free States and Pro-Slavery Settlers--The Military called out.', 'name': None, 'seo': None, 'sub': None}",[],1855-12-01 05:00:00+00:00,article,,Archives,"{'original': '', 'person': [], 'organization': None}",Archives,nyt://article/b40970df-c391-50ba-aab4-fa9d2b6f3982,0,nyt://article/b40970df-c391-50ba-aab4-fa9d2b6f3982,
,https://www.nytimes.com/1855/12/01/archives/fire-at-east-haddam-conn.html,,,,4.0,The New York Times,[],"{'main': 'Fire at East Haddam, Conn.', 'kicker': '1', 'content_kicker': None, 'print_headline': 'Fire at East Haddam, Conn.', 'name': None, 'seo': None, 'sub': None}",[],1855-12-01 05:00:00+00:00,article,,Archives,"{'original': '', 'person': [], 'organization': None}",Archives,nyt://article/b44c4fff-45d4-53b4-8637-1991045c8b77,0,nyt://article/b44c4fff-45d4-53b4-8637-1991045c8b77,
