abstract,web_url,snippet,lead_paragraph,print_section,print_page,source,multimedia,headline,keywords,pub_date,document_type,news_desk,section_name,byline,type_of_material,_id,word_count,uri,subsection_name
Disagreement of the Jury,https://www.nytimes.com/1855/12/15/archives/the-baker-trial-the-jury-discharged.html,Disagreement of the Jury,,,1.0,The New York Times,[],"{'main': 'THE BAKER TRIAL.; THE JURY DISCHARGED.', 'kicker': None, 'content_kicker': None, 'print_headline': 'THE BAKER TRIAL.; THE JURY DISCHARGED.', 'name': None, 'seo': None, 'sub': None}",[],1855-12-15 05:00:00+00:00,article,,Archives,"{'original': '', 'person': [], 'organization': None}",Archives,nyt://article/9a96a0ae-a87a-55c4-9b3e-d57552d21b25,0,nyt://article/9a96a0ae-a87a-55c4-9b3e-d57552d21b25,
,https://www.nytimes.com/1855/12/15/archives/special-notices.html,,,,5.0,The New York Times,[],"{'main': 'SPECIAL NOTICES.', 'kicker': '1', 'content_kicker': None, 'print_headline': 'SPECIAL NOTICES.', 'name': None, 'seo': None, 'sub': None}",[],1855-12-15 05:00:00+00:00,article,,Archives,"{'original': '', 'person': [], 'organization': None}",Archives,nyt://article/9cf696fa-179d-50f3-becb-f4af25bb058a,0,nyt://article/9cf696fa-179d-50f3-becb-f4af25bb058a,
,https://www.nytimes.com/1855/12/15/archives/financial.html,,,,6.0,The New York Times,[],"{'main': 'FINANCIAL.', 'kicker': '1', 'content_kicker': None, 'print_headline': 'FINANCIAL.', 'name': None, 'seo': None, 'sub': None}",[],1855-12-15 05:00:00+00:00,article,,Archives,"{'original': '', 'person': [], 'organization': None}",Archives,nyt://article/9d4eeb33-e0c4-598b-9230-ec2286ac9a9c,0,nyt://article/9d4eeb33-e0c4-598b-9230-ec2286ac9a9c,
"WILLIAM S. TRUCKERMAN, late Treasurer of the Eastern Railroad Company, was arraigned in the Municipal Court this morning, charged with embezzling seventy shares of the stock of said load, and transferring the same to the Roxbury Savings Institution.  ",https://www.nytimes.com/1855/12/15/archives/arrest-for-embezzlement-of-railroad-stock.html,,,,1.0,The New York Times,[],"{'main': 'Arrest for Embezzlement of Railroad Stock.', 'kicker': '1', 'content_kicker': None, 'print_headline': 'Arrest for Embezzlement of Railroad Stock.', 'name': None, 'seo': None, 'sub': None}",[],1855-12-15 05:00:00+00:00,article,,Archives,"{'original': '', 'person': [], 'organization': None}",Archives,nyt://article/ad9ffb7c-f8e3-5ee0-b076-487fcfd72876,0,nyt://article/ad9ffb7c-f8e3-5ee0-b076-487fcfd72876,
,https://www.nytimes.com/1855/12/15/archives/marine-intelligence-cleared-arrived-memoranda-spoken-c-foreign.html,,,,8.0,The New York Times,[],"{'main': 'MARINE INTELLIGENCE.; Cleared. Arrived. Memoranda. Spoken, &c. Foreign Ports.', 'kicker': '1', 'content_kicker': None, 'print_headline': 'MARINE INTELLIGENCE.; Cleared. Arrived. Memoranda. Spoken, &c. Foreign Ports.', 'name': None, 'seo': None, 'sub': None}",[],1855-12-15 05:00:00+00:00,article,,Archives,"{'original': '', 'person': [], 'organization': None}",Archives,nyt://article/af44f69f-bf5c-5679-9e8e-d4a6b7b48483,0,nyt://article/af44f69f-bf5c-5679-9e8e-d4a6b7b48483,
Defends his pardon of Mich. Cavanagh,https://www.nytimes.com/1855/12/15/archives/letter-from-gov-clark-concerning-the-pardon-of-michael-cavanagh.html,Defends his pardon of Mich. Cavanagh,,,1.0,The New York Times,[],"{'main': 'Letter from Gov. Clark Concerning the Pardon of Michael Cavanagh.', 'kicker': None, 'content_kicker': None, 'print_headline': 'Letter from Gov. Clark Concerning the Pardon of Michael Cavanagh.', 'name': None, 'seo': None, 'sub': None}",[],1855-12-15 05:00:00+00:00,article,,Archives,"{'original': '', 'person': [], 'organization': None}",Archives,nyt://article/b54af7c7-bec0-51ab-af3c-7df2efa4595c,0,nyt://article/b54af7c7-bec0-51ab-af3c-7df2efa4595c,
"A suit was brought on in Jersey City on Thursday, before Justice GARDNER, against the New-York and Erie Railroad Company, by LEWIS BARNUM, of Jersey City, for an overcoat which was stolen from his seat in the cars on that road.  ",https://www.nytimes.com/1855/12/15/archives/newjersey-they-must-pay-for-our-overcoats.html,,,,2.0,The New York Times,[],"{'main': 'NEW-JERSEY.; They Must Pay for Our Overcoats.', 'kicker': '1', 'content_kicker': None, 'print_headline': 'NEW-JERSEY.; They Must Pay for Our Overcoats.', 'name': None, 'seo': None, 'sub': None}",[],1855-12-15 05:00:00+00:00,article,,Archives,"{'original': '', 'person': [], 'organization': None}",Archives,nyt://article/bd0bbb9b-04a2-5183-9f8c-6319c1f4e95b,0,nyt://article/bd0bbb9b-04a2-5183-9f8c-6319c1f4e95b,
"HARBOR, RIVER AND LAKE IMPROVEMENTS. Mr. SEWARD, Mr. FESSENDEN, and Mr. STUART severally gave notice of their intention to introduce bills for Harbor, River and Lake Improvements. Adjourned till Monday.  ",https://www.nytimes.com/1855/12/15/archives/xxxivth-congressfirst-session-senate.html,,,,1.0,The New York Times,[],"{'main': 'XXXIVth CONGRESS----First Session.; SENATE....', 'kicker': '1', 'content_kicker': None, 'print_headline': 'XXXIVth CONGRESS----First Session.; SENATE....', 'name': None, 'seo': None, 'sub': None}",[],1855-12-15 05:00:00+00:00,article,,Archives,"{'original': '', 'person': [], 'organization': None}",Archives,nyt://article/cdff18bb-f07b-5f04-995f-6bb21cead007,0,nyt://article/cdff18bb-f07b-5f04-995f-6bb21cead007,
"The particulars of another fraud upon the public of this City, in the shape of a bogus company for granting insurance policies against loss or damage by fire, have been made out by the Special Commissioner of the State Comptroller's Department.  ",https://www.nytimes.com/1855/12/15/archives/look-to-your-fire-policies.html,,,,4.0,The New York Times,[],"{'main': 'Look to Your Fire Policies!', 'kicker': '1', 'content_kicker': None, 'print_headline': 'Look to Your Fire Policies!', 'name': None, 'seo': None, 'sub': None}",[],1855-12-15 05:00:00+00:00,article,,Archives,"{'original': '', 'person': [], 'organization': None}",Archives,nyt://article/ce842a9c-a204-5a84-8774-4baeed67c92c,0,nyt://article/ce842a9c-a204-5a84-8774-4baeed67c92c,
"The Amoskeag Veterans arrived here this afternoon, and were received by a military escort, and marched to Independence square. The guests there stacked arms and marched into the Hall. Colonel POTTER was introduced by Mayor FRITZ to Mayor CONRAD, who welcomed the Veterans to the Hall and to the City.  ",https://www.nytimes.com/1855/12/15/archives/the-amoskeag-veterans-at-philadelphia.html,,,,1.0,The New York Times,[],"{'main': 'The Amoskeag Veterans at Philadelphia.', 'kicker': '1', 'content_kicker': None, 'print_headline': 'The Amoskeag Veterans at Philadelphia.', 'name': None, 'seo': None, 'sub': None}",[],1855-12-15 05:00:00+00:00,article,,Archives,"{'original': '', 'person': [], 'organization': None}",Archives,nyt://article/d151ed13-3ed6-5a0b-8b78-18b1ad8a43f0,0,nyt://article/d151ed13-3ed6-5a0b-8b78-18b1ad8a43f0,
"ONE THOUSAND DOLLARS REWARD.--The above reward is offered for the apprechsion of DAVID BURNAS, who was confined in the jail McDonough county Illionis, for the murder of JAMES DYE, Sr., and who made his escape on the night of the 9th ult. He is desribed as five feet ten inches high, broad shouldered, weighing 175 pounds;  ",https://www.nytimes.com/1855/12/15/archives/article-3-no-title.html,,,,3.0,The New York Times,[],"{'main': 'Article 3 -- No Title', 'kicker': '1', 'content_kicker': None, 'print_headline': 'Article 3 -- No Title', 'name': None, 'seo': None, 'sub': None}",[],1855-12-15 05:00:00+00:00,article,,Archives,"{'original': '', 'person': [], 'organization': None}",Archives,nyt://article/d746fe8b-e75c-5b6c-adad-02e483e8f7da,0,nyt://article/d746fe8b-e75c-5b6c-adad-02e483e8f7da,
An account of,https://www.nytimes.com/1855/12/15/archives/col-parker-h-french.html,An account of,,,4.0,The New York Times,[],"{'main': 'Col. Parker H. French.', 'kicker': None, 'content_kicker': None, 'print_headline': 'Col. Parker H. French.', 'name': None, 'seo': None, 'sub': None}",[],1855-12-15 05:00:00+00:00,article,,Archives,"{'original': '', 'person': [], 'organization': None}",Archives,nyt://article/d751f407-c181-522c-b8d3-c85e1539d96b,0,nyt://article/d751f407-c181-522c-b8d3-c85e1539d96b,
Letter on Irish Emigrant aid Society,https://www.nytimes.com/1855/12/15/archives/letter-from-robert-tyler-president-of-the-astor-house-irish.html,Letter on Irish Emigrant aid Society,,,2.0,The New York Times,[],"{'main': 'Letter from Robert Tyler, President of the Astor House Irish Convention.; From the Philadelphia Argus.', 'kicker': None, 'content_kicker': None, 'print_headline': 'Letter from Robert Tyler, President of the Astor House Irish Convention.; From the Philadelphia Argus.', 'name': None, 'seo': None, 'sub': None}",[],1855-12-15 05:00:00+00:00,article,,Archives,"{'original': '', 'person': [], 'organization': None}",Archives,nyt://article/d885fbb8-943c-56ac-a8b3-8fe8c3893072,0,nyt://article/d885fbb8-943c-56ac-a8b3-8fe8c3893072,
"We hear of no new cases of prosecution for malpractice within the last twenty-four hours. Mean while the wiser surgeons, before undertaking a job, require assurances that if Providence should not smile upon their efforts, they shall not be held under legal obligations to pay a couple of thousand dollars to soothe the feelings of the surviving parties.  ",https://www.nytimes.com/1855/12/15/archives/malpractice.html,,,,4.0,The New York Times,[],"{'main': 'Malpractice.', 'kicker': '1', 'content_kicker': None, 'print_headline': 'Malpractice.', 'name': None, 'seo': None, 'sub': None}",[],1855-12-15 05:00:00+00:00,article,,Archives,"{'original': '', 'person': [], 'organization': None}",Archives,nyt://article/dcbf6082-1072-56ad-8091-d8b0364d654b,0,nyt://article/dcbf6082-1072-56ad-8091-d8b0364d654b,
,https://www.nytimes.com/1855/12/15/archives/accident-on-the-newjersey-central-railroad.html,,,,1.0,The New York Times,[],"{'main': 'Accident on the New-Jersey Central Railroad.', 'kicker': '1', 'content_kicker': None, 'print_headline': 'Accident on the New-Jersey Central Railroad.', 'name': None, 'seo': None, 'sub': None}",[],1855-12-15 05:00:00+00:00,article,,Archives,"{'original': '', 'person': [], 'organization': None}",Archives,nyt://article/f0e3ecac-4355-501e-9c53-2358ca39d0d5,0,nyt://article/f0e3ecac-4355-501e-9c53-2358ca39d0d5,
Reappears in New York,https://www.nytimes.com/1855/12/15/archives/academy-of-music-gotischalk-items.html,Reappears in New York,,,4.0,The New York Times,[],"{'main': 'Academy of Music.; Gotischalk. Items.', 'kicker': None, 'content_kicker': None, 'print_headline': 'Academy of Music.; Gotischalk. Items.', 'name': None, 'seo': None, 'sub': None}",[],1855-12-15 05:00:00+00:00,article,,Archives,"{'original': '', 'person': [], 'organization': None}",Archives,nyt://article/f13bdc20-7d70-5837-8a8d-f2e8ced056ac,0,nyt://article/f13bdc20-7d70-5837-8a8d-f2e8ced056ac,
,https://www.nytimes.com/1855/12/15/archives/newjersey-three-days-thanksgiving.html,,,,8.0,The New York Times,[],"{'main': ""NEW-JERSEY.; Three Days' Thanksgiving."", 'kicker': '1', 'content_kicker': None, 'print_headline': ""NEW-JERSEY.; Three Days' Thanksgiving."", 'name': None, 'seo': None, 'sub': None}",[],1855-12-15 05:00:00+00:00,article,,Archives,"{'original': '', 'person': [], 'organization': None}",Archives,nyt://article/f597762e-1c1b-517a-b688-c622f86eb10a,0,nyt://article/f597762e-1c1b-517a-b688-c622f86eb10a,
"Next Saturday night, citizens who feel sufficient indignation at the snail's pace at which the Thirdavenue cars crawl up town and down, will meet and blow it off. Really though, the Company ought to turn out the Rips Van Winkle of the Board, or give more oats to their "" rack-a-bone"" steeds. Often a man may leave the Park at 5 1/2 P. M., and reach the Astoria boats not before 7 P. M.  ",https://www.nytimes.com/1855/12/15/archives/newyork-city-putting-hot-coals-on-the-snails-backs-suicide-in.html,,,,8.0,The New York Times,[],"{'main': ""NEW-YORK CITY.; Putting Hot Coals on the Snails' Backs. Suicide in Prison. Board of Councilmen. Fires. Alcoholic Drinks, in and of themselves, do not produce Consumption, but on the contrary prevent the formation and deposit of Tubercles in the Langs. To all who use Liquor--Wolfe's Schicdam Aromatic Schnapps."", 'kicker': '1', 'content_kicker': None, 'print_headline': ""NEW-YORK CITY.; Putting Hot Coals on the Snails' Backs. Suicide in Prison. Board of Councilmen. Fires. Alcoholic Drinks, in and of themselves, do not produce Consumption, but on the contrary prevent the formation and deposit of Tubercles in the Langs. To all who use Liquor--Wolfe's Schicdam Aromatic Schnapps."", 'name': None, 'seo': None, 'sub': None}",[],1855-12-15 05:00:00+00:00,article,,Archives,"{'original': '', 'person': [], 'organization': None}",Archives,nyt://article/fddcd3c0-7e27-572f-8e0e-f18ddea69de2,0,nyt://article/fddcd3c0-7e27-572f-8e0e-f18ddea69de2,
"Thursday--No. 18--Wm. H. Goles et al. vs. Thos. M. League. Argument continued by Mr. Hughes for defendant, and concluded by Mr. Fale for plaintiff. No. 16--Isaac R. Smith, Owner of sloop Velant vs. The State of Maryland. Argued by Mr. Latrobe for plaintiff, and by J. Wilson Campbell, Esq., for defendant.  ",https://www.nytimes.com/1855/12/15/archives/unites-states-supreme-court.html,,,,1.0,The New York Times,[],"{'main': 'Unites States Supreme Court.', 'kicker': '1', 'content_kicker': None, 'print_headline': 'Unites States Supreme Court.', 'name': None, 'seo': None, 'sub': None}",[],1855-12-15 05:00:00+00:00,article,,Archives,"{'original': '', 'person': [], 'organization': None}",Archives,nyt://article/fe44add7-7c6d-5f9e-85c6-8a68dc16f65d,0,nyt://article/fe44add7-7c6d-5f9e-85c6-8a68dc16f65d,
,https://www.nytimes.com/1855/12/17/archives/from-washington-affairs-of-central-america-and-mexico-parker-w.html,,,,2.0,The New York Times,[],"{'main': 'FROM WASHINGTON.; Affairs of Central America and Mexico. Parker W. French--Senator Fish--Anecdotes, &c.', 'kicker': '1', 'content_kicker': None, 'print_headline': 'FROM WASHINGTON.; Affairs of Central America and Mexico. Parker W. French--Senator Fish--Anecdotes, &c.', 'name': None, 'seo': None, 'sub': None}",[],1855-12-17 05:00:00+00:00,article,,Archives,"{'original': 'Special Correspondence of the N. Y. Daily Times', 'person': [{'firstname': '', 'middlename': None, 'lastname': '', 'qualifier': None, 'title': None, 'role': 'reported', 'organization': '', 'rank': 1}], 'organization': None}",Archives,nyt://article/022afb3a-0936-5027-8056-8c0a0c4339ef,0,nyt://article/022afb3a-0936-5027-8056-8c0a0c4339ef,
,https://www.nytimes.com/1855/12/17/archives/article-1-no-title.html,,,,4.0,The New York Times,[],"{'main': 'Article 1 -- No Title', 'kicker': '1', 'content_kicker': None, 'print_headline': 'Article 1 -- No Title', 'name': None, 'seo': None, 'sub': None}",[],1855-12-17 05:00:00+00:00,article,,Archives,"{'original': '', 'person': [], 'organization': None}",Archives,nyt://article/06b2778e-06ce-5821-9cd8-36a1c02b90b9,0,nyt://article/06b2778e-06ce-5821-9cd8-36a1c02b90b9,
,https://www.nytimes.com/1855/12/17/archives/insurance.html,,,,6.0,The New York Times,[],"{'main': 'INSURANCE.', 'kicker': '1', 'content_kicker': None, 'print_headline': 'INSURANCE.', 'name': None, 'seo': None, 'sub': None}",[],1855-12-17 05:00:00+00:00,article,,Archives,"{'original': '', 'person': [], 'organization': None}",Archives,nyt://article/09919f3c-2672-5944-8f37-0ac85211a3d8,0,nyt://article/09919f3c-2672-5944-8f37-0ac85211a3d8,
"COURT CALENDAR-MONDAY. UNITED STATES DISTRICT COURT.-Same before. SUPREME COURT-Special Term-Nos. 171, 32, 154, 66, 98, 114, 199, 16, 43, 84, 96, 115, 122, 127, 44, 45,  ",https://www.nytimes.com/1855/12/17/archives/law-intelligence-court-calendar-united-states-district-court-united.html,,,,3.0,The New York Times,[],"{'main': 'LAW INTELLIGENCE.; COURT CALENDAR UNITED STATES DISTRICT COURT. UNITED STATES DISTRICT COURT. SUPERIOR COURT SUPERIOR COURT. SUPERIOR COURT. Important to Mortgagers. COURT OF COMMON PLEAS. COURT OF GENERAL SESSIONS. FIRST DISTRICT COURT.', 'kicker': '1', 'content_kicker': None, 'print_headline': 'LAW INTELLIGENCE.; COURT CALENDAR UNITED STATES DISTRICT COURT. UNITED STATES DISTRICT COURT. SUPERIOR COURT SUPERIOR COURT. SUPERIOR COURT. Important to Mortgagers. COURT OF COMMON PLEAS. COURT OF GENERAL SESSIONS. FIRST DISTRICT COURT.', 'name': None, 'seo': None, 'sub': None}",[],1855-12-17 05:00:00+00:00,article,,Archives,"{'original': '', 'person': [], 'organization': None}",Archives,nyt://article/0c7b23b1-4cca-5153-abd5-5b9a321c3e95,0,nyt://article/0c7b23b1-4cca-5153-abd5-5b9a321c3e95,
Details of news,https://www.nytimes.com/1855/12/17/archives/south-america-news-from-buenos-ayres-frightful-massacre-by.html,Details of news,,,1.0,The New York Times,[],"{'main': 'SOUTH AMERICA.; News from Buenos Ayres -- Frightful Massacre by Indians--Valuable Discovery by the Commander of the ""Water Witch"" -- Affairs at Montevideo-News from Rio do Janeiro-Business.', 'kicker': None, 'content_kicker': None, 'print_headline': 'SOUTH AMERICA.; News from Buenos Ayres -- Frightful Massacre by Indians--Valuable Discovery by the Commander of the ""Water Witch"" -- Affairs at Montevideo-News from Rio do Janeiro-Business.', 'name': None, 'seo': None, 'sub': None}",[],1855-12-17 05:00:00+00:00,article,,Archives,"{'original': 'Special Correspondence of the N. Y. Daily Times', 'person': [{'firstname': '', 'middlename': None, 'lastname': '', 'qualifier': None, 'title': None, 'role': 'reported', 'organization': '', 'rank': 1}], 'organization': None}",Archives,nyt://article/0ddd794e-f5e7-5e81-bef1-e284cf6f9b88,0,nyt://article/0ddd794e-f5e7-5e81-bef1-e284cf6f9b88,
"Mr. STEVENS' ""great iron steam battery, both shot and shell proof,"" for which Congress has appropriated some $800,000, gets along slowly. To work in quietness at it, says the U. S. Nautical Magazine: ""An excavated dry dock was built on the grounds of Mr. STEVENS, Hoboken, extending from the cofferdam at the margin of the river, to nearly the middle, and beneath one of the principal streets;  ",https://www.nytimes.com/1855/12/17/archives/mr-steveus-battery.html,,,,4.0,The New York Times,[],"{'main': ""Mr. Steveus' Battery."", 'kicker': '1', 'content_kicker': None, 'print_headline': ""Mr. Steveus' Battery."", 'name': None, 'seo': None, 'sub': None}",[],1855-12-17 05:00:00+00:00,article,,Archives,"{'original': '', 'person': [], 'organization': None}",Archives,nyt://article/13c60f20-e527-57e9-9a68-fe1e5977f471,0,nyt://article/13c60f20-e527-57e9-9a68-fe1e5977f471,
"Capt. HAMPTON, of the brig Abby Taylor, arrived on Saturday from Aspinwall, reports: Died at Sea, Nov. 20, BERNARD DAILY, of Providence, R. I. Also, Nov. 24, JOHN FLANNIGAN, of Charlestown, Mass., both of the above. The men were taken on board for charity sake, and were very sick and destitute of everything. Eastern papers are requested to copy. The friends wishing any further information,  ",https://www.nytimes.com/1855/12/17/archives/sickness-and-death-at-sen.html,,,,2.0,The New York Times,[],"{'main': 'Sickness and Death at Sen.', 'kicker': '1', 'content_kicker': None, 'print_headline': 'Sickness and Death at Sen.', 'name': None, 'seo': None, 'sub': None}",[],1855-12-17 05:00:00+00:00,article,,Archives,"{'original': '', 'person': [], 'organization': None}",Archives,nyt://article/143c21a8-2eed-5070-90c4-b54a811c4452,0,nyt://article/143c21a8-2eed-5070-90c4-b54a811c4452,
"A Stunner to the Office-Seekers at Home. The Atlas insists that the Heads of Departments can't suit themselves with clerks and assistants quite as extensively as had been supposed. The old ones, it holds, can only be removed by a concurrent resolution of both Boards of the Common Council, or the consent of the Mayor. Here is the law it quotes--from the 20th section of the Charter:  ",https://www.nytimes.com/1855/12/17/archives/newyork-city-a-stunner-to-the-officeseekers-at-home-to-all-who-use.html,,,,8.0,The New York Times,[],"{'main': ""NEW-YORK CITY.; A Stunner to the Office-Seekers at Home. To all who use Liqour--Wolfe's Schiedam Aromatic Schnapps. CAUTION TO THE PUBLIC. CAUTION TO PERSONS SCHIEDAM AROMATIC SCHNAPPS."", 'kicker': '1', 'content_kicker': None, 'print_headline': ""NEW-YORK CITY.; A Stunner to the Office-Seekers at Home. To all who use Liqour--Wolfe's Schiedam Aromatic Schnapps. CAUTION TO THE PUBLIC. CAUTION TO PERSONS SCHIEDAM AROMATIC SCHNAPPS."", 'name': None, 'seo': None, 'sub': None}",[],1855-12-17 05:00:00+00:00,article,,Archives,"{'original': '', 'person': [], 'organization': None}",Archives,nyt://article/1d897d00-fe52-54a3-b192-777cb8518a4e,0,nyt://article/1d897d00-fe52-54a3-b192-777cb8518a4e,
,https://www.nytimes.com/1855/12/17/archives/the-official-state-canvass.html,,,,4.0,The New York Times,[],"{'main': 'The Official State Canvass.', 'kicker': '1', 'content_kicker': None, 'print_headline': 'The Official State Canvass.', 'name': None, 'seo': None, 'sub': None}",[],1855-12-17 05:00:00+00:00,article,,Archives,"{'original': '', 'person': [], 'organization': None}",Archives,nyt://article/201333b2-90d5-5ba9-8a48-5465e49f35ea,0,nyt://article/201333b2-90d5-5ba9-8a48-5465e49f35ea,
,https://www.nytimes.com/1855/12/17/archives/from-kansas.html,,,,4.0,The New York Times,[],"{'main': 'From Kansas.', 'kicker': '1', 'content_kicker': None, 'print_headline': 'From Kansas.', 'name': None, 'seo': None, 'sub': None}",[],1855-12-17 05:00:00+00:00,article,,Archives,"{'original': '', 'person': [], 'organization': None}",Archives,nyt://article/252e9d52-b453-5a23-80ae-34f3b10c39a7,0,nyt://article/252e9d52-b453-5a23-80ae-34f3b10c39a7,
,https://www.nytimes.com/1855/12/17/archives/special-notices.html,,,,5.0,The New York Times,[],"{'main': 'SPECIAL NOTICES.', 'kicker': '1', 'content_kicker': None, 'print_headline': 'SPECIAL NOTICES.', 'name': None, 'seo': None, 'sub': None}",[],1855-12-17 05:00:00+00:00,article,,Archives,"{'original': '', 'person': [], 'organization': None}",Archives,nyt://article/35014a85-5c91-5493-a7e6-576d787e3aab,0,nyt://article/35014a85-5c91-5493-a7e6-576d787e3aab,
"Robbery of $50,000 in gold arrest of Parties",https://www.nytimes.com/1855/12/17/archives/the-american-express-robberyarrest-of-the-supposed-guilty-parties.html,"Robbery of $50,000 in gold arrest of Parties",,,1.0,The New York Times,[],"{'main': 'The American Express Robbery--Arrest of the Supposed Guilty Parties.', 'kicker': None, 'content_kicker': None, 'print_headline': 'The American Express Robbery--Arrest of the Supposed Guilty Parties.', 'name': None, 'seo': None, 'sub': None}",[],1855-12-17 05:00:00+00:00,article,,Archives,"{'original': '', 'person': [], 'organization': None}",Archives,nyt://article/355f7169-27d8-517f-8428-94de9b7ff44a,0,nyt://article/355f7169-27d8-517f-8428-94de9b7ff44a,
,https://www.nytimes.com/1855/12/17/archives/prospects-of-the-election-of-speaker.html,,,,1.0,The New York Times,[],"{'main': 'Prospects of the Election of Speaker..', 'kicker': '1', 'content_kicker': None, 'print_headline': 'Prospects of the Election of Speaker..', 'name': None, 'seo': None, 'sub': None}",[],1855-12-17 05:00:00+00:00,article,,Archives,"{'original': '', 'person': [], 'organization': None}",Archives,nyt://article/4579e518-63cd-50cd-b5cb-b2e2bc238355,0,nyt://article/4579e518-63cd-50cd-b5cb-b2e2bc238355,
"PARKER H. FRENCH is expected here to-morrow. His rejection will be placed chiefly on the ground that the Government he seeks to represent is merely a Military Government, which has not been recognized by any civilized power.  ",https://www.nytimes.com/1855/12/17/archives/latest-intelligence-by-telegraph-to-the-newyork-daily-times-from.html,,,,1.0,The New York Times,[],"{'main': 'LATEST INTELLIGENCE; By Telegraph to the New-York Daily Times. FROM WASHINGTON. The Rejection of Parker H. French. THE DUTY ON RAILROAD IRON, Nothing New in Relation to the Speakership.', 'kicker': '1', 'content_kicker': None, 'print_headline': 'LATEST INTELLIGENCE; By Telegraph to the New-York Daily Times. FROM WASHINGTON. The Rejection of Parker H. French. THE DUTY ON RAILROAD IRON, Nothing New in Relation to the Speakership.', 'name': None, 'seo': None, 'sub': None}",[],1855-12-17 05:00:00+00:00,article,,Archives,"{'original': 'Special Dispatch to the New-York Daily Times', 'person': [{'firstname': '', 'middlename': None, 'lastname': '', 'qualifier': None, 'title': None, 'role': 'reported', 'organization': '', 'rank': 1}], 'organization': None}",Archives,nyt://article/47373a9f-f488-5d4c-af96-77e50ef47717,0,nyt://article/47373a9f-f488-5d4c-af96-77e50ef47717,
"Mr. EISFELD gave his second source on Saturday, and much to our astonishment the room (DODWORTH'S) was crowded with a fashionable and discriminating audience. We say much to our astonishment, because the weather was really a justification for a meagre attendance. But the patrons of Mr. EISFELD'S admirable series have got used to bad weather. For nearly six years they have been accustomed to march through pelting torrents of rain or snows.  ",https://www.nytimes.com/1855/12/17/archives/eisfelds-classical-soriee.html,,,,4.0,The New York Times,[],"{'main': ""Eisfeld's Classical Soriee."", 'kicker': '1', 'content_kicker': None, 'print_headline': ""Eisfeld's Classical Soriee."", 'name': None, 'seo': None, 'sub': None}",[],1855-12-17 05:00:00+00:00,article,,Archives,"{'original': '', 'person': [], 'organization': None}",Archives,nyt://article/5bdbc47a-6c47-5d3d-8e98-066622f9506c,0,nyt://article/5bdbc47a-6c47-5d3d-8e98-066622f9506c,
