abstract,web_url,snippet,lead_paragraph,print_section,print_page,source,multimedia,headline,keywords,pub_date,document_type,news_desk,section_name,byline,type_of_material,_id,word_count,uri,subsection_name
"SINGULAR CASES OF ARSON.--About 9 1/2 o'clock yesterday morning a fire was discovered in a carpenter's shop in the rear of No. 216 Ninth-avenue, which was extinguished before it had made progress. Among the shavings a small fluid lamp was found, which had evidently been placed there to fire the building.... Shortly after 10 o'clock another fire was discovered by Officer WM. OVERTON, IN THE HOUSE OF Mrs. ELIZABETH PRYOR, at the same umber.  ",https://www.nytimes.com/1859/09/16/archives/city-intelligence.html,,,,5.0,The New York Times,[],"{'main': 'CITY INTELLIGENCE.', 'kicker': '1', 'content_kicker': None, 'print_headline': 'CITY INTELLIGENCE.', 'name': None, 'seo': None, 'sub': None}",[],1859-09-16 05:00:00+00:00,article,,Archives,"{'original': '', 'person': [], 'organization': None}",Archives,nyt://article/0d6ffd2d-c59d-503f-9ee0-49ded9be3a6a,0,nyt://article/0d6ffd2d-c59d-503f-9ee0-49ded9be3a6a,
"If the correspondent of the St. Louis Democrat tells the truth, the Administration having exhausted the coal and flour business, has gone into the mule trade. There will soon be hardly a branch of commerce left in which they will not have turned a penny, There has recently been large sale of supernumerary baggage unless at Camp Floyd in Utah.  ",https://www.nytimes.com/1859/09/16/archives/the-president-in-the-mule-trade.html,,,,4.0,The New York Times,[],"{'main': 'The President in the Mule Trade.', 'kicker': '1', 'content_kicker': None, 'print_headline': 'The President in the Mule Trade.', 'name': None, 'seo': None, 'sub': None}",[],1859-09-16 05:00:00+00:00,article,,Archives,"{'original': '', 'person': [], 'organization': None}",Archives,nyt://article/0da7c210-718c-5b89-9309-e164abfa756b,0,nyt://article/0da7c210-718c-5b89-9309-e164abfa756b,
,https://www.nytimes.com/1859/09/16/archives/article-9-no-title.html,,,,8.0,The New York Times,[],"{'main': 'Article 9 -- No Title', 'kicker': '1', 'content_kicker': None, 'print_headline': 'Article 9 -- No Title', 'name': None, 'seo': None, 'sub': None}",[],1859-09-16 05:00:00+00:00,article,,Archives,"{'original': '', 'person': [], 'organization': None}",Archives,nyt://article/10271574-fd77-5041-80ba-ee4af25f2db0,0,nyt://article/10271574-fd77-5041-80ba-ee4af25f2db0,
"Reliable information received in official circles leaves but little doubt that Sir WM. OUSELEY was a party to the revolution in Costa Rica. Having failed to induce President MORA to assent to the treaty which Nicaragua had rejected, it is believed he then determined to lend his influence to the revolutionary movement.  ",https://www.nytimes.com/1859/09/16/archives/news-by-telegraph-interesting-from-washington-the-british-minister.html,,,,1.0,The New York Times,[],"{'main': 'NEWS BY TELEGRAPH.; INTERESTING FROM WASHINGTON. The British Minister in Costa Rica a Party to the Revolution. The Revolutionary Movements in Carthagena, &c.', 'kicker': '1', 'content_kicker': None, 'print_headline': 'NEWS BY TELEGRAPH.; INTERESTING FROM WASHINGTON. The British Minister in Costa Rica a Party to the Revolution. The Revolutionary Movements in Carthagena, &c.', 'name': None, 'seo': None, 'sub': None}",[],1859-09-16 05:00:00+00:00,article,,Archives,"{'original': '', 'person': [], 'organization': None}",Archives,nyt://article/13468243-f312-5d08-9511-64b0565014ae,0,nyt://article/13468243-f312-5d08-9511-64b0565014ae,
,https://www.nytimes.com/1859/09/16/archives/article-8-no-title.html,,,,5.0,The New York Times,[],"{'main': 'Article 8 -- No Title', 'kicker': '1', 'content_kicker': None, 'print_headline': 'Article 8 -- No Title', 'name': None, 'seo': None, 'sub': None}",[],1859-09-16 05:00:00+00:00,article,,Archives,"{'original': '', 'person': [], 'organization': None}",Archives,nyt://article/142ae954-a15d-50c6-9aee-d730bfcc31da,0,nyt://article/142ae954-a15d-50c6-9aee-d730bfcc31da,
"MOORE--UNDERHILL,--In this City, on Wednesday, Sept. 14, at the residence of the bride's father, by the Rev. Dr. Jamesson, Mr. HENRY S. MOORE to MISS CLARA BELMONT, the eldest daughter of Capt. M.H. Underhill, all of this City. AUSTIN--BRADBURN.--In this City, on Thursday evening, Sept. 15, at Trinity Chapel, by the Rev. Geo. C. Pennell, LEANDER W. AUSTIN to MISS JULIA BRADBURN, all of this City.  ",https://www.nytimes.com/1859/09/16/archives/married.html,,,,5.0,The New York Times,[],"{'main': 'MARRIED.', 'kicker': '1', 'content_kicker': None, 'print_headline': 'MARRIED.', 'name': None, 'seo': None, 'sub': None}",[],1859-09-16 05:00:00+00:00,article,,Archives,"{'original': '', 'person': [], 'organization': None}",Archives,nyt://article/18da3a2c-1d70-5a86-bc59-104a7088eb0a,0,nyt://article/18da3a2c-1d70-5a86-bc59-104a7088eb0a,
"The latest dispatch from Sandy Hook, dated at midnight, states that up to that hour nothing had been seen of the steamship Persia, now in her thirteenth day. The Kangraroo is also overdue, she having left Liverpool on the 31st ult. The news, however, has been anticipated by other arrivals.  ",https://www.nytimes.com/1859/09/16/archives/news-of-the-day.html,,,,4.0,The New York Times,[],"{'main': 'NEWS OF THE DAY.', 'kicker': '1', 'content_kicker': None, 'print_headline': 'NEWS OF THE DAY.', 'name': None, 'seo': None, 'sub': None}",[],1859-09-16 05:00:00+00:00,article,,Archives,"{'original': '', 'person': [], 'organization': None}",Archives,nyt://article/1924b38d-65cc-5499-8cfc-bd5d9a052bfe,0,nyt://article/1924b38d-65cc-5499-8cfc-bd5d9a052bfe,
"MEETING OF THE PARK COMMISSIONERS--AN EXTENSIVE PARK PROPOSED.--The Commissioners on Parks, appointed by a recent act of the Legislature to locate parks and a parade ground for the City of Brooklyn, held a meeting last evening. The Commissioners early the present Summer effected on organization by electing Judge JOHN GREENWOOD as President, LUTHER B. WYMAN, Esq., as Secretary, and appointing Committees for the different sections of the City.  ",https://www.nytimes.com/1859/09/16/archives/brooklyn-intelligence.html,,,,8.0,The New York Times,[],"{'main': 'BROOKLYN INTELLIGENCE.', 'kicker': '1', 'content_kicker': None, 'print_headline': 'BROOKLYN INTELLIGENCE.', 'name': None, 'seo': None, 'sub': None}",[],1859-09-16 05:00:00+00:00,article,,Archives,"{'original': '', 'person': [], 'organization': None}",Archives,nyt://article/1a9db246-18b8-58d3-82e4-b599843802e7,0,nyt://article/1a9db246-18b8-58d3-82e4-b599843802e7,
,https://www.nytimes.com/1859/09/16/archives/marine-intelligence.html,,,,8.0,The New York Times,[],"{'main': 'MARINE INTELLIGENCE.', 'kicker': '1', 'content_kicker': None, 'print_headline': 'MARINE INTELLIGENCE.', 'name': None, 'seo': None, 'sub': None}",[],1859-09-16 05:00:00+00:00,article,,Archives,"{'original': '', 'person': [], 'organization': None}",Archives,nyt://article/26179d44-504c-5ed3-bd64-dfc830dad813,0,nyt://article/26179d44-504c-5ed3-bd64-dfc830dad813,
"We have at last an intelligible and reliable account of the state of our negotiations with Mexico. A letter from Washington, which will be found in another column, confirms the statement that Mr. McLANE has returned without a treaty, and at the same time traces his failure to its proper cause,--the instructions which hampered his action and prevented its success.  ",https://www.nytimes.com/1859/09/16/archives/failure-of-our-mexican-treaty.html,,,,4.0,The New York Times,[],"{'main': 'Failure of our Mexican Treaty.', 'kicker': '1', 'content_kicker': None, 'print_headline': 'Failure of our Mexican Treaty.', 'name': None, 'seo': None, 'sub': None}",[],1859-09-16 05:00:00+00:00,article,,Archives,"{'original': '', 'person': [], 'organization': None}",Archives,nyt://article/29ebabc3-a185-55e6-81ea-74f49abb6ece,0,nyt://article/29ebabc3-a185-55e6-81ea-74f49abb6ece,
"Among the many scientific works that are attracting attention abroad, the mammoth derrick, which lifts a thousand tons at a pull, is the lion at the present writing. Nor does it attract the popular wonder alone, for the highly scientific manner in which it works is much admired by the profession.  ",https://www.nytimes.com/1859/09/16/archives/engineering-abroad-the-great-floating-derrick-for-raising-sunken.html,,,,2.0,The New York Times,[],"{'main': 'ENGINEERING ABROAD.; The Great Floating Derrick for Raising Sunken Vessels--An American Invention---A Brig and a Steamboat Lifted Out of Water Together--Description of Its Peculiarities, Uses and Operations.', 'kicker': '1', 'content_kicker': None, 'print_headline': 'ENGINEERING ABROAD.; The Great Floating Derrick for Raising Sunken Vessels--An American Invention---A Brig and a Steamboat Lifted Out of Water Together--Description of Its Peculiarities, Uses and Operations.', 'name': None, 'seo': None, 'sub': None}",[],1859-09-16 05:00:00+00:00,article,,Archives,"{'original': '', 'person': [], 'organization': None}",Archives,nyt://article/301e4b3e-9e7a-565f-84e6-d4a442f28457,0,nyt://article/301e4b3e-9e7a-565f-84e6-d4a442f28457,
"PHAIR.--In this City, on Wednesday, Sept.14, JAMES PHAIR, formerly of Killyshandra, County Cavan, Ireland, aged 70 years. The friends and acquaintances of the family, and those of his sons, John and William, are respectfully invited to attend the funeral, from his late residence, No. 3 Madison--st.. near Pearl, on Friday, Sept. 16, at 9 o'clock in the forenoon.  ",https://www.nytimes.com/1859/09/16/archives/died.html,,,,5.0,The New York Times,[],"{'main': 'DIED.', 'kicker': '1', 'content_kicker': None, 'print_headline': 'DIED.', 'name': None, 'seo': None, 'sub': None}",[],1859-09-16 05:00:00+00:00,article,,Archives,"{'original': '', 'person': [], 'organization': None}",Archives,nyt://article/31fcc0e4-1e15-51c7-9af7-54541dcdc094,0,nyt://article/31fcc0e4-1e15-51c7-9af7-54541dcdc094,
"Before Judge Nelson. The September Term of this Court was opened this morning by Judge NELSON> The appeal Calendar was taken up and called nearly through before any case was found read for argument to-day, although almost all ""would be ready to -morrow"".  ",https://www.nytimes.com/1859/09/16/archives/law-reports-united-states-circuit-court-marine-court-common-pleas.html,,,,2.0,The New York Times,[],"{'main': 'LAW REPORTS.; UNITED STATES CIRCUIT COURT MARINE COURT. COMMON PLEAS SUPREME COURT. COURT OF GENERAL SESSIONS.', 'kicker': '1', 'content_kicker': None, 'print_headline': 'LAW REPORTS.; UNITED STATES CIRCUIT COURT MARINE COURT. COMMON PLEAS SUPREME COURT. COURT OF GENERAL SESSIONS.', 'name': None, 'seo': None, 'sub': None}",[],1859-09-16 05:00:00+00:00,article,,Archives,"{'original': '', 'person': [], 'organization': None}",Archives,nyt://article/3cea32a9-fb55-54fb-8e02-c1e58c78bd45,0,nyt://article/3cea32a9-fb55-54fb-8e02-c1e58c78bd45,
,https://www.nytimes.com/1859/09/16/archives/movements-of-ocean-steamers-for-europe.html,,,,8.0,The New York Times,[],"{'main': 'Movements of Ocean Steamers. FOR EUROPE.', 'kicker': '1', 'content_kicker': None, 'print_headline': 'Movements of Ocean Steamers. FOR EUROPE.', 'name': None, 'seo': None, 'sub': None}",[],1859-09-16 05:00:00+00:00,article,,Archives,"{'original': '', 'person': [], 'organization': None}",Archives,nyt://article/3eb31ba4-5019-55c5-bcf6-32a555b903d8,0,nyt://article/3eb31ba4-5019-55c5-bcf6-32a555b903d8,
"We publish this morning the first letter of a special correspondent commissioned to examine and report upon certain great features of European progress in practical matters, and the application of science to the useful arts. Truly treated, this theme involves the special history of the present age.  ",https://www.nytimes.com/1859/09/16/archives/america-and-her-rivals.html,,,,4.0,The New York Times,[],"{'main': 'America and her Rivals.', 'kicker': '1', 'content_kicker': None, 'print_headline': 'America and her Rivals.', 'name': None, 'seo': None, 'sub': None}",[],1859-09-16 05:00:00+00:00,article,,Archives,"{'original': '', 'person': [], 'organization': None}",Archives,nyt://article/50115a47-8972-556e-acd2-9a9e859e438b,0,nyt://article/50115a47-8972-556e-acd2-9a9e859e438b,
,https://www.nytimes.com/1859/09/16/archives/england-the-queenitalian-affairstroubles-about-marriage-in-royal.html,,,,2.0,The New York Times,[],"{'main': 'ENGLAND.; The Queen--Italian Affairs--Troubles about Marriage in Royal Circles.', 'kicker': '1', 'content_kicker': None, 'print_headline': 'ENGLAND.; The Queen--Italian Affairs--Troubles about Marriage in Royal Circles.', 'name': None, 'seo': None, 'sub': None}",[],1859-09-16 05:00:00+00:00,article,,Archives,"{'original': '', 'person': [], 'organization': None}",Archives,nyt://article/514ece8d-893a-5c1a-abef-9d30f5f4178e,0,nyt://article/514ece8d-893a-5c1a-abef-9d30f5f4178e,
,https://www.nytimes.com/1859/09/16/archives/financial.html,,,,7.0,The New York Times,[],"{'main': 'FINANCIAL.', 'kicker': '1', 'content_kicker': None, 'print_headline': 'FINANCIAL.', 'name': None, 'seo': None, 'sub': None}",[],1859-09-16 05:00:00+00:00,article,,Archives,"{'original': '', 'person': [], 'organization': None}",Archives,nyt://article/5191aa0c-ca52-5a81-a411-920b858f87f8,0,nyt://article/5191aa0c-ca52-5a81-a411-920b858f87f8,
"TELEGRAPHIC NEWS.--SUIT AGAINST THE AMERICAN TELEGRAPH COMPANY.--In the Supreme Judicial Court, at Boston, on the 10th, before Judge MERRICK, the case of Johnson  Zabriskie vs. The American Telegraph Company was heard, on the part of the petitioners, who describe themselves as reporters of news by telegraph. It is an application for an injunction to restrain the respondents from refusing to receive and transmit their messages at Sackvillc.  ",https://www.nytimes.com/1859/09/16/archives/article-3-no-title.html,,,,3.0,The New York Times,[],"{'main': 'Article 3 -- No Title', 'kicker': '1', 'content_kicker': None, 'print_headline': 'Article 3 -- No Title', 'name': None, 'seo': None, 'sub': None}",[],1859-09-16 05:00:00+00:00,article,,Archives,"{'original': '', 'person': [], 'organization': None}",Archives,nyt://article/58e05c5a-9547-52a0-b3d0-2c32832245ba,0,nyt://article/58e05c5a-9547-52a0-b3d0-2c32832245ba,
,https://www.nytimes.com/1859/09/16/archives/insurance.html,,,,6.0,The New York Times,[],"{'main': 'INSURANCE.', 'kicker': '1', 'content_kicker': None, 'print_headline': 'INSURANCE.', 'name': None, 'seo': None, 'sub': None}",[],1859-09-16 05:00:00+00:00,article,,Archives,"{'original': '', 'person': [], 'organization': None}",Archives,nyt://article/5d8f759d-c51b-5b1f-af48-d24224dada45,0,nyt://article/5d8f759d-c51b-5b1f-af48-d24224dada45,
,https://www.nytimes.com/1859/09/16/archives/article-2-no-title.html,,,,2.0,The New York Times,[],"{'main': 'Article 2 -- No Title', 'kicker': '1', 'content_kicker': None, 'print_headline': 'Article 2 -- No Title', 'name': None, 'seo': None, 'sub': None}",[],1859-09-16 05:00:00+00:00,article,,Archives,"{'original': '', 'person': [], 'organization': None}",Archives,nyt://article/61d69912-f24c-50d2-b3f5-f305933dd9e8,0,nyt://article/61d69912-f24c-50d2-b3f5-f305933dd9e8,
,https://www.nytimes.com/1859/09/16/archives/railroads.html,,,,7.0,The New York Times,[],"{'main': 'RAILROADS.', 'kicker': '1', 'content_kicker': None, 'print_headline': 'RAILROADS.', 'name': None, 'seo': None, 'sub': None}",[],1859-09-16 05:00:00+00:00,article,,Archives,"{'original': '', 'person': [], 'organization': None}",Archives,nyt://article/676b4d7e-348c-5637-9070-5b6e6290b923,0,nyt://article/676b4d7e-348c-5637-9070-5b6e6290b923,
"The London Atheneum says: ""Sculpture is at last secure of a home in England, her Majesty's Commissioners for the Exhibition of 1851 and the Horticultural Society having finally agreed; and tile works at Kensington will be proceeded with as soon as the money is subscribed. Of this there is little doubt. The council of the Horticultural Society, at  ",https://www.nytimes.com/1859/09/16/archives/miscellaneous.html,,,,3.0,The New York Times,[],"{'main': 'MISCELLANEOUS.', 'kicker': '1', 'content_kicker': None, 'print_headline': 'MISCELLANEOUS.', 'name': None, 'seo': None, 'sub': None}",[],1859-09-16 05:00:00+00:00,article,,Archives,"{'original': '', 'person': [], 'organization': None}",Archives,nyt://article/678621e3-e3a6-53b3-a608-52d00f2089a3,0,nyt://article/678621e3-e3a6-53b3-a608-52d00f2089a3,
"My letter of yesterday, in which mention was made of the fighting-gang brought up by FERNANDO WOOD, may in some part have prepared you to hear of violence and outrage both within and around the Democratic State Convention. But the scenes which  ",https://www.nytimes.com/1859/09/16/archives/newyork-politics-the-democratic-state-convention-at-syracuse.html,,,,1.0,The New York Times,[],"{'main': 'NEW-YORK POLITICS.; The Democratic State Convention at Syracuse. CONCLUSION OF THE PROCEEDINGS. Nomination of a State Ticket and Election of Delegates to Charleston. Changes in the State Central Committee. THE RESOLUTIONS. The Opening Scenes of the Convention on Wednesday.', 'kicker': '1', 'content_kicker': None, 'print_headline': 'NEW-YORK POLITICS.; The Democratic State Convention at Syracuse. CONCLUSION OF THE PROCEEDINGS. Nomination of a State Ticket and Election of Delegates to Charleston. Changes in the State Central Committee. THE RESOLUTIONS. The Opening Scenes of the Convention on Wednesday.', 'name': None, 'seo': None, 'sub': None}",[],1859-09-16 05:00:00+00:00,article,,Archives,"{'original': '', 'person': [], 'organization': None}",Archives,nyt://article/6c84a139-d112-50ee-89ff-327c6297e8d0,0,nyt://article/6c84a139-d112-50ee-89ff-327c6297e8d0,
,https://www.nytimes.com/1859/09/16/archives/steamboats.html,,,,7.0,The New York Times,[],"{'main': 'STEAMBOATS.', 'kicker': '1', 'content_kicker': None, 'print_headline': 'STEAMBOATS.', 'name': None, 'seo': None, 'sub': None}",[],1859-09-16 05:00:00+00:00,article,,Archives,"{'original': '', 'person': [], 'organization': None}",Archives,nyt://article/79493df3-fe90-5f9e-afbd-aaaf3d5cf621,0,nyt://article/79493df3-fe90-5f9e-afbd-aaaf3d5cf621,
"In my last I promised to give you some of the particulars of the manner in which the great male sale conducted. After the arrival of Mr. HOLLIDAY and the development of the fraud perpetrated upon the Government by the contract for the furnishing of flour to the army in Utah, it was whispered around that developments would be made in a few days that would start us still more than the flour contract.  ",https://www.nytimes.com/1859/09/16/archives/the-mule-contractsale-of-mules-in-utah-from-the-missouri-democrat.html,,,,2.0,The New York Times,[],"{'main': 'The Mule Contract--Sale of Mules in Utah.; From the Missouri Democrat.', 'kicker': '1', 'content_kicker': None, 'print_headline': 'The Mule Contract--Sale of Mules in Utah.; From the Missouri Democrat.', 'name': None, 'seo': None, 'sub': None}",[],1859-09-16 05:00:00+00:00,article,,Archives,"{'original': '', 'person': [], 'organization': None}",Archives,nyt://article/7c691425-9e02-539c-9874-35f48922edc4,0,nyt://article/7c691425-9e02-539c-9874-35f48922edc4,
"Mr. William E. Robinson and wife, of this City, having stopped at Coleraine, Ireland, on their homeward trip after a tour on the Continent, were entertained on the 23d August at an out-door festival at the Giant's Causeway. The Coleraine Chronicle Sates that a large number of guests were present at the entertainment, and that an address of welcome was delivered by the Rev. Mr. McConachie, who visited the United States in 1852.  ",https://www.nytimes.com/1859/09/16/archives/personal.html,,,,2.0,The New York Times,[],"{'main': 'PERSONAL.', 'kicker': '1', 'content_kicker': None, 'print_headline': 'PERSONAL.', 'name': None, 'seo': None, 'sub': None}",[],1859-09-16 05:00:00+00:00,article,,Archives,"{'original': '', 'person': [], 'organization': None}",Archives,nyt://article/81b8e291-c34a-5fa2-869d-439a817aff4b,0,nyt://article/81b8e291-c34a-5fa2-869d-439a817aff4b,
"COMMENDABLE ENTERPRISE.--The NEW-YORK TIMES takes the lead among the New-York dailies in all its enterprises and arrangements for supplying the public with the earliest and most desirable news of the day. Its issue of Thursday last contained a verbatim report of Senator DOUGLAS' speech, delivered in Columbus only the day previously. The speech was reported solely for the TIMES, and at their own expense. contained 7,100 words,  ",https://www.nytimes.com/1859/09/16/archives/article-4-no-title.html,,,,3.0,The New York Times,[],"{'main': 'Article 4 -- No Title', 'kicker': '1', 'content_kicker': None, 'print_headline': 'Article 4 -- No Title', 'name': None, 'seo': None, 'sub': None}",[],1859-09-16 05:00:00+00:00,article,,Archives,"{'original': '', 'person': [], 'organization': None}",Archives,nyt://article/861a5855-c476-5e6a-a28f-cfb774d3ec9a,0,nyt://article/861a5855-c476-5e6a-a28f-cfb774d3ec9a,
,https://www.nytimes.com/1859/09/16/archives/the-crusade-against-the-sunday-lawsletter-from-the-editor-of-the.html,,,,2.0,The New York Times,[],"{'main': 'The Crusade Against the Sunday Laws--Letter from the Editor of the Sunday Mercury.', 'kicker': '1', 'content_kicker': None, 'print_headline': 'The Crusade Against the Sunday Laws--Letter from the Editor of the Sunday Mercury.', 'name': None, 'seo': None, 'sub': None}",[],1859-09-16 05:00:00+00:00,article,,Archives,"{'original': '', 'person': [], 'organization': None}",Archives,nyt://article/8c33fa46-1ab4-57e1-a26c-9090bacb46b2,0,nyt://article/8c33fa46-1ab4-57e1-a26c-9090bacb46b2,
"Let not the reader be alarmed by the heading of this article. We do not propose a review of the Rev. Dr. BELLOWS' dramatic sermons, nor a screed upon the civic and moral properties of the theatre generally. We simply mean to say what we think, in our capacity as critics, of a certain new play which Miss LAURA KEENE, in her capacity as manager, this week presents to the enlightened public.  ",https://www.nytimes.com/1859/09/16/archives/the-world-and-the-stage.html,,,,4.0,The New York Times,[],"{'main': 'The World and the Stage.', 'kicker': '1', 'content_kicker': None, 'print_headline': 'The World and the Stage.', 'name': None, 'seo': None, 'sub': None}",[],1859-09-16 05:00:00+00:00,article,,Archives,"{'original': '', 'person': [], 'organization': None}",Archives,nyt://article/91e74903-bfbb-54ef-8d81-4404570bcb6e,0,nyt://article/91e74903-bfbb-54ef-8d81-4404570bcb6e,
"On Monday last an election was held in this city for municipal officers, and resulted in the reflection of Mr. DENMAN as Mayor by a small majority, not exceeding thirty. The Republicans elected the Recorder, Marshal, Treasurer, Street Commissioner, Assessor, and six of the twelve Councilmen, and are very much elected at their success in reducing the Democratic majority of last year from over 200 to less than 30.  ",https://www.nytimes.com/1859/09/16/archives/kansas-politics-result-of-the-municipal-election-in-leavenworth-its.html,,,,2.0,The New York Times,[],"{'main': 'Kansas Politics.; RESULT OF THE MUNICIPAL ELECTION IN LEAVENWORTH -- ITS EFFECT ON THE NEW CONSTITUTION--A POLITICAL ROW--THE APPROACHING CONGRESSIONAL CONTEST--FUGITIVE SLAVES FROM MISSOURI.', 'kicker': '1', 'content_kicker': None, 'print_headline': 'Kansas Politics.; RESULT OF THE MUNICIPAL ELECTION IN LEAVENWORTH -- ITS EFFECT ON THE NEW CONSTITUTION--A POLITICAL ROW--THE APPROACHING CONGRESSIONAL CONTEST--FUGITIVE SLAVES FROM MISSOURI.', 'name': None, 'seo': None, 'sub': None}",[],1859-09-16 05:00:00+00:00,article,,Archives,"{'original': '', 'person': [], 'organization': None}",Archives,nyt://article/a2d0f5a7-2e1b-5d17-8280-552cde96ab55,0,nyt://article/a2d0f5a7-2e1b-5d17-8280-552cde96ab55,
"ARTICLES ON EXHIBITION--LOCALITY OF THE FAIR. The New-Jersey State fair opened at Elizabeth City on Tuesday inst. The grounds are located between Elizabeth and ?? immediately on the line of the New-Jersey Central Railroad. The inclosure devoted to the exhibition of the various articles comprises about thirty acres, almost enough, one would think, to contain all the agricultural and mechanical products of the State.  ",https://www.nytimes.com/1859/09/16/archives/newjersey-state-fair.html,,,,8.0,The New York Times,[],"{'main': 'New-Jersey State Fair.', 'kicker': '1', 'content_kicker': None, 'print_headline': 'New-Jersey State Fair.', 'name': None, 'seo': None, 'sub': None}",[],1859-09-16 05:00:00+00:00,article,,Archives,"{'original': '', 'person': [], 'organization': None}",Archives,nyt://article/a3d7ce41-ef9c-57fc-99de-e18567af8c34,0,nyt://article/a3d7ce41-ef9c-57fc-99de-e18567af8c34,
"BRITISH LEGATION TO MEXICO.--We have anthoritative intelligenen to the effect that Mr. OTWAY, British Minister to Mexico, did not sail, as reported, from Vera Cruz, in the packet of the 4th inst., but will remain at least a month longer at the capital. Several reasons are assigned for this, the principal of which is that he entertained suspicious of the course Mr. MATHEWS, who is left in charge of the Legation, would pursue.  ",https://www.nytimes.com/1859/09/16/archives/article-10-no-title.html,,,,8.0,The New York Times,[],"{'main': 'Article 10 -- No Title', 'kicker': '1', 'content_kicker': None, 'print_headline': 'Article 10 -- No Title', 'name': None, 'seo': None, 'sub': None}",[],1859-09-16 05:00:00+00:00,article,,Archives,"{'original': '', 'person': [], 'organization': None}",Archives,nyt://article/a8050da0-43ab-59c3-b988-8bd354dee2fb,0,nyt://article/a8050da0-43ab-59c3-b988-8bd354dee2fb,
