abstract,web_url,snippet,lead_paragraph,print_section,print_page,source,multimedia,headline,keywords,pub_date,document_type,news_desk,section_name,byline,type_of_material,_id,word_count,uri,subsection_name
"The President of the United States, speaking through his organ at Washington, is very much exercised in his mind about the NEWYORK TIMES. His Editorial Excellency evidently labors under the belief that he is engaged in a tremendous newspaper controversy with this journal; and is considerably annoyed to find that the formidable assaults  ",https://www.nytimes.com/1859/09/07/archives/the-presidential-malaprop.html,,,,4.0,The New York Times,[],"{'main': 'The Presidential Malaprop.', 'kicker': '1', 'content_kicker': None, 'print_headline': 'The Presidential Malaprop.', 'name': None, 'seo': None, 'sub': None}",[],1859-09-07 05:00:00+00:00,article,,Archives,"{'original': '', 'person': [], 'organization': None}",Archives,nyt://article/946bce21-bf34-541f-87b6-381aa44e8162,0,nyt://article/946bce21-bf34-541f-87b6-381aa44e8162,
"A FEMALE PHYSICIAN IN DIFFICULTY.--An investigation has been pending before Coroner SUMMER for a day or two past into the cause of death of a woman named MARY E. BISCHER, who is alleged to have died from the consequences of an unnatural operation at the hands of Mrs. ELIZABETH BYRNES, a female physician at No. 168 Thompson-street.  ",https://www.nytimes.com/1859/09/07/archives/city-intelligence.html,,,,4.0,The New York Times,[],"{'main': 'CITY INTELLIGENCE.', 'kicker': '1', 'content_kicker': None, 'print_headline': 'CITY INTELLIGENCE.', 'name': None, 'seo': None, 'sub': None}",[],1859-09-07 05:00:00+00:00,article,,Archives,"{'original': '', 'person': [], 'organization': None}",Archives,nyt://article/95006dd4-a394-5452-8436-e69e3a202c36,0,nyt://article/95006dd4-a394-5452-8436-e69e3a202c36,
"LYON.-In this City, on Tuesday, Sept 6. EMMA only child of Robert S. and Caroline A. Lyon, aged 15 month. The relatives and friends of the family are respectfully invited to attend her funeral, on Thursday afterucon at 4 o'clock, from the residence other father, No. 31 East 11th st., without further their invitation.  ",https://www.nytimes.com/1859/09/07/archives/died.html,,,,5.0,The New York Times,[],"{'main': 'DIED.', 'kicker': '1', 'content_kicker': None, 'print_headline': 'DIED.', 'name': None, 'seo': None, 'sub': None}",[],1859-09-07 05:00:00+00:00,article,,Archives,"{'original': '', 'person': [], 'organization': None}",Archives,nyt://article/9b75f551-765d-5e72-9735-aa71e7ef09f5,0,nyt://article/9b75f551-765d-5e72-9735-aa71e7ef09f5,
"SECTIONAL CONVENTIONS.--EX-GOVERNOR SEYMOUR, of this State, blew his silver trumpet rather loudly the other day, at St. Paul's, Minesota, over the fact that every State, without exception, was represented in the Cincinnati Convention of 1856, while in the Convention which nominated Col. FREMONT  ",https://www.nytimes.com/1859/09/07/archives/article-5-no-title.html,,,,4.0,The New York Times,[],"{'main': 'Article 5 -- No Title', 'kicker': '1', 'content_kicker': None, 'print_headline': 'Article 5 -- No Title', 'name': None, 'seo': None, 'sub': None}",[],1859-09-07 05:00:00+00:00,article,,Archives,"{'original': '', 'person': [], 'organization': None}",Archives,nyt://article/9f070b4b-bdfc-5eda-97f7-c0409638a158,0,nyt://article/9f070b4b-bdfc-5eda-97f7-c0409638a158,
,https://www.nytimes.com/1859/09/07/archives/newyork-politics-the-canal-question-the-republican-state-convention.html,,,,8.0,The New York Times,[],"{'main': 'NEW-YORK POLITICS.; THE CANAL QUESTION. The Republican State Convention at Syracase. ASSEMBLING OF THE DELEGATES. The Prominent Men Talked of as Candidates.', 'kicker': '1', 'content_kicker': None, 'print_headline': 'NEW-YORK POLITICS.; THE CANAL QUESTION. The Republican State Convention at Syracase. ASSEMBLING OF THE DELEGATES. The Prominent Men Talked of as Candidates.', 'name': None, 'seo': None, 'sub': None}",[],1859-09-07 05:00:00+00:00,article,,Archives,"{'original': '', 'person': [], 'organization': None}",Archives,nyt://article/afd13d60-661c-5f45-af9d-7ef2dcf3d6c2,0,nyt://article/afd13d60-661c-5f45-af9d-7ef2dcf3d6c2,
,https://www.nytimes.com/1859/09/07/archives/naval-intelligence-78897885.html,,,,4.0,The New York Times,[],"{'main': 'Naval Intelligence.', 'kicker': '1', 'content_kicker': None, 'print_headline': 'Naval Intelligence.', 'name': None, 'seo': None, 'sub': None}",[],1859-09-07 05:00:00+00:00,article,,Archives,"{'original': '', 'person': [], 'organization': None}",Archives,nyt://article/b11dd3fd-f833-578f-baa2-20b5305d513e,0,nyt://article/b11dd3fd-f833-578f-baa2-20b5305d513e,
"A SOUTHERN AURORAL DISPLAY. - THE Mobile Advertiser has the following : ""On Sunday night we witnessed , from Point Clear, some electrical feats a little extraordinary for this latitude, A little after dark the attention of every one was directed to a dull red light, which reserabled that reflected from a burning building upon a cloud of no great density.  ",https://www.nytimes.com/1859/09/07/archives/article-2-no-title.html,,,,2.0,The New York Times,[],"{'main': 'Article 2 -- No Title', 'kicker': '1', 'content_kicker': None, 'print_headline': 'Article 2 -- No Title', 'name': None, 'seo': None, 'sub': None}",[],1859-09-07 05:00:00+00:00,article,,Archives,"{'original': '', 'person': [], 'organization': None}",Archives,nyt://article/b2fa16fa-e494-5365-a823-94cbd8abb50b,0,nyt://article/b2fa16fa-e494-5365-a823-94cbd8abb50b,
,https://www.nytimes.com/1859/09/07/archives/article-4-no-title.html,,,,3.0,The New York Times,[],"{'main': 'Article 4 -- No Title', 'kicker': '1', 'content_kicker': None, 'print_headline': 'Article 4 -- No Title', 'name': None, 'seo': None, 'sub': None}",[],1859-09-07 05:00:00+00:00,article,,Archives,"{'original': '', 'person': [], 'organization': None}",Archives,nyt://article/c2b47e0b-bc6b-5e3e-9d3a-134b345fe62b,0,nyt://article/c2b47e0b-bc6b-5e3e-9d3a-134b345fe62b,
,https://www.nytimes.com/1859/09/07/archives/railroads.html,,,,7.0,The New York Times,[],"{'main': 'RAILROADS.', 'kicker': '1', 'content_kicker': None, 'print_headline': 'RAILROADS.', 'name': None, 'seo': None, 'sub': None}",[],1859-09-07 05:00:00+00:00,article,,Archives,"{'original': '', 'person': [], 'organization': None}",Archives,nyt://article/c3a3ab95-f49b-51b7-aeb7-293c66fa69e5,0,nyt://article/c3a3ab95-f49b-51b7-aeb7-293c66fa69e5,
"PROGRESS OF THE SURVEYS--INDIAN HOSTILITIES. The General Land Office has received returns of the progress of the boundary survey in Daoolah Territory. The main lines of the survey constitute bases for the sub divisional work in that part of the surveying district of Wisconsin and Iowa which, upon the organization of the State of Minnesota, was not embraced within its limits.  ",https://www.nytimes.com/1859/09/07/archives/the-new-territory-of-dacotah.html,,,,2.0,The New York Times,[],"{'main': 'The New Territory of Dacotah.', 'kicker': '1', 'content_kicker': None, 'print_headline': 'The New Territory of Dacotah.', 'name': None, 'seo': None, 'sub': None}",[],1859-09-07 05:00:00+00:00,article,,Archives,"{'original': '', 'person': [], 'organization': None}",Archives,nyt://article/c9a750bb-8e63-5c3c-a2f4-a6d8ee5672c3,0,nyt://article/c9a750bb-8e63-5c3c-a2f4-a6d8ee5672c3,
,https://www.nytimes.com/1859/09/07/archives/financial.html,,,,7.0,The New York Times,[],"{'main': 'FINANCIAL.', 'kicker': '1', 'content_kicker': None, 'print_headline': 'FINANCIAL.', 'name': None, 'seo': None, 'sub': None}",[],1859-09-07 05:00:00+00:00,article,,Archives,"{'original': '', 'person': [], 'organization': None}",Archives,nyt://article/d8db7b05-3b9b-55f4-900e-91700ee79474,0,nyt://article/d8db7b05-3b9b-55f4-900e-91700ee79474,
"The Washington Star publishes the following, in a letter from on board the United States ship Cyare, at Realejo, July 31: "" Lieut. PHILPS, at present attached to tile sloop-of war St. Mary's, has received orders to join us, to fill the vacancy occasioned by the death of Lieut. LAMBERT. The bark Evadne,  ",https://www.nytimes.com/1859/09/07/archives/naval-intelligence.html,,,,3.0,The New York Times,[],"{'main': 'Naval Intelligence.', 'kicker': '1', 'content_kicker': None, 'print_headline': 'Naval Intelligence.', 'name': None, 'seo': None, 'sub': None}",[],1859-09-07 05:00:00+00:00,article,,Archives,"{'original': '', 'person': [], 'organization': None}",Archives,nyt://article/da3819c2-5f71-590f-8c01-6619281ab12a,0,nyt://article/da3819c2-5f71-590f-8c01-6619281ab12a,
"HEGEMAN--ALLISON.--In this City, on Tuesday, Sept. 6, in the new Brick Church, 5th. av., by the Rev. Dr. Spring, Mr. GEORGE HEGEMAN to Miss JENNIE A. ALLISON, all of this City. THOMSON--TAYLOR --In this City, on Tuesday, Sept. 6, by the Rev. Edwin F. Hatfield, Mr. EUGENE THOMSON to Miss JANIE E., daughter of John Taylor, Esq., all of this City.  ",https://www.nytimes.com/1859/09/07/archives/married.html,,,,5.0,The New York Times,[],"{'main': 'MARRIED.', 'kicker': '1', 'content_kicker': None, 'print_headline': 'MARRIED.', 'name': None, 'seo': None, 'sub': None}",[],1859-09-07 05:00:00+00:00,article,,Archives,"{'original': '', 'person': [], 'organization': None}",Archives,nyt://article/de3df123-94a3-5216-a2ee-1f60d97b259e,0,nyt://article/de3df123-94a3-5216-a2ee-1f60d97b259e,
"In steamship Arago, from Southampton and Havrt--H. J. Reamond. Esq., and family, Sam. Butzterworth, Esq, the Hon. P. Bennett, Gen. Bernard, Lient, H. A. ??, U.S.A., Dr. F. Betton and son, Dr. J. S. Evans. Dr. Quackenbes. Baron Otto Bramucker, Lime. Gmer, Mr. and Mrs. C. Livingston, 3 children and servant, Miss A. Chausy, Mrs. Baggerty, Miss Haggerty and 2 servants Mr. C. H. Scott, Miss Scott, Mr. C. D. Fredricks  ",https://www.nytimes.com/1859/09/07/archives/passengers-arrived.html,,,,8.0,The New York Times,[],"{'main': 'Passengers Arrived.', 'kicker': '1', 'content_kicker': None, 'print_headline': 'Passengers Arrived.', 'name': None, 'seo': None, 'sub': None}",[],1859-09-07 05:00:00+00:00,article,,Archives,"{'original': '', 'person': [], 'organization': None}",Archives,nyt://article/eb35f2da-1c7c-5bc8-acc9-35d7fd20bb4a,0,nyt://article/eb35f2da-1c7c-5bc8-acc9-35d7fd20bb4a,
"We publish today a full and intelligible account of the difficulty which has sprung up between this country and England in the far West. If an American Colonel in command of a petty post, and an English Colonel at the head of a petty Colony, can drive England and America into a war, we shall shortly be cannonading our dearly beloved cousins across the sea.  ",https://www.nytimes.com/1859/09/07/archives/the-little-war-cloud-in-the-west.html,,,,4.0,The New York Times,[],"{'main': 'The Little War Cloud in the West.', 'kicker': '1', 'content_kicker': None, 'print_headline': 'The Little War Cloud in the West.', 'name': None, 'seo': None, 'sub': None}",[],1859-09-07 05:00:00+00:00,article,,Archives,"{'original': '', 'person': [], 'organization': None}",Archives,nyt://article/ef6e2ff6-4f9b-57ae-844e-ee08886d0002,0,nyt://article/ef6e2ff6-4f9b-57ae-844e-ee08886d0002,
"Assassination of an Army Sergeant in Salt Lake City--General Alarm--Potition of the Citizens for the Army--General News. GEEAT SALT LAKE CITY, Friday, Aug. 12, 1859. Again we have tidings of assassination. On the 10th inst., Sergeant PIXE, with several soldiers as witnesses, obedient to summons directed to him from the United States Court, arrived in this city to answer to an indictment found by the Grand Jury for assault upon HOWARD SPENCER during last Winter.  ",https://www.nytimes.com/1859/09/08/archives/from-utah.html,,,,2.0,The New York Times,[],"{'main': 'FROM UTAH.', 'kicker': '1', 'content_kicker': None, 'print_headline': 'FROM UTAH.', 'name': None, 'seo': None, 'sub': None}",[],1859-09-08 05:00:00+00:00,article,,Archives,"{'original': '', 'person': [], 'organization': None}",Archives,nyt://article/0373361f-2c83-5c44-8f6f-c9e6fa6d82db,0,nyt://article/0373361f-2c83-5c44-8f6f-c9e6fa6d82db,
,https://www.nytimes.com/1859/09/08/archives/miniature-almanacthis-day.html,,,,8.0,The New York Times,[],"{'main': 'MINIATURE ALMANAC--THIS DAY.', 'kicker': '1', 'content_kicker': None, 'print_headline': 'MINIATURE ALMANAC--THIS DAY.', 'name': None, 'seo': None, 'sub': None}",[],1859-09-08 05:00:00+00:00,article,,Archives,"{'original': '', 'person': [], 'organization': None}",Archives,nyt://article/03b216af-1c69-5463-a13c-edde6e36d556,0,nyt://article/03b216af-1c69-5463-a13c-edde6e36d556,
"The annual session of the Order of United Americans for this State, was held at their rooms No. 297 Bowery, on Monday evening last. The following are the grand officers from the ensuing year: Grand Sachem--James A. Lucas, of Eureka, No. 98. Grand First Chief--H. H. Gregory, of Lawrence, No. 5.  ",https://www.nytimes.com/1859/09/08/archives/the-united-americansstate-organizations.html,,,,5.0,The New York Times,[],"{'main': 'The United Americans--State Organizations.', 'kicker': '1', 'content_kicker': None, 'print_headline': 'The United Americans--State Organizations.', 'name': None, 'seo': None, 'sub': None}",[],1859-09-08 05:00:00+00:00,article,,Archives,"{'original': '', 'person': [], 'organization': None}",Archives,nyt://article/12d8b580-9e8f-555a-b340-9d219c545a26,0,nyt://article/12d8b580-9e8f-555a-b340-9d219c545a26,
"LATER FROM CIUDAD BOLIVAR--BUSINESS PROS TRATED --PROGRESS OF THE REVOLUTION IN THE EAST--GENERAL NEWS. By the arrival of the brig Conquest, Capt. JENSEN, we have received advices from Ciuded Bolivar to the 11th ult. The steamers, having been chartered by Government to serve as transports. do not run regularly,  ",https://www.nytimes.com/1859/09/08/archives/from-venezuela.html,,,,4.0,The New York Times,[],"{'main': 'From Venezuela.', 'kicker': '1', 'content_kicker': None, 'print_headline': 'From Venezuela.', 'name': None, 'seo': None, 'sub': None}",[],1859-09-08 05:00:00+00:00,article,,Archives,"{'original': '', 'person': [], 'organization': None}",Archives,nyt://article/163f8c5f-4090-562f-a15c-48fb57036394,0,nyt://article/163f8c5f-4090-562f-a15c-48fb57036394,
"Col. FAUNTLEROY, of the Dragoons, has been ordered to duty in New Mexico, where his rank makes him the commander of the military department of New-Mexico in the absence of Gen. GABLAND, now an invalid. Brevet Major-General JOHN E. WOOL, commanding the Department of the East is to proceed to make an inspection of Fort Adams, R. I., and of Ford Independence, Mass.  ",https://www.nytimes.com/1859/09/08/archives/army-news.html,,,,2.0,The New York Times,[],"{'main': 'Army News.', 'kicker': '1', 'content_kicker': None, 'print_headline': 'Army News.', 'name': None, 'seo': None, 'sub': None}",[],1859-09-08 05:00:00+00:00,article,,Archives,"{'original': '', 'person': [], 'organization': None}",Archives,nyt://article/204ed01d-6a62-5727-ba96-bf6899bb2364,0,nyt://article/204ed01d-6a62-5727-ba96-bf6899bb2364,
"A number of Dentists practising in this State were convoked by public call Tuesday, and met at the Cooper Institute, for the purpose of organizing a State Dental Association. Dr. BURROWS was chose for temporary Chairman, and Dr. PERINS for Secretary. The roll having been called, the Convention was permanently organized by the election of the fellowing officers:  ",https://www.nytimes.com/1859/09/08/archives/convention-of-the-newyork-dentists.html,,,,2.0,The New York Times,[],"{'main': 'Convention of the New-York Dentists.', 'kicker': '1', 'content_kicker': None, 'print_headline': 'Convention of the New-York Dentists.', 'name': None, 'seo': None, 'sub': None}",[],1859-09-08 05:00:00+00:00,article,,Archives,"{'original': '', 'person': [], 'organization': None}",Archives,nyt://article/2056da70-6438-5c0a-8cf8-6983baf7d442,0,nyt://article/2056da70-6438-5c0a-8cf8-6983baf7d442,
"THE MAGDALEN ISLANDS.--The Toronto Colonist says that the Provincial Government has issued a proclamation regulating the holding of a Circuit Court st Amhet Habor, in the Magoalen Islands, Gulf of St. Lawrence. These Islands have been much neglected, to the great dissatisfaction of the inhabitants, who were disposed to look to New-Bruns wick for the encouragement and sympathy which they failed to receive at the hands of Canada.  ",https://www.nytimes.com/1859/09/08/archives/article-3-no-title.html,,,,2.0,The New York Times,[],"{'main': 'Article 3 -- No Title', 'kicker': '1', 'content_kicker': None, 'print_headline': 'Article 3 -- No Title', 'name': None, 'seo': None, 'sub': None}",[],1859-09-08 05:00:00+00:00,article,,Archives,"{'original': '', 'person': [], 'organization': None}",Archives,nyt://article/27cab2a5-003d-541d-85e4-9572501fe002,0,nyt://article/27cab2a5-003d-541d-85e4-9572501fe002,
,https://www.nytimes.com/1859/09/08/archives/financial.html,,,,7.0,The New York Times,[],"{'main': 'FINANCIAL.', 'kicker': '1', 'content_kicker': None, 'print_headline': 'FINANCIAL.', 'name': None, 'seo': None, 'sub': None}",[],1859-09-08 05:00:00+00:00,article,,Archives,"{'original': '', 'person': [], 'organization': None}",Archives,nyt://article/2b42110d-d620-5e41-b303-abec91131e23,0,nyt://article/2b42110d-d620-5e41-b303-abec91131e23,
"The Paris papers are sometimes as ingenious as their London contemporaries in discovering imaginary causes of national complaint, and we find a case in point elaborated in the columns of La Presse. Our readers are familiar with the particulars of the dispute that, some months ago, led to the withdrawal of the French, English and Spanish Consuls from the Republic of San Domingo.  ",https://www.nytimes.com/1859/09/08/archives/san-domingo-and-annexation.html,,,,4.0,The New York Times,[],"{'main': 'San Domingo and Annexation.', 'kicker': '1', 'content_kicker': None, 'print_headline': 'San Domingo and Annexation.', 'name': None, 'seo': None, 'sub': None}",[],1859-09-08 05:00:00+00:00,article,,Archives,"{'original': '', 'person': [], 'organization': None}",Archives,nyt://article/2ca9ddaa-c45a-530d-96c1-7c9bd3dbadac,0,nyt://article/2ca9ddaa-c45a-530d-96c1-7c9bd3dbadac,
"The Opposition and the American State Conven. tions met here to-day to nominate a candidate for Governor. The Americans assembled at the Athemaum, at 11 o'clock, A. M., made a temporary organization by choosing Dr. HARBERT, of Salem, Chairman; and C. W. TOLLER, of Essex, Secretary. After the preliminary matters of appointing committees on credentials, resolutions, , Dr. SAMUEL C. HABBERT was chosen permanent President of the meeting.  ",https://www.nytimes.com/1859/09/08/archives/gubernatorial-conventions-in-newjersey-resolutions-c-c-stormy-times.html,,,,4.0,The New York Times,[],"{'main': 'GUBERNATORIAL CONVENTIONS IN NEW-JERSEY.; RESOLUTIONS, &C., &C. Stormy Times Among the Americans, UNION OF THE TWO PARTIES.', 'kicker': '1', 'content_kicker': None, 'print_headline': 'GUBERNATORIAL CONVENTIONS IN NEW-JERSEY.; RESOLUTIONS, &C., &C. Stormy Times Among the Americans, UNION OF THE TWO PARTIES.', 'name': None, 'seo': None, 'sub': None}",[],1859-09-08 05:00:00+00:00,article,,Archives,"{'original': '', 'person': [], 'organization': None}",Archives,nyt://article/2d17c631-ab38-594e-b883-7b9e0e33fe42,0,nyt://article/2d17c631-ab38-594e-b883-7b9e0e33fe42,
"ANTI-RENT DISTURBANCE IN COLUMBIA COUNTY.--Another anti-rent difficulty occurred in Columbia county, in this State, on Tuesday. August 30. The Deputy Sheriff, with a posse, proceeded to a house in Tagakanie, occupied by one PETER FINKLE, who had dispossessed a man named MALLORY. FINKLE had previously been ejected from this house, and MALLORY was placed in possession.  ",https://www.nytimes.com/1859/09/08/archives/article-2-no-title.html,,,,2.0,The New York Times,[],"{'main': 'Article 2 -- No Title', 'kicker': '1', 'content_kicker': None, 'print_headline': 'Article 2 -- No Title', 'name': None, 'seo': None, 'sub': None}",[],1859-09-08 05:00:00+00:00,article,,Archives,"{'original': '', 'person': [], 'organization': None}",Archives,nyt://article/2ff07aea-0fb4-5540-b72d-ddf3f170b1fb,0,nyt://article/2ff07aea-0fb4-5540-b72d-ddf3f170b1fb,
,https://www.nytimes.com/1859/09/08/archives/marine-intelligence.html,,,,8.0,The New York Times,[],"{'main': 'MARINE INTELLIGENCE.', 'kicker': '1', 'content_kicker': None, 'print_headline': 'MARINE INTELLIGENCE.', 'name': None, 'seo': None, 'sub': None}",[],1859-09-08 05:00:00+00:00,article,,Archives,"{'original': '', 'person': [], 'organization': None}",Archives,nyt://article/316e0689-22da-5a01-9e15-025aec9ccdb8,0,nyt://article/316e0689-22da-5a01-9e15-025aec9ccdb8,
,https://www.nytimes.com/1859/09/08/archives/railroads.html,,,,7.0,The New York Times,[],"{'main': 'RAILROADS.', 'kicker': '1', 'content_kicker': None, 'print_headline': 'RAILROADS.', 'name': None, 'seo': None, 'sub': None}",[],1859-09-08 05:00:00+00:00,article,,Archives,"{'original': '', 'person': [], 'organization': None}",Archives,nyt://article/3b995e32-ecd1-5a2f-b5bf-f132b59fff92,0,nyt://article/3b995e32-ecd1-5a2f-b5bf-f132b59fff92,
"THE COLLIER FOLIO SHAKESPEARE--The Duke of DROVENSHIRE, its owner, has withdrawn the famous COLLIER folio from the British Museum, and has placed it in the hands of his solicitor for safe keeping, Such was the excitement which the question raised as to the good faith of Mr. COLLIER and the corrector of the folio had created, that the Duke thought it best to have the volume under his own eye.  ",https://www.nytimes.com/1859/09/08/archives/article-6-no-title.html,,,,4.0,The New York Times,[],"{'main': 'Article 6 -- No Title', 'kicker': '1', 'content_kicker': None, 'print_headline': 'Article 6 -- No Title', 'name': None, 'seo': None, 'sub': None}",[],1859-09-08 05:00:00+00:00,article,,Archives,"{'original': '', 'person': [], 'organization': None}",Archives,nyt://article/4570338e-8838-5c9b-addd-c5cd08c325ad,0,nyt://article/4570338e-8838-5c9b-addd-c5cd08c325ad,
"THE MAYOR INTERFERES WITH A PROJECT OF THE NINTH AVENUE RAILROAD COMPANY.--The Common Council, not long ago, as our readers know, passed a resolution authorizing the Ninth-avenue Railroad Company to run their cars on the tracks of the Sixth and Eighth avenue, and Hudson River Railroad Companies, provided it was permitted so to do by those Corporations.  ",https://www.nytimes.com/1859/09/08/archives/city-intelligence.html,,,,4.0,The New York Times,[],"{'main': 'CITY INTELLIGENCE.', 'kicker': '2', 'content_kicker': None, 'print_headline': 'CITY INTELLIGENCE.', 'name': None, 'seo': None, 'sub': None}",[],1859-09-08 05:00:00+00:00,article,,Archives,"{'original': '', 'person': [], 'organization': None}",Archives,nyt://article/474ee358-ac5e-5b28-abc2-e421f59f194e,0,nyt://article/474ee358-ac5e-5b28-abc2-e421f59f194e,
"NEW JERSEY STATE AGRICULTURAL FAIR.--The Fifth Annual Fair, under the auspices of the New Jersey State Agricultural Society, will be held at Elizabeth from the 13th to the 10th inst. With a view at testing the qualities of the blood horses offered for exhibition, the Committee of the City of Elizabeth offer premiums of $150,  ",https://www.nytimes.com/1859/09/08/archives/article-1-no-title.html,,,,2.0,The New York Times,[],"{'main': 'Article 1 -- No Title', 'kicker': '1', 'content_kicker': None, 'print_headline': 'Article 1 -- No Title', 'name': None, 'seo': None, 'sub': None}",[],1859-09-08 05:00:00+00:00,article,,Archives,"{'original': '', 'person': [], 'organization': None}",Archives,nyt://article/4a2f7f94-281c-5ea9-9f39-37ea5464a16b,0,nyt://article/4a2f7f94-281c-5ea9-9f39-37ea5464a16b,
"TAYLOR--NORRIS--In this City, on Wednesday, Sept. 7, at St Thomas' Church, by the Rev. Dr. Morgan, ?? of Westport. Conn., to MARGARET NORRIS, of this City. MARTINE--RITTON.--In this City, on Wednesday, Sept. 7, at the Church of the Holy Communion, by the Rev. Dr. Mublenberg, WILLIAM M. MARTINE to Miss AUGUS TIENE L. BITTON.  ",https://www.nytimes.com/1859/09/08/archives/married.html,,,,5.0,The New York Times,[],"{'main': 'MARRIED.', 'kicker': '1', 'content_kicker': None, 'print_headline': 'MARRIED.', 'name': None, 'seo': None, 'sub': None}",[],1859-09-08 05:00:00+00:00,article,,Archives,"{'original': '', 'person': [], 'organization': None}",Archives,nyt://article/4ca33b29-a5df-574e-aee5-d0e9b95640aa,0,nyt://article/4ca33b29-a5df-574e-aee5-d0e9b95640aa,
"LYON.-In this City, on Tuesday, Sept. 6, EMMA only child of Robert S. and Caroline A. Lyon, aged 15 months. The relatives and friends of the family are respectfully invited to Attend her funeral, on Thursday afternoon, at o'clock, from the residence of her father, No. 31 East 11th st., without further invitation.  ",https://www.nytimes.com/1859/09/08/archives/died.html,,,,5.0,The New York Times,[],"{'main': 'DIED', 'kicker': '1', 'content_kicker': None, 'print_headline': 'DIED', 'name': None, 'seo': None, 'sub': None}",[],1859-09-08 05:00:00+00:00,article,,Archives,"{'original': '', 'person': [], 'organization': None}",Archives,nyt://article/55a3567e-ff7a-51e0-8b73-186373145f1e,0,nyt://article/55a3567e-ff7a-51e0-8b73-186373145f1e,
,https://www.nytimes.com/1859/09/08/archives/steamboats.html,,,,7.0,The New York Times,[],"{'main': 'STEAMBOATS.', 'kicker': '1', 'content_kicker': None, 'print_headline': 'STEAMBOATS.', 'name': None, 'seo': None, 'sub': None}",[],1859-09-08 05:00:00+00:00,article,,Archives,"{'original': '', 'person': [], 'organization': None}",Archives,nyt://article/5dfdda61-bb59-5cd1-8513-8a22a4b759ef,0,nyt://article/5dfdda61-bb59-5cd1-8513-8a22a4b759ef,
