headline,abstract,pub_date,web_url,keyword_1,keyword_2,keyword_3,keyword_4,keyword_5
"Live Earth: Earnest Crooners and a “Supersonic Speed Machine” in Australia, China and Japan","It was a long antipodean night. While there’s no telling what’s a reflection of national taste and what’s the result of booking expediency, each of the concerts from Australia, Japan and China certainly had its own character.",2007-07-07 14:46:20+00:00,https://artsbeat.blogs.nytimes.com/2007/07/07/live-earth-crooners-and-a-supersonic-speed-machine-in-australia-china-and-japan/,,,,,
"Live Earth: Shakira, Shakira",,2007-07-07 14:46:54+00:00,https://artsbeat.blogs.nytimes.com/2007/07/07/live-earth-shakira-shakira/,,,,,
Live Earth: Rocking Out Around the World,,2007-07-07 15:12:39+00:00,https://artsbeat.blogs.nytimes.com/2007/07/07/live-earth-music-fans-around-the-world/,,,,,
"Hamilton, Hamilton, Hamilton","The Lewis Hamilton effect is felt everywhere. When I left the paddock last night after 10:30 PM – when I took the photo below to provide another view of the new McLaren motor home, as promised – it took 25 minutes to drive back to my hotel in Northampton. When I returned to the track this morning shortly after 8:00 AM, it took an hour and a half. The Hamilton phenomenon is living up to expectation. ",2007-07-07 15:48:45+00:00,https://rendezvous.blogs.nytimes.com/2007/07/07/hamilton-hamilton-hamilton/,,,,,
Live Earth: Genesis and Duran Duran in London,"England started its Live Earth concert at Wembley Stadium with an international drum tattoo: rockers at their kits, Scotsmen in kilts, Brazilian and Japanese and African drums. Then the show went decidedly British, mixing bombast, yearning and self-pity. The latest Genesis reunion did it with fast fingers and prog-rock intricacy; its all-purpose complaint about the state of the world, “Land of Confusion,” was still germane. ",2007-07-07 16:35:51+00:00,https://artsbeat.blogs.nytimes.com/2007/07/07/live-earth-genesis-and-duran-duran-in-london/,,,,,
Rating the U.S. Players at the Copa,"The Sam’s Army ratings polls reflect the general disappointment with the Nats at the Copa América, but they also show that a handful of players impressed the fans who pay the closest attention.",2007-07-07 16:36:01+00:00,https://goal.blogs.nytimes.com/2007/07/07/rating-the-us-players-at-the-copa/,,,,,
Government Expected to Try to Protect Names in Radomski Case,The government has until Monday to protect the redacted names of baseball players who were supplied performance-enhancing drugs by a former Mets clubhouse attendant.,2007-07-07 16:43:00+00:00,https://www.nytimes.com/2007/07/07/sports/baseball/07redact.html,,,,,
Mexico Rules,"In Mexico there are no licensing or registration requirements for real estate agents, which means your bartender in the nightclub might show up as your agent the next day. Anyone can represent themselves as an agent. While rare, stories abound of unscrupulous or simply under-prepared agents fouling up deals. ",2007-07-07 18:12:54+00:00,https://raisingtheroof.blogs.nytimes.com/2007/07/07/mexico-rules/,,,,,
Live Earth: Country in the Capitol,,2007-07-07 18:34:57+00:00,https://artsbeat.blogs.nytimes.com/2007/07/07/live-earth-country-in-the-capitol/,,,,,
