abstract,web_url,snippet,lead_paragraph,print_page,source,multimedia,headline,keywords,pub_date,document_type,news_desk,section_name,byline,type_of_material,_id,word_count,uri
"We have received advanced sheets of an interesting and important document about to be issued by the "" Sabbath Committee,"" on the Sunday liquor traffic. Few public papers, of similar tenor, deserve, or are likely to receive, more general attention. The nature and magnitude of the evil exposed, and the source and manner of the discussion, alike claim the candid consideration of all good citizens.  ",https://www.nytimes.com/1859/02/14/archives/the-sunday-liquor-traffic.html,,,2,The New York Times,[],"{'main': 'The Sunday Liquor Traffic.', 'kicker': '1', 'content_kicker': None, 'print_headline': 'The Sunday Liquor Traffic.', 'name': None, 'seo': None, 'sub': None}",[],1859-02-14T05:00:00+0000,article,None,Archives,"{'original': '', 'person': [], 'organization': None}",Archives,nyt://article/2c8d129e-5f48-53d1-a620-6439d6f24297,0,nyt://article/2c8d129e-5f48-53d1-a620-6439d6f24297
"On last Thursday morning we called attention to one hundred and sixty-six judgemens obtained agains the City by various parties ; and taking up a single case--that of HARSIN and CLARK--we exposed its history as a fraud from beginning to end, and called on the Corporation Counsel to explain how such a claim had been pemitted to stand in a Court of justice.  ",https://www.nytimes.com/1859/02/14/archives/how-the-city-treasury-is-plundered.html,,,4,The New York Times,[],"{'main': 'How the City Treasury is Plundered.', 'kicker': '1', 'content_kicker': None, 'print_headline': 'How the City Treasury is Plundered.', 'name': None, 'seo': None, 'sub': None}",[],1859-02-14T05:00:00+0000,article,None,Archives,"{'original': '', 'person': [], 'organization': None}",Archives,nyt://article/30b1ac95-09e5-505b-9307-4373371a8c83,0,nyt://article/30b1ac95-09e5-505b-9307-4373371a8c83
"The island of San Domingo, one of the earliest discoveries of COLUMBUS, was, for a long period, regarded as the most valuable of the Spanish possessions in the American scas. With the rise, however, of the fillibusters, or buccansers, whose favorite resorts were in the neighborhood of the Windward Passage,  ",https://www.nytimes.com/1859/02/14/archives/the-empire-of-hayti-sketch-of-the-early-history-of-the-islandorigin.html,,,2,The New York Times,[],"{'main': 'The Empire of Hayti.; SKETCH OF THE EARLY HISTORY OF THE ISLAND--ORIGIN OF THE FRENCH REPUBLIC--THE LIFE AND REIGN OF FAUSTIN SOULOUQUE--NARRATIVE OF EVENTS DOWN TO THE OUTBREAK OF THE RECENT REVOLUTION.', 'kicker': '1', 'content_kicker': None, 'print_headline': 'The Empire of Hayti.; SKETCH OF THE EARLY HISTORY OF THE ISLAND--ORIGIN OF THE FRENCH REPUBLIC--THE LIFE AND REIGN OF FAUSTIN SOULOUQUE--NARRATIVE OF EVENTS DOWN TO THE OUTBREAK OF THE RECENT REVOLUTION.', 'name': None, 'seo': None, 'sub': None}",[],1859-02-14T05:00:00+0000,article,None,Archives,"{'original': '', 'person': [], 'organization': None}",Archives,nyt://article/32abb8c1-52af-5edf-b2e7-87d07ccd7229,0,nyt://article/32abb8c1-52af-5edf-b2e7-87d07ccd7229
,https://www.nytimes.com/1859/02/14/archives/endictment-of-captain-corrie-of-the-yacht-wanderer.html,,,8,The New York Times,[],"{'main': 'Endictment of Captain Corrie, of the Yacht, Wanderer.', 'kicker': '1', 'content_kicker': None, 'print_headline': 'Endictment of Captain Corrie, of the Yacht, Wanderer.', 'name': None, 'seo': None, 'sub': None}",[],1859-02-14T05:00:00+0000,article,None,Archives,"{'original': '', 'person': [], 'organization': None}",Archives,nyt://article/35302509-6779-5ab7-b195-8035d7c0e403,0,nyt://article/35302509-6779-5ab7-b195-8035d7c0e403
"The state of siege still continues, including Santiago, Valparaiso, and Aconcagua; it was for 00 days. The political storm has been hushed for the time. Tile Mercurio is still suspended. Its suspension emanated from the President himself, arid will contime to the end of the 90 days.  ",https://www.nytimes.com/1859/02/14/archives/from-valparaiso.html,,,1,The New York Times,[],"{'main': 'From Valparaiso.', 'kicker': '1', 'content_kicker': None, 'print_headline': 'From Valparaiso.', 'name': None, 'seo': None, 'sub': None}",[],1859-02-14T05:00:00+0000,article,None,Archives,"{'original': '', 'person': [], 'organization': None}",Archives,nyt://article/3c08bddd-f808-5de7-9765-ba55af28fe21,0,nyt://article/3c08bddd-f808-5de7-9765-ba55af28fe21
,https://www.nytimes.com/1859/02/14/archives/detection-of-a-mail-robber.html,,,8,The New York Times,[],"{'main': 'Detection of a Mail Robber.', 'kicker': '1', 'content_kicker': None, 'print_headline': 'Detection of a Mail Robber.', 'name': None, 'seo': None, 'sub': None}",[],1859-02-14T05:00:00+0000,article,None,Archives,"{'original': '', 'person': [], 'organization': None}",Archives,nyt://article/3c1f1454-d7d9-5924-a569-ef027bfb2d0c,0,nyt://article/3c1f1454-d7d9-5924-a569-ef027bfb2d0c
"FATTY WELCH SHOT AND SEVERAL OTHERS INJURED. Scarcely a Sabbath passes during which there is not a serious disturbance of the peace, occasioned by the denizens of that locality, now tolerably well known as the ""Dead Rabbits."" But generally their onslaughts have been upon parties having no connection with them.  ",https://www.nytimes.com/1859/02/14/archives/riot-in-the-sixth-ward-the-feuds-of-the-dead-rabbits.html,,,1,The New York Times,[],"{'main': 'RIOT IN THE SIXTH WARD.; The Feuds of the Dead Rabbits.', 'kicker': '1', 'content_kicker': None, 'print_headline': 'RIOT IN THE SIXTH WARD.; The Feuds of the Dead Rabbits.', 'name': None, 'seo': None, 'sub': None}",[],1859-02-14T05:00:00+0000,article,None,Archives,"{'original': '', 'person': [], 'organization': None}",Archives,nyt://article/3c6580d9-6ecc-5723-9650-cfd3bdfcb341,0,nyt://article/3c6580d9-6ecc-5723-9650-cfd3bdfcb341
"MORE LEGISLATIVE BRIBERY--THE MICHIGAN LEGISLATURE.--The Lansing correspondent of the Detroit Free Press has the following: ""It has been hinted lately that an attempt had been made to bribe some of the members of Legislature, and the hints culminated to-day by the appointment of a Committee to investigate the matter.  ",https://www.nytimes.com/1859/02/14/archives/article-2-no-title.html,,,3,The New York Times,[],"{'main': 'Article 2 -- No Title', 'kicker': '1', 'content_kicker': None, 'print_headline': 'Article 2 -- No Title', 'name': None, 'seo': None, 'sub': None}",[],1859-02-14T05:00:00+0000,article,None,Archives,"{'original': '', 'person': [], 'organization': None}",Archives,nyt://article/3e832f14-f6e8-5d83-99f0-cbbf9a932a89,0,nyt://article/3e832f14-f6e8-5d83-99f0-cbbf9a932a89
"THE REGISTRY MEASURE.--Some progress is making in both branches of the Legislature to wards the enactinent of a Registry law. Each House has a bill before it-that of the Senate introduced by Mr. JOHNSON, and the one in the Assembly by Mr. SPENCER. On Wednesday the Senate appointed a special Committee--Messrs. JOHNSON, NOXON and MATHER--to take charge  ",https://www.nytimes.com/1859/02/14/archives/article-4-no-title.html,,,4,The New York Times,[],"{'main': 'Article 4 -- No Title', 'kicker': '1', 'content_kicker': None, 'print_headline': 'Article 4 -- No Title', 'name': None, 'seo': None, 'sub': None}",[],1859-02-14T05:00:00+0000,article,None,Archives,"{'original': '', 'person': [], 'organization': None}",Archives,nyt://article/433ebd92-e9ba-5ade-afd4-d5d6f2f5aea6,0,nyt://article/433ebd92-e9ba-5ade-afd4-d5d6f2f5aea6
"The steamship Indian Is now in her nineteenth day out from Livepool, and overdue at Portland, and the America is in her sixteenth day out from the same port, and overdue at Halifax. The weather at both ports of destination last night was clear, and favorable in every respect.  ",https://www.nytimes.com/1859/02/14/archives/news-of-the-day.html,,,4,The New York Times,[],"{'main': 'NEWS OF THE DAY.', 'kicker': '1', 'content_kicker': None, 'print_headline': 'NEWS OF THE DAY.', 'name': None, 'seo': None, 'sub': None}",[],1859-02-14T05:00:00+0000,article,None,Archives,"{'original': '', 'person': [], 'organization': None}",Archives,nyt://article/43ca0d54-81b0-5bb2-ab5e-784754961c34,0,nyt://article/43ca0d54-81b0-5bb2-ab5e-784754961c34
"Our Washington correspondent furnishes us to-day some important hints towards an appreciation of the motives which are urging on so many members of Congress to their vehement Cuban crusade. The country, quite insensible itself to all appeals for its sympathy in the singular excitement, was beginning to suspect that Senators  ",https://www.nytimes.com/1859/02/14/archives/the-cuban-humbug.html,,,4,The New York Times,[],"{'main': 'The Cuban Humbug.', 'kicker': '1', 'content_kicker': None, 'print_headline': 'The Cuban Humbug.', 'name': None, 'seo': None, 'sub': None}",[],1859-02-14T05:00:00+0000,article,None,Archives,"{'original': '', 'person': [], 'organization': None}",Archives,nyt://article/4648b53d-1f7c-5e64-ae7f-ae4aca6816f9,0,nyt://article/4648b53d-1f7c-5e64-ae7f-ae4aca6816f9
""" To be or not to be "" is the question upon which the President's venerable and poetic friend in the herald office now seems to be exercising his vigorous and imaginative mind. No convenient "" Plum Gut"" offers itself to his inquiring eye as a means of escape from the perplexities of the political voyage on which he has entered.  ",https://www.nytimes.com/1859/02/14/archives/sink-or-swim.html,,,4,The New York Times,[],"{'main': 'Sink or Swim?', 'kicker': '1', 'content_kicker': None, 'print_headline': 'Sink or Swim?', 'name': None, 'seo': None, 'sub': None}",[],1859-02-14T05:00:00+0000,article,None,Archives,"{'original': '', 'person': [], 'organization': None}",Archives,nyt://article/4c693f1b-f771-5860-bbc3-c21efa120cd2,0,nyt://article/4c693f1b-f771-5860-bbc3-c21efa120cd2
"From the Paris Constitutionnel. The young Republic of the New World was long ago warned by clear-sighted men that it nourished in its own bosom its most dangerous enemy. It was warned that the day would come in which it would have to face that most formidable of despots the multitude, and to undergo that blindest of tyrannies the tyranay of the passionate and capriclious mob.  ",https://www.nytimes.com/1859/02/14/archives/american-politics-as-they-strike-observers-in-france.html,,,2,The New York Times,[],"{'main': 'American Politics as they Strike Observers in France.', 'kicker': '1', 'content_kicker': None, 'print_headline': 'American Politics as they Strike Observers in France.', 'name': None, 'seo': None, 'sub': None}",[],1859-02-14T05:00:00+0000,article,None,Archives,"{'original': '', 'person': [], 'organization': None}",Archives,nyt://article/5480ff16-fcda-5a95-ad56-23bbd0d8f820,0,nyt://article/5480ff16-fcda-5a95-ad56-23bbd0d8f820
"DISCOVERY OF HISTORICAL DOCUMENTS AT THE HAGUE.--The albany Evening Journal publishes a letter addressd to Dr. E. B. O'CALLAGHAN by the Hon. HENRY C. MURPHY, United Staes Minister at the Hague, announcing the discovery of important historical documents at the Hague. Mr. MURPHY writes: I hope to send you, during the Winter, a ""Memoir on Henry Hudson in Holland,""  ",https://www.nytimes.com/1859/02/14/archives/front-page-1-no-title.html,,,1,The New York Times,[],"{'main': 'Front Page 1 -- No Title', 'kicker': '1', 'content_kicker': None, 'print_headline': 'Front Page 1 -- No Title', 'name': None, 'seo': None, 'sub': None}",[],1859-02-14T05:00:00+0000,article,None,Archives,"{'original': '', 'person': [], 'organization': None}",Archives,nyt://article/59418f90-bf80-56fd-a295-ff9ddc9e7937,0,nyt://article/59418f90-bf80-56fd-a295-ff9ddc9e7937
"The steamship Tennessee has arrived here with Vera Cruz dates to the 9th inst. ZELOAGA abdicated in favor of MIRAMON on the 2nd last., when the letter was installed as President. HIRAMON had rearrested the political prisoners liberated by BOHLES, and dismissed all the officers engaged in deposing ZULOAGA. He had also suppressed the forced one million loan ordered by ROBLES.  ",https://www.nytimes.com/1859/02/14/archives/important-from-mexico-later-from-the-northern-states-miramon.html,,,1,The New York Times,[],"{'main': 'IMPORTANT FROM MEXICO.; Later from the Northern States. MIRAMON ASSUMES THE PRESIDENCY.', 'kicker': '1', 'content_kicker': None, 'print_headline': 'IMPORTANT FROM MEXICO.; Later from the Northern States. MIRAMON ASSUMES THE PRESIDENCY.', 'name': None, 'seo': None, 'sub': None}",[],1859-02-14T05:00:00+0000,article,None,Archives,"{'original': '', 'person': [], 'organization': None}",Archives,nyt://article/5f65c0fa-bfe5-5308-9912-c36ec575f2b9,0,nyt://article/5f65c0fa-bfe5-5308-9912-c36ec575f2b9
"There appears to be a fearful battle raging in the Custom-house at this moment between routine and insolvency, the end whereof it would be difficult to foresee. It is no doubt understood by most of our readers that on the entry of certain imports, the exact total of duty on which it would be impossible to accertain until the goods have been appraised and weighed,  ",https://www.nytimes.com/1859/02/14/archives/insolvency-at-the-customhouse.html,,,4,The New York Times,[],"{'main': 'Insolvency at the Custom-House.', 'kicker': '1', 'content_kicker': None, 'print_headline': 'Insolvency at the Custom-House.', 'name': None, 'seo': None, 'sub': None}",[],1859-02-14T05:00:00+0000,article,None,Archives,"{'original': '', 'person': [], 'organization': None}",Archives,nyt://article/68b9e0df-a6a5-5dfa-a107-56b4e970cce6,0,nyt://article/68b9e0df-a6a5-5dfa-a107-56b4e970cce6
"For the greater part of the fortnight clapsing since the departure of the last ocean mail an extreme degree of imactivity has character the market, relieved, however, towards the close, by a somewhat improved demand from the country; while,recently. lumerous arrivals have afforted the city trade a better opprtunity of making purchases.  ",https://www.nytimes.com/1859/02/14/archives/san-francisco-markets-from-wells-fargo-cos-mercantile-gazette.html,,,3,The New York Times,[],"{'main': ""San Francisco Markets.; From Wells, Fargo & Co's Mercantile Gazette."", 'kicker': '1', 'content_kicker': None, 'print_headline': ""San Francisco Markets.; From Wells, Fargo & Co's Mercantile Gazette."", 'name': None, 'seo': None, 'sub': None}",[],1859-02-14T05:00:00+0000,article,None,Archives,"{'original': '', 'person': [], 'organization': None}",Archives,nyt://article/6a6f45b5-0a5a-5252-a1f6-6d3d910fab20,0,nyt://article/6a6f45b5-0a5a-5252-a1f6-6d3d910fab20
"The United States sloop-of-war Vandalin left San Francisco for Guaymas, Gulf of California, on the 19th olt., to relieve the Saranan. The Vantalia sailed from Portsmonth, (N. H.,) on the 1st of December, 1857. and made the trip to Rio de Janeiro Inwenty-nine days and nineteen hours, one of the shortest passages ever made between the two places-From Rio the Vandalia salled for cruise,  ",https://www.nytimes.com/1859/02/14/archives/naval-and-marine-intelligence.html,,,4,The New York Times,[],"{'main': 'Naval and Marine Intelligence.', 'kicker': '1', 'content_kicker': None, 'print_headline': 'Naval and Marine Intelligence.', 'name': None, 'seo': None, 'sub': None}",[],1859-02-14T05:00:00+0000,article,None,Archives,"{'original': '', 'person': [], 'organization': None}",Archives,nyt://article/6d1b62d3-2f2b-54bf-af26-891ca5b98877,0,nyt://article/6d1b62d3-2f2b-54bf-af26-891ca5b98877
"UNITED STATES SUPREME COURT.--The twelfth rule of the Supreme Court of the United States in Admiralty authorizes proceedings in rem. for supplies, materials,  c., furnished to domestic vessels. This rule has just been altered by the Supreme Court so as to confine the remedy to proceedings in personam, removing the lien heretofore assumed in accordance with  ",https://www.nytimes.com/1859/02/14/archives/article-1-no-title.html,,,2,The New York Times,[],"{'main': 'Article 1 -- No Title', 'kicker': '1', 'content_kicker': None, 'print_headline': 'Article 1 -- No Title', 'name': None, 'seo': None, 'sub': None}",[],1859-02-14T05:00:00+0000,article,None,Archives,"{'original': '', 'person': [], 'organization': None}",Archives,nyt://article/6f8412ea-4a1e-5061-bcc6-80a57e7c72c7,0,nyt://article/6f8412ea-4a1e-5061-bcc6-80a57e7c72c7
,https://www.nytimes.com/1859/02/14/archives/news-from-newmexico.html,,,8,The New York Times,[],"{'main': 'News from New-Mexico.', 'kicker': '1', 'content_kicker': None, 'print_headline': 'News from New-Mexico.', 'name': None, 'seo': None, 'sub': None}",[],1859-02-14T05:00:00+0000,article,None,Archives,"{'original': '', 'person': [], 'organization': None}",Archives,nyt://article/73f3de8c-842d-54ea-9a21-622a4734137d,0,nyt://article/73f3de8c-842d-54ea-9a21-622a4734137d
"The weather has been very clear all day, with a Hight N. W. wind, and so continues, but there are yet no signs of the Royal mail steamship America, now in her 16th day from Liverpool and overdue. PORTLAND, Me., Sunday, Feb. 13-11 P. M. There are no signs of the steamship Indian, now her nineteenth day from Liverpool.  ",https://www.nytimes.com/1859/02/14/archives/the-expected-european-news-nonarrival-of-the-america-and-indian.html,,,8,The New York Times,[],"{'main': 'The Expected European News.; NON-ARRIVAL OF THE AMERICA AND INDIAN.', 'kicker': '1', 'content_kicker': None, 'print_headline': 'The Expected European News.; NON-ARRIVAL OF THE AMERICA AND INDIAN.', 'name': None, 'seo': None, 'sub': None}",[],1859-02-14T05:00:00+0000,article,None,Archives,"{'original': '', 'person': [], 'organization': None}",Archives,nyt://article/76bb1159-883e-539d-a3a3-3b47ccd8af3c,0,nyt://article/76bb1159-883e-539d-a3a3-3b47ccd8af3c
"The POST-OFFICE AT FAULT AGAIN-There must be something very defective in the foreign postal arrangement in this city. A short time ago a number of letters intended for Liverpool, England, were send, instead, to Liverpool in the British Provinces. And it now appears that the mails of the 6th December for New-Granada and the Spanish main,  ",https://www.nytimes.com/1859/02/14/archives/article-5-no-title.html,,,4,The New York Times,[],"{'main': 'Article 5 -- No Title', 'kicker': '1', 'content_kicker': None, 'print_headline': 'Article 5 -- No Title', 'name': None, 'seo': None, 'sub': None}",[],1859-02-14T05:00:00+0000,article,None,Archives,"{'original': '', 'person': [], 'organization': None}",Archives,nyt://article/7c82599b-5d13-582c-b5c9-3e017200b520,0,nyt://article/7c82599b-5d13-582c-b5c9-3e017200b520
"To the Editor of the New York Times: Two or three days since it seemed to be my duty to signify to the residents of the Twenty-first Ward, that if called upon by unknown persons making use of my name to contribute money, it would be without my consent and approval. Several instances have been reported of persons, unknown to myselfm who have within a brief parcial thus abused the generosity of the public.  ",https://www.nytimes.com/1859/02/14/archives/another-card-from-mr-bailey.html,,,1,The New York Times,[],"{'main': 'Another Card from Mr. Bailey.', 'kicker': '1', 'content_kicker': None, 'print_headline': 'Another Card from Mr. Bailey.', 'name': None, 'seo': None, 'sub': None}",[],1859-02-14T05:00:00+0000,article,None,Archives,"{'original': '', 'person': [], 'organization': None}",Archives,nyt://article/810be366-f8b3-5628-9ae7-49c901106da0,0,nyt://article/810be366-f8b3-5628-9ae7-49c901106da0
,https://www.nytimes.com/1859/02/14/archives/article-6-no-title.html,,,4,The New York Times,[],"{'main': 'Article 6 -- No Title', 'kicker': '1', 'content_kicker': None, 'print_headline': 'Article 6 -- No Title', 'name': None, 'seo': None, 'sub': None}",[],1859-02-14T05:00:00+0000,article,None,Archives,"{'original': '', 'person': [], 'organization': None}",Archives,nyt://article/851237af-2126-5d03-8bad-af762dab224b,0,nyt://article/851237af-2126-5d03-8bad-af762dab224b
"Signor FONTANA, all Italian gentlemen familiar with his theme, will lecture to night, at Clinton Hall, upon the character and the reign of FERDINAND of Naples, commonly and justly branded by the title of King ""Bomba,"" whose death was reported by the last stcamer from Europe.  ",https://www.nytimes.com/1859/02/14/archives/king-bomba-and-his-government.html,,,4,The New York Times,[],"{'main': 'King Bomba and his Government.', 'kicker': '1', 'content_kicker': None, 'print_headline': 'King Bomba and his Government.', 'name': None, 'seo': None, 'sub': None}",[],1859-02-14T05:00:00+0000,article,None,Archives,"{'original': '', 'person': [], 'organization': None}",Archives,nyt://article/8acdaeb8-a2b3-5518-848f-9b8ee941b1cd,0,nyt://article/8acdaeb8-a2b3-5518-848f-9b8ee941b1cd
,https://www.nytimes.com/1859/02/14/archives/front-page-3-no-title.html,,,1,The New York Times,[],"{'main': 'Front Page 3 -- No Title', 'kicker': '1', 'content_kicker': None, 'print_headline': 'Front Page 3 -- No Title', 'name': None, 'seo': None, 'sub': None}",[],1859-02-14T05:00:00+0000,article,None,Archives,"{'original': '', 'person': [], 'organization': None}",Archives,nyt://article/8cc2f3ca-17db-5b5f-a341-1c04cd3e439e,0,nyt://article/8cc2f3ca-17db-5b5f-a341-1c04cd3e439e
,https://www.nytimes.com/1859/02/14/archives/export-of-specie.html,,,8,The New York Times,[],"{'main': 'Export of Specie.', 'kicker': '1', 'content_kicker': None, 'print_headline': 'Export of Specie.', 'name': None, 'seo': None, 'sub': None}",[],1859-02-14T05:00:00+0000,article,None,Archives,"{'original': '', 'person': [], 'organization': None}",Archives,nyt://article/91d7aa95-ed57-5ae5-beab-982859ecfa67,0,nyt://article/91d7aa95-ed57-5ae5-beab-982859ecfa67
"To the Editor of the New-York Times: I have seldom been so impressed with the importance of clear and correct views of great truths as in hearing Professor MITCHEL'S two Astronomical lectures in Brooklyn. My family have become quite a family of Astronomers; and, in place of the idle talk of the city, the vast works of the Almighty have become our theme.  ",https://www.nytimes.com/1859/02/14/archives/professor-mitchel-in-brooklyn.html,,,8,The New York Times,[],"{'main': 'Professor Mitchel in Brooklyn.', 'kicker': '1', 'content_kicker': None, 'print_headline': 'Professor Mitchel in Brooklyn.', 'name': None, 'seo': None, 'sub': None}",[],1859-02-14T05:00:00+0000,article,None,Archives,"{'original': '', 'person': [], 'organization': None}",Archives,nyt://article/948abc01-5332-54b4-8a55-0b4e609ea846,0,nyt://article/948abc01-5332-54b4-8a55-0b4e609ea846
"A WHOLE FAMILY POISONED BY DRINKING TEA.--A singlular case of poisoning occurred in a family residing in Neutra-alley, leading from Jay-street, between Concord and Johnson-streets, on Saturday Last. The parties poisoned were ANTHONY GALE, his wife, and their two daughtors named JULLA AND EMMA, aged respectively twelve and fourteen years.  ",https://www.nytimes.com/1859/02/14/archives/brooklyn-intelligence-.html,,,5,The New York Times,[],"{'main': 'BROOKLYN INTELLIGENCE .', 'kicker': '1', 'content_kicker': None, 'print_headline': 'BROOKLYN INTELLIGENCE .', 'name': None, 'seo': None, 'sub': None}",[],1859-02-14T05:00:00+0000,article,None,Archives,"{'original': '', 'person': [], 'organization': None}",Archives,nyt://article/94e19111-61cb-5b52-927b-41ef2bbea5a4,0,nyt://article/94e19111-61cb-5b52-927b-41ef2bbea5a4
,https://www.nytimes.com/1859/02/14/archives/passengers-sailed.html,,,8,The New York Times,[],"{'main': 'Passengers Sailed.', 'kicker': '1', 'content_kicker': None, 'print_headline': 'Passengers Sailed.', 'name': None, 'seo': None, 'sub': None}",[],1859-02-14T05:00:00+0000,article,None,Archives,"{'original': '', 'person': [], 'organization': None}",Archives,nyt://article/9b01dc7d-3b48-585a-8619-83ae2c100c00,0,nyt://article/9b01dc7d-3b48-585a-8619-83ae2c100c00
,https://www.nytimes.com/1859/02/14/archives/railroads.html,,,7,The New York Times,[],"{'main': 'RAILROADS.', 'kicker': '1', 'content_kicker': None, 'print_headline': 'RAILROADS.', 'name': None, 'seo': None, 'sub': None}",[],1859-02-14T05:00:00+0000,article,None,Archives,"{'original': '', 'person': [], 'organization': None}",Archives,nyt://article/a0f1fce4-e0f9-5752-a8cb-91c2a3e137be,0,nyt://article/a0f1fce4-e0f9-5752-a8cb-91c2a3e137be
,https://www.nytimes.com/1859/02/14/archives/marine-disasters.html,,,8,The New York Times,[],"{'main': 'Marine Disasters.', 'kicker': '1', 'content_kicker': None, 'print_headline': 'Marine Disasters.', 'name': None, 'seo': None, 'sub': None}",[],1859-02-14T05:00:00+0000,article,None,Archives,"{'original': '', 'person': [], 'organization': None}",Archives,nyt://article/a4483e6a-c233-50de-8851-24701b7b4194,0,nyt://article/a4483e6a-c233-50de-8851-24701b7b4194
,https://www.nytimes.com/1859/02/14/archives/married.html,,,5,The New York Times,[],"{'main': 'MARRIED.', 'kicker': '1', 'content_kicker': None, 'print_headline': 'MARRIED.', 'name': None, 'seo': None, 'sub': None}",[],1859-02-14T05:00:00+0000,article,None,Archives,"{'original': '', 'person': [], 'organization': None}",Archives,nyt://article/a83ad172-ea8c-5fe0-9a3c-f23a4f7e226b,0,nyt://article/a83ad172-ea8c-5fe0-9a3c-f23a4f7e226b
,https://www.nytimes.com/1859/02/14/archives/kansas-and-slavery.html,,,8,The New York Times,[],"{'main': 'Kansas and Slavery.', 'kicker': '1', 'content_kicker': None, 'print_headline': 'Kansas and Slavery.', 'name': None, 'seo': None, 'sub': None}",[],1859-02-14T05:00:00+0000,article,None,Archives,"{'original': '', 'person': [], 'organization': None}",Archives,nyt://article/aa9fb829-bf6e-5205-8da4-d91cbf822ad2,0,nyt://article/aa9fb829-bf6e-5205-8da4-d91cbf822ad2
