abstract,web_url,snippet,lead_paragraph,print_page,source,multimedia,headline,keywords,pub_date,document_type,news_desk,section_name,byline,type_of_material,_id,word_count,uri
"SUPREME COURT--GENERAL TERM.--Motion day. CIRCUIY-NOS. 277, 443, 1004, 614, 453, 530, 373. 196, 468, 153, 500, 235, 237, 255, 273, 279, 361, 365, 385, 423. SUPERIOR COURT--TRIAL TEEM.--NOS. 07, 423, 3, 247. 408, 311, 400, 460, 461, 463, 465 to 470, 872, (rec. case,) 227, 321, 422. 155.  ",https://www.nytimes.com/1859/02/21/archives/law-reports-court-calendar-common-pleas-superior-court-new-rule-in.html,,,2,The New York Times,[],"{'main': 'LAW REPORTS.; COURT CALENDAR COMMON PLEAS. SUPERIOR COURT New Rule in Admiraity. SUPERIOR COURT SUPREME COURT', 'kicker': '1', 'content_kicker': None, 'print_headline': 'LAW REPORTS.; COURT CALENDAR COMMON PLEAS. SUPERIOR COURT New Rule in Admiraity. SUPERIOR COURT SUPREME COURT', 'name': None, 'seo': None, 'sub': None}",[],1859-02-21T05:00:00+0000,article,None,Archives,"{'original': '', 'person': [], 'organization': None}",Archives,nyt://article/3e021fe1-5fa1-5d39-ac28-d03005729304,0,nyt://article/3e021fe1-5fa1-5d39-ac28-d03005729304
,https://www.nytimes.com/1859/02/21/archives/the-colchester-bank-case.html,,,1,The New York Times,[],"{'main': 'The Colchester Bank Case.', 'kicker': '1', 'content_kicker': None, 'print_headline': 'The Colchester Bank Case.', 'name': None, 'seo': None, 'sub': None}",[],1859-02-21T05:00:00+0000,article,None,Archives,"{'original': '', 'person': [], 'organization': None}",Archives,nyt://article/3fae259f-aa04-5fe9-88ee-4426f69b7d80,0,nyt://article/3fae259f-aa04-5fe9-88ee-4426f69b7d80
"The Democratic State Convention of Michigan. held Feb. 17 , passed the following resolution on Cuba; Resolved, That we deem the possession by this Government of the Island of Cuba desirable for the proper defence and protection of our great and rapidly-increasing commercial interests: that its acquisition wold not only greatly benefit the agricultural , mechanical and commercial interests of the whole country, but world put an end  ",https://www.nytimes.com/1859/02/21/archives/political.html,,,1,The New York Times,[],"{'main': 'Political.', 'kicker': '1', 'content_kicker': None, 'print_headline': 'Political.', 'name': None, 'seo': None, 'sub': None}",[],1859-02-21T05:00:00+0000,article,None,Archives,"{'original': '', 'person': [], 'organization': None}",Archives,nyt://article/4b27892e-e1e5-53bb-a921-f7243369c777,0,nyt://article/4b27892e-e1e5-53bb-a921-f7243369c777
"CROWELL.--In this City, on Sunday, Feb. 20, THEODORE CROWELL, Jr., Youngest son of Theodore and Abby S. Crowell, aged 2 years and 6 days. The relatives and friends are respectfully invited to ??tend the funeral this day, (Monday,) at 2 o'clock, from the residence of this parents, No. 139 Christopicterst. STORMS.--In this City, on Sunday morning, Feb. 20 at the residence of his set, Fienry H. Stories, JOHN STORMS,  ",https://www.nytimes.com/1859/02/21/archives/died.html,,,5,The New York Times,[],"{'main': 'DIED.', 'kicker': '1', 'content_kicker': None, 'print_headline': 'DIED.', 'name': None, 'seo': None, 'sub': None}",[],1859-02-21T05:00:00+0000,article,None,Archives,"{'original': '', 'person': [], 'organization': None}",Archives,nyt://article/4d0e668d-cfc1-5a97-b7e5-9b6c9e975ce4,0,nyt://article/4d0e668d-cfc1-5a97-b7e5-9b6c9e975ce4
"A LITTERATRUR GUILTY OF FORGERY.--The Hartford Press notices the arrest of Dr. LINUS P. BROCKETT, formerly of the firm of BROCKETT  HUTORIESON, booksellers, for forging the indorsement of ALLEN S. STILLNAN to a note for $500, which he had left with GEO. P. BISSELL  Co., bankers, a collateral for a loan. Dr. BROCKETT'S operations have been carried on for a long time, and involve a large amount of money.  ",https://www.nytimes.com/1859/02/21/archives/article-1-no-title.html,,,2,The New York Times,[],"{'main': 'Article 1 -- No Title', 'kicker': '1', 'content_kicker': None, 'print_headline': 'Article 1 -- No Title', 'name': None, 'seo': None, 'sub': None}",[],1859-02-21T05:00:00+0000,article,None,Archives,"{'original': '', 'person': [], 'organization': None}",Archives,nyt://article/51fe77f9-a026-503c-bb8b-0685e53c2512,0,nyt://article/51fe77f9-a026-503c-bb8b-0685e53c2512
"A number of Italian vagrants are under arrest in Pittsburg, charged with soliciting aid under false pretenses. They carry forged papers, setting forth their claims upon the sympathy of the public. The Gazette says: ""The Mayor learned from an intelligent and respectable Italian, that there is a regular system, which has its head-quarters in New-York, by which this swindling is carried on.  ",https://www.nytimes.com/1859/02/21/archives/miscellaneous.html,,,2,The New York Times,[],"{'main': 'MISCELLANEOUS.', 'kicker': '1', 'content_kicker': None, 'print_headline': 'MISCELLANEOUS.', 'name': None, 'seo': None, 'sub': None}",[],1859-02-21T05:00:00+0000,article,None,Archives,"{'original': '', 'person': [], 'organization': None}",Archives,nyt://article/54c3d187-7019-585f-b7f8-2b0b600e2779,0,nyt://article/54c3d187-7019-585f-b7f8-2b0b600e2779
"AFRICAN EXPLORATIONS.--At a recent meeting of the Royal Geographical Society, a communication from the notes of Captains BURTON and SPEKE on Lake Ujiji, in Central Africa, was read. These notes contained very brief accounts of the Eastern Exploring Expedition, and their arrival at and survey of the Lake Ujiji, which lies to the west of Zanzibar, and train the space occupied on the map is about 200 mites long and 27 mile broad.  ",https://www.nytimes.com/1859/02/21/archives/article-9-no-title.html,,,8,The New York Times,[],"{'main': 'Article 9 -- No Title', 'kicker': '1', 'content_kicker': None, 'print_headline': 'Article 9 -- No Title', 'name': None, 'seo': None, 'sub': None}",[],1859-02-21T05:00:00+0000,article,None,Archives,"{'original': '', 'person': [], 'organization': None}",Archives,nyt://article/56202db5-2e36-5be1-9891-03b890f0a651,0,nyt://article/56202db5-2e36-5be1-9891-03b890f0a651
"In steamship New-York, for Bremen and Southampton--Mr. and Mrs. Hermann D. Siefkes, Victor Gross A. Koop, George M. Howell, Robert Fleming Gourlay, all of New-York; J. W. Beck, Beltimore; James Jackson, England; Armand de Vigneraulx, Mexico; Jean de Simony, H. J. Zernecke, M. Frank, all of New-Orleans; J. F. J. Caldwell, Charleston;  ",https://www.nytimes.com/1859/02/21/archives/passengers-sailed.html,,,8,The New York Times,[],"{'main': 'Passengers Sailed.', 'kicker': '1', 'content_kicker': None, 'print_headline': 'Passengers Sailed.', 'name': None, 'seo': None, 'sub': None}",[],1859-02-21T05:00:00+0000,article,None,Archives,"{'original': '', 'person': [], 'organization': None}",Archives,nyt://article/598d941f-4172-525a-b9be-091157829b4b,0,nyt://article/598d941f-4172-525a-b9be-091157829b4b
"THE ""WANDERER"" INDICTMENTS.--The Charleston Mercury states, in relation to the indictments against the parties concerned in the Wanderer affair, that two indictments were returned against each person, one in the Georgia Judicial District, and the Other in the United Stated District. Each indictment contains ten or twelve counts.  ",https://www.nytimes.com/1859/02/21/archives/article-13-no-title.html,,,8,The New York Times,[],"{'main': 'Article 13 -- No Title', 'kicker': '1', 'content_kicker': None, 'print_headline': 'Article 13 -- No Title', 'name': None, 'seo': None, 'sub': None}",[],1859-02-21T05:00:00+0000,article,None,Archives,"{'original': '', 'person': [], 'organization': None}",Archives,nyt://article/618cf7d9-1796-5f12-b204-97e29ced06f7,0,nyt://article/618cf7d9-1796-5f12-b204-97e29ced06f7
,https://www.nytimes.com/1859/02/21/archives/the-ohio-legislature.html,,,1,The New York Times,[],"{'main': 'The Ohio Legislature.', 'kicker': '1', 'content_kicker': None, 'print_headline': 'The Ohio Legislature.', 'name': None, 'seo': None, 'sub': None}",[],1859-02-21T05:00:00+0000,article,None,Archives,"{'original': '', 'person': [], 'organization': None}",Archives,nyt://article/6207b2ca-fb74-54bd-a403-b1dba1654638,0,nyt://article/6207b2ca-fb74-54bd-a403-b1dba1654638
,https://www.nytimes.com/1859/02/21/archives/miniature-almanacthis-day.html,,,8,The New York Times,[],"{'main': 'MINIATURE ALMANAC--THIS DAY.', 'kicker': '1', 'content_kicker': None, 'print_headline': 'MINIATURE ALMANAC--THIS DAY.', 'name': None, 'seo': None, 'sub': None}",[],1859-02-21T05:00:00+0000,article,None,Archives,"{'original': '', 'person': [], 'organization': None}",Archives,nyt://article/65612b9e-a7d6-5958-8395-31732b0d3988,0,nyt://article/65612b9e-a7d6-5958-8395-31732b0d3988
"VIRGINIA AND THE ""PAN-HANDLE."" --At a recent meeting of the Western Pennsylvania Historical Society, held in Pitisburg, Mr. JAMES VEETCH Produced documents to invariable the title of Virginia to that part of her territory known as the ""Pan-handle."" He contended that the character of 1620 did not give to Virginia the right to territory.  ",https://www.nytimes.com/1859/02/21/archives/article-12-no-title.html,,,8,The New York Times,[],"{'main': 'Article 12 -- No Title', 'kicker': '1', 'content_kicker': None, 'print_headline': 'Article 12 -- No Title', 'name': None, 'seo': None, 'sub': None}",[],1859-02-21T05:00:00+0000,article,None,Archives,"{'original': '', 'person': [], 'organization': None}",Archives,nyt://article/6f9b7fa2-ead9-5303-a751-ba030dcfd120,0,nyt://article/6f9b7fa2-ead9-5303-a751-ba030dcfd120
"To-day has been witnessed the closing scene in the Territorial Assembly. They adjourned to night at midnight. The usual bustle and confusion incident to the last hours of a stormy session have been witnessed. Every bill of importance has been signed by the Governor, except the one prohibiting Slavery in this Territory. That was a very important measure, and the Governor still holds it in his pocket.  ",https://www.nytimes.com/1859/02/21/archives/from-kansas-adjournment-of-the-legislature.html,,,1,The New York Times,[],"{'main': 'FROM KANSAS.; Adjournment of the Legislature.', 'kicker': '1', 'content_kicker': None, 'print_headline': 'FROM KANSAS.; Adjournment of the Legislature.', 'name': None, 'seo': None, 'sub': None}",[],1859-02-21T05:00:00+0000,article,None,Archives,"{'original': '', 'person': [], 'organization': None}",Archives,nyt://article/745c57d9-2d34-5de5-ab10-8be84d851ae4,0,nyt://article/745c57d9-2d34-5de5-ab10-8be84d851ae4
"THE ROCK ISLAND BRIDGE CONDEMNED--SUITS AGAINST THE COMPANY.--AMOS STILLMAN, City Engineer of Rock Island, Ill., has tiled an atlidavit in the office of the Clerk of the County of Rock Island, to the effect that the Rock Island Railroad bridges unsafe for the passage of trains.  ",https://www.nytimes.com/1859/02/21/archives/article-10-no-title.html,,,8,The New York Times,[],"{'main': 'Article 10 -- No Title', 'kicker': '1', 'content_kicker': None, 'print_headline': 'Article 10 -- No Title', 'name': None, 'seo': None, 'sub': None}",[],1859-02-21T05:00:00+0000,article,None,Archives,"{'original': '', 'person': [], 'organization': None}",Archives,nyt://article/756f1c4f-83b9-579b-b10e-369c47c9b3ef,0,nyt://article/756f1c4f-83b9-579b-b10e-369c47c9b3ef
"OPERATIONS AT HARVARD OBSERVATORY.--The Committee appointed to visit Harvard Observatory, Messrs. Mitchell, Quincy, Winthrop, Bowditeh, and others, have made their report upon its condition. They state that observations for the revision of the position and magnitude of the stars in the interesting Nebula of Orion, were commenced in October, 1857, and brought to a close in March, 1858.  ",https://www.nytimes.com/1859/02/21/archives/article-7-no-title.html,,,8,The New York Times,[],"{'main': 'Article 7 -- No Title', 'kicker': '1', 'content_kicker': None, 'print_headline': 'Article 7 -- No Title', 'name': None, 'seo': None, 'sub': None}",[],1859-02-21T05:00:00+0000,article,None,Archives,"{'original': '', 'person': [], 'organization': None}",Archives,nyt://article/78f4047b-23e5-5351-8e30-93199a1964e3,0,nyt://article/78f4047b-23e5-5351-8e30-93199a1964e3
"There is no longer room for doubt in respect to the discovery of an important gold region this side the Rocky Mountains. When the accounts from Pike's Peak were first published, they were regarded with no little scepticism, particularly in the Eastern States. California itself encountered. the same sort of unbelief in the earlier days of its golden age.  ",https://www.nytimes.com/1859/02/21/archives/a-new-california.html,,,4,The New York Times,[],"{'main': 'A New California.', 'kicker': '1', 'content_kicker': None, 'print_headline': 'A New California.', 'name': None, 'seo': None, 'sub': None}",[],1859-02-21T05:00:00+0000,article,None,Archives,"{'original': '', 'person': [], 'organization': None}",Archives,nyt://article/81a25500-0ce4-5e75-84bb-8360e6c403f2,0,nyt://article/81a25500-0ce4-5e75-84bb-8360e6c403f2
,https://www.nytimes.com/1859/02/21/archives/railroads.html,,,7,The New York Times,[],"{'main': 'RAILROADS.', 'kicker': '1', 'content_kicker': None, 'print_headline': 'RAILROADS.', 'name': None, 'seo': None, 'sub': None}",[],1859-02-21T05:00:00+0000,article,None,Archives,"{'original': '', 'person': [], 'organization': None}",Archives,nyt://article/831a6fff-448a-5613-99d0-b12c986a9dd7,0,nyt://article/831a6fff-448a-5613-99d0-b12c986a9dd7
"In steamship Alabama, from Savannah--H. C. C. Brown, John Watson, J. J. Watkins, R. A. Beers, E. J. Mulkay, W. C. Zimmerman, J. E. Burnett, J. J. Land, J. C. Deaffrafiermerd, J. Center, J. L. Wilson, J. W. C. Gilrey, P. J. Snail, A. Vislte, R. Warneck, Mr. Eaken, S. Pate, D. B. Crocker, Dr. C. White, Miss M. McGroney, Mrs. Mary Kion, Prof. N. G. Clark, A. J. White.  ",https://www.nytimes.com/1859/02/21/archives/passengers-arrived.html,,,8,The New York Times,[],"{'main': 'Passengers Arrived.', 'kicker': '1', 'content_kicker': None, 'print_headline': 'Passengers Arrived.', 'name': None, 'seo': None, 'sub': None}",[],1859-02-21T05:00:00+0000,article,None,Archives,"{'original': '', 'person': [], 'organization': None}",Archives,nyt://article/85e7ce9f-d4f2-57fd-bf08-dd4f215ee6c2,0,nyt://article/85e7ce9f-d4f2-57fd-bf08-dd4f215ee6c2
"Since my last, of only a few days ago, nothing of much importance to your readers has occurred here. In domestic affairs we have the same wordy war in the journals which has so long wearied every sensible person who would desire to study the polities of these agitated countries; for instead of reasons or knowledge which could convince onproselytize, all discussion here has long since left dignity behind and descended  ",https://www.nytimes.com/1859/02/21/archives/the-paraguay-expedition-movements-of-the-american-commissioner.html,,,1,The New York Times,[],"{'main': 'THE PARAGUAY EXPEDITION.; Movements of the American Commissioner.', 'kicker': '1', 'content_kicker': None, 'print_headline': 'THE PARAGUAY EXPEDITION.; Movements of the American Commissioner.', 'name': None, 'seo': None, 'sub': None}",[],1859-02-21T05:00:00+0000,article,None,Archives,"{'original': '', 'person': [], 'organization': None}",Archives,nyt://article/8fbd2f7c-66a3-5351-95a0-8e6953a2b73a,0,nyt://article/8fbd2f7c-66a3-5351-95a0-8e6953a2b73a
"Important dispatches have been received by the State Department from the Hon. WM. M. CHURCH-WELL, of Tennessee, who was some time ago sent out to Mexico as the Special Agent of the Government, to ascertain as nearly as possible the precise condition of affairs in that agitated country.  ",https://www.nytimes.com/1859/02/21/archives/news-of-the-day.html,,,4,The New York Times,[],"{'main': 'NEWS OF THE DAY.', 'kicker': '1', 'content_kicker': None, 'print_headline': 'NEWS OF THE DAY.', 'name': None, 'seo': None, 'sub': None}",[],1859-02-21T05:00:00+0000,article,None,Archives,"{'original': '', 'person': [], 'organization': None}",Archives,nyt://article/8fe1bf65-470f-56c3-8ee7-59b63890bbbc,0,nyt://article/8fe1bf65-470f-56c3-8ee7-59b63890bbbc
"MORE OF THE EVILS OF SPIRITUALISM--THE FREE-LOVE ELEMENT--We find the following in the Cleveland Herald : There is a neighborhood in Summit County, and we think in the township of Stow, called Darrow-street. That locality has been age of the most celebrated on the Reserve for believers in Spiritualism.  ",https://www.nytimes.com/1859/02/21/archives/article-14-no-title.html,,,8,The New York Times,[],"{'main': 'Article 14 -- No Title', 'kicker': '1', 'content_kicker': None, 'print_headline': 'Article 14 -- No Title', 'name': None, 'seo': None, 'sub': None}",[],1859-02-21T05:00:00+0000,article,None,Archives,"{'original': '', 'person': [], 'organization': None}",Archives,nyt://article/91e8253b-f07e-5d5b-9db4-e940e45773da,0,nyt://article/91e8253b-f07e-5d5b-9db4-e940e45773da
,https://www.nytimes.com/1859/02/21/archives/marine-intelligence.html,,,8,The New York Times,[],"{'main': 'MARINE INTELLIGENCE.', 'kicker': '1', 'content_kicker': None, 'print_headline': 'MARINE INTELLIGENCE.', 'name': None, 'seo': None, 'sub': None}",[],1859-02-21T05:00:00+0000,article,None,Archives,"{'original': '', 'person': [], 'organization': None}",Archives,nyt://article/926e96d8-d58d-5265-9bd2-7091978b44bb,0,nyt://article/926e96d8-d58d-5265-9bd2-7091978b44bb
"Dr. JOSE W. SMITH, of Acapulco, has arrived here from Mexico with highly important dispatches, and is stopping at WILLARD'S Hotel. He is the personal friend of General ALVAREZ, who is now ready for the field with six thousand men, if he had arms and ammunition. He converses freely and frankly relative to affairs in Mexico.  ",https://www.nytimes.com/1859/02/21/archives/news-by-telegraph-interesting-from-washington-mexican.html,,,1,The New York Times,[],"{'main': ""NEWS BY TELEGRAPH.; INTERESTING FROM WASHINGTON. Mexican Affairs--Necessity for Recognizing the Juarez Government--Effect of the President's Special Message--The Investigating Committees--The Tariff--The Illinois Marshalship Case, &c."", 'kicker': '1', 'content_kicker': None, 'print_headline': ""NEWS BY TELEGRAPH.; INTERESTING FROM WASHINGTON. Mexican Affairs--Necessity for Recognizing the Juarez Government--Effect of the President's Special Message--The Investigating Committees--The Tariff--The Illinois Marshalship Case, &c."", 'name': None, 'seo': None, 'sub': None}",[],1859-02-21T05:00:00+0000,article,None,Archives,"{'original': '', 'person': [], 'organization': None}",Archives,nyt://article/94f27da8-6afe-5740-a5ca-b31d37ecdb7c,0,nyt://article/94f27da8-6afe-5740-a5ca-b31d37ecdb7c
,https://www.nytimes.com/1859/02/21/archives/front-page-1-no-title.html,,,1,The New York Times,[],"{'main': 'Front Page 1 -- No Title', 'kicker': '1', 'content_kicker': None, 'print_headline': 'Front Page 1 -- No Title', 'name': None, 'seo': None, 'sub': None}",[],1859-02-21T05:00:00+0000,article,None,Archives,"{'original': '', 'person': [], 'organization': None}",Archives,nyt://article/a22c7ef8-6e56-586e-8e24-ef27564b0ac2,0,nyt://article/a22c7ef8-6e56-586e-8e24-ef27564b0ac2
"ARRIVAL OF THE OVERLAND MAIL AT ST. LOUIS. The Overland Mail at St. Louis brings San Francisco dates to Jan. 24, three days later than previous accounts, and four days later than the last steamer's news. The Sate of California, by the Attorney-General, had commenced fourteen suites in the Twelfth District Court on the 22d uit., against the auctioneers of  ",https://www.nytimes.com/1859/02/21/archives/three-days-later-from-california.html,,,1,The New York Times,[],"{'main': 'Three Days Later from California.', 'kicker': '1', 'content_kicker': None, 'print_headline': 'Three Days Later from California.', 'name': None, 'seo': None, 'sub': None}",[],1859-02-21T05:00:00+0000,article,None,Archives,"{'original': '', 'person': [], 'organization': None}",Archives,nyt://article/a45228ad-a75d-55fa-98d9-951ec9bc259d,0,nyt://article/a45228ad-a75d-55fa-98d9-951ec9bc259d
CONGRESSIONAL MANNERS IN THE INDIANA LEGISLATURE--FIGHT IN THE SENATE.--The Indianapolis correspondent of the Cincinnati Commercial describes a fracas which occurred in the Senate Chamber Feb. 15. It arose from an old fend between Senators' HEFFRFN and GOODING. The antagonism of Lecomptonism and Anti-Lecomptonism ealminated in the two champions.  ,https://www.nytimes.com/1859/02/21/archives/article-5-no-title.html,,,5,The New York Times,[],"{'main': 'Article 5 -- No Title', 'kicker': '1', 'content_kicker': None, 'print_headline': 'Article 5 -- No Title', 'name': None, 'seo': None, 'sub': None}",[],1859-02-21T05:00:00+0000,article,None,Archives,"{'original': '', 'person': [], 'organization': None}",Archives,nyt://article/a7bd5502-5ace-542c-a4b5-aa7ffcc6f673,0,nyt://article/a7bd5502-5ace-542c-a4b5-aa7ffcc6f673
,https://www.nytimes.com/1859/02/21/archives/massachusetts-legislature.html,,,1,The New York Times,[],"{'main': 'Massachusetts Legislature..', 'kicker': '1', 'content_kicker': None, 'print_headline': 'Massachusetts Legislature..', 'name': None, 'seo': None, 'sub': None}",[],1859-02-21T05:00:00+0000,article,None,Archives,"{'original': '', 'person': [], 'organization': None}",Archives,nyt://article/a84bf156-769b-554b-9d1c-90cb00248018,0,nyt://article/a84bf156-769b-554b-9d1c-90cb00248018
"Senator DOUGLAS is a candidate for the Prcsidency, and in that capacity probably finds, or fancies, it necessary to do a good many things repugnant to his own judgment. Naturally enough, he desires to maintain his standing as a Democrat, and to signalize his orthodoxy by what we cannot help regarding as an excessive and not very creditable subserviency to the Executive.  ",https://www.nytimes.com/1859/02/21/archives/wanteda-leader.html,,,4,The New York Times,[],"{'main': 'Wanted--A Leader.', 'kicker': '1', 'content_kicker': None, 'print_headline': 'Wanted--A Leader.', 'name': None, 'seo': None, 'sub': None}",[],1859-02-21T05:00:00+0000,article,None,Archives,"{'original': '', 'person': [], 'organization': None}",Archives,nyt://article/aba8b989-fdd8-53f2-b0f0-7998c6117def,0,nyt://article/aba8b989-fdd8-53f2-b0f0-7998c6117def
"There are three Port Warden bills in the hands of one of the House's standing committees. The one for which Mr. Port Warden BELLER is the most earnest friend, alters the existing law in the following respects: SECTION 1. Makes the Board consist of six instead of nine men. The following provision it abolishes, to wit: ""One of whom shall be a resident of Brooklyn,  ",https://www.nytimes.com/1859/02/21/archives/affairs-at-albany-three-port-warden-bills-threateningthe-proposed.html,,,2,The New York Times,[],"{'main': 'AFFAIRS AT ALBANY.; Three Port Warden Bills Threatening--The Proposed Increase of Wharfage--Cold Comfort for Sepoys--Brooklyn Bills Forwarded--The Contested Seat in the Senate--Swill Milk, &c., &c., &c.', 'kicker': '1', 'content_kicker': None, 'print_headline': 'AFFAIRS AT ALBANY.; Three Port Warden Bills Threatening--The Proposed Increase of Wharfage--Cold Comfort for Sepoys--Brooklyn Bills Forwarded--The Contested Seat in the Senate--Swill Milk, &c., &c., &c.', 'name': None, 'seo': None, 'sub': None}",[],1859-02-21T05:00:00+0000,article,None,Archives,"{'original': '', 'person': [], 'organization': None}",Archives,nyt://article/b0269bec-cd6e-5d18-8b10-f1deb4fcffe0,0,nyt://article/b0269bec-cd6e-5d18-8b10-f1deb4fcffe0
"The French projectors of a canal through Nicaragua have demonstrated, to the satisfaction of capitalists, the physical possibilities of a cut through the Isthmus. They have ascertained the exact amount of lockage necessary to carry the largest ship to the level of Lake Nicaragua, and to let it down upon the opposite side.  ",https://www.nytimes.com/1859/02/21/archives/a-dead-lock-in-the-nicaragua-canal.html,,,4,The New York Times,[],"{'main': 'A Dead Lock in the Nicaragua Canal.', 'kicker': '1', 'content_kicker': None, 'print_headline': 'A Dead Lock in the Nicaragua Canal.', 'name': None, 'seo': None, 'sub': None}",[],1859-02-21T05:00:00+0000,article,None,Archives,"{'original': '', 'person': [], 'organization': None}",Archives,nyt://article/b908a883-f202-5eec-b146-a26dca57d644,0,nyt://article/b908a883-f202-5eec-b146-a26dca57d644
"MORTALITY.--The Health Officer reports 97 deaths as the total for the week ending Saturday last. They are classified as follows: Men, 14; women--; boys, 26; girls, 31; adults, 40; children, 59; males, 42; females, 55; colored persons, 2; 20, or about one-fifth of the whole, were more than 50 years old, and 58, or about three-fifths, were under 21 years of age; one at least died of old age; 71 were natives.  ",https://www.nytimes.com/1859/02/21/archives/brooklyn-intelligence.html,,,5,The New York Times,[],"{'main': 'BROOKLYN INTELLIGENCE.', 'kicker': '1', 'content_kicker': None, 'print_headline': 'BROOKLYN INTELLIGENCE.', 'name': None, 'seo': None, 'sub': None}",[],1859-02-21T05:00:00+0000,article,None,Archives,"{'original': '', 'person': [], 'organization': None}",Archives,nyt://article/be6e68a3-5d47-5329-818c-4e8bc13ef37e,0,nyt://article/be6e68a3-5d47-5329-818c-4e8bc13ef37e
,https://www.nytimes.com/1859/02/21/archives/insurance.html,,,7,The New York Times,[],"{'main': 'INSURANCE.', 'kicker': '1', 'content_kicker': None, 'print_headline': 'INSURANCE.', 'name': None, 'seo': None, 'sub': None}",[],1859-02-21T05:00:00+0000,article,None,Archives,"{'original': '', 'person': [], 'organization': None}",Archives,nyt://article/c6479c4c-4ddb-568b-b093-5676cbc4f3a8,0,nyt://article/c6479c4c-4ddb-568b-b093-5676cbc4f3a8
,https://www.nytimes.com/1859/02/21/archives/married.html,,,5,The New York Times,[],"{'main': 'MARRIED.', 'kicker': '1', 'content_kicker': None, 'print_headline': 'MARRIED.', 'name': None, 'seo': None, 'sub': None}",[],1859-02-21T05:00:00+0000,article,None,Archives,"{'original': '', 'person': [], 'organization': None}",Archives,nyt://article/c987831b-0974-5c10-97b4-5cd24dd24b5b,0,nyt://article/c987831b-0974-5c10-97b4-5cd24dd24b5b
