abstract,web_url,snippet,lead_paragraph,print_page,source,multimedia,headline,keywords,pub_date,document_type,news_desk,section_name,byline,type_of_material,_id,word_count,uri
"MILES--DOWING.--In this City, on Tuesday. Feb. 1, by the Rev. T. J. Sawyer. WILLIAM B. MILES to MARTHA M., daughter of the late Isaac Downing, all of this City. BOND--THOMAS.--In this City, on Thursday, Feb. 3. at Trinity Church, by the Rev. Dr. Iligbee, JOHN BOYD to SARAH A . THOMAS, all of this City.  ",https://www.nytimes.com/1859/02/07/archives/married.html,,,5,The New York Times,[],"{'main': 'MARRIED', 'kicker': '1', 'content_kicker': None, 'print_headline': 'MARRIED', 'name': None, 'seo': None, 'sub': None}",[],1859-02-07T05:00:00+0000,article,None,Archives,"{'original': '', 'person': [], 'organization': None}",Archives,nyt://article/abafe524-7fc8-51b8-9a4c-3391c31401f5,0,nyt://article/abafe524-7fc8-51b8-9a4c-3391c31401f5
,https://www.nytimes.com/1859/02/07/archives/insurance.html,,,6,The New York Times,[],"{'main': 'INSURANCE.', 'kicker': '1', 'content_kicker': None, 'print_headline': 'INSURANCE.', 'name': None, 'seo': None, 'sub': None}",[],1859-02-07T05:00:00+0000,article,None,Archives,"{'original': '', 'person': [], 'organization': None}",Archives,nyt://article/b234b76f-c2e6-5329-93da-a121aa52d293,0,nyt://article/b234b76f-c2e6-5329-93da-a121aa52d293
"At about three o'clock this morning a fire broke out in the upper portion of RUSSELL'S mechanical bakery, corner of Battery and Commercial-streets, which was totally destroyed. The building was o brick with a granite front,  ",https://www.nytimes.com/1859/02/07/archives/great-fire-in-bostonloss-of-life.html,,,8,The New York Times,[],"{'main': 'Great Fire in Boston--Loss of Life.', 'kicker': '1', 'content_kicker': None, 'print_headline': 'Great Fire in Boston--Loss of Life.', 'name': None, 'seo': None, 'sub': None}",[],1859-02-07T05:00:00+0000,article,None,Archives,"{'original': '', 'person': [], 'organization': None}",Archives,nyt://article/bdd1e0e5-5941-5d2d-8ae5-0caec2a99a89,0,nyt://article/bdd1e0e5-5941-5d2d-8ae5-0caec2a99a89
"On Saturday evening Miss LAURA KEENE commemorated the hundredth performance of ""Our American Cousin."" The house was decorated with flowers as artificial as the Cousin in question; each lady was presented with a piece of music by Mr. ?? and a display of fireworks completed the brilliant ?? of the occasion.  ",https://www.nytimes.com/1859/02/07/archives/amusements.html,,,4,The New York Times,[],"{'main': 'Amusements.', 'kicker': '1', 'content_kicker': None, 'print_headline': 'Amusements.', 'name': None, 'seo': None, 'sub': None}",[],1859-02-07T05:00:00+0000,article,None,Archives,"{'original': '', 'person': [], 'organization': None}",Archives,nyt://article/c16d7156-ae6e-53c5-9d2c-85bd934609f6,0,nyt://article/c16d7156-ae6e-53c5-9d2c-85bd934609f6
"AMERICAN PROJECT OF LIGHTING PONCE WITH GAS. The Havana Diario receives a copy of the ?? of Ponce, Jan. 15, which it finds nothing of interest, save an article devoted to the project of a Company for lighting that town with gas. The following are extracts from the Fonix editorial:  ",https://www.nytimes.com/1859/02/07/archives/from-porto-rico.html,,,1,The New York Times,[],"{'main': 'From Porto Rico.', 'kicker': '1', 'content_kicker': None, 'print_headline': 'From Porto Rico.', 'name': None, 'seo': None, 'sub': None}",[],1859-02-07T05:00:00+0000,article,None,Archives,"{'original': '', 'person': [], 'organization': None}",Archives,nyt://article/c410485a-86f5-52f3-a78d-e348a39d60e9,0,nyt://article/c410485a-86f5-52f3-a78d-e348a39d60e9
To the Editor of the New-York Times: I am sorry to see in yesterday's TIMES that the Aldermen of New-York are going to mutilate the best paved street in the word (I believe.) I will give u suggestion for making the pavement as good and safe footed for the horses as when first paved.  ,https://www.nytimes.com/1859/02/07/archives/how-to-improve-the-brondway-payment.html,,,2,The New York Times,[],"{'main': 'How to Improve the Brondway Payment.', 'kicker': '1', 'content_kicker': None, 'print_headline': 'How to Improve the Brondway Payment.', 'name': None, 'seo': None, 'sub': None}",[],1859-02-07T05:00:00+0000,article,None,Archives,"{'original': '', 'person': [], 'organization': None}",Archives,nyt://article/c5508540-9b04-579c-8a7e-1d0f6602494e,0,nyt://article/c5508540-9b04-579c-8a7e-1d0f6602494e
"THE CITY MILITARY IN TROUBLE--Considerable feeling exists among the members of the Seventh Regiment in regard to the dismissal of JOHN A. HALL, an enlisted man doing duty in Company C, Captain PRICE, by Colonel DURYEA.  ",https://www.nytimes.com/1859/02/07/archives/city-intelligence.html,,,4,The New York Times,[],"{'main': 'CITY INTELLIGENCE.', 'kicker': '2', 'content_kicker': None, 'print_headline': 'CITY INTELLIGENCE.', 'name': None, 'seo': None, 'sub': None}",[],1859-02-07T05:00:00+0000,article,None,Archives,"{'original': '', 'person': [], 'organization': None}",Archives,nyt://article/ccc6bd93-7966-5869-96fe-fd1287e39726,0,nyt://article/ccc6bd93-7966-5869-96fe-fd1287e39726
,https://www.nytimes.com/1859/02/07/archives/the-bark-vernon.html,,,8,The New York Times,[],"{'main': 'The Bark Vernon.', 'kicker': '1', 'content_kicker': None, 'print_headline': 'The Bark Vernon.', 'name': None, 'seo': None, 'sub': None}",[],1859-02-07T05:00:00+0000,article,None,Archives,"{'original': '', 'person': [], 'organization': None}",Archives,nyt://article/cff29926-c224-5e9e-8055-a9d1f8ebde0f,0,nyt://article/cff29926-c224-5e9e-8055-a9d1f8ebde0f
"CONGRESSIONAL NOMINATION IN CONNECTICUT. ALFRED A. BURNHAM, of Windham, was nominated on Wednesday as the Republican candidate for member of Congress from the Third District of Connecticut, in place of SIDNEY DEAN, also a Republican.  ",https://www.nytimes.com/1859/02/07/archives/article-9-no-title.html,,,8,The New York Times,[],"{'main': 'Article 9 -- No Title', 'kicker': '1', 'content_kicker': None, 'print_headline': 'Article 9 -- No Title', 'name': None, 'seo': None, 'sub': None}",[],1859-02-07T05:00:00+0000,article,None,Archives,"{'original': '', 'person': [], 'organization': None}",Archives,nyt://article/d2f56114-8bab-5302-9377-d770f35980df,0,nyt://article/d2f56114-8bab-5302-9377-d770f35980df
"To the editor of the New-York Times: The Editor f te NEW-YORK TIMES is respectfully requested to enlighen sme of is aged eaders on the subejct of military commutation and exemption. To-day a notice was left at my house, where I have  ",https://www.nytimes.com/1859/02/07/archives/military-commntation-and-exemption.html,,,2,The New York Times,[],"{'main': 'Military Commntation and Exemption', 'kicker': '1', 'content_kicker': None, 'print_headline': 'Military Commntation and Exemption', 'name': None, 'seo': None, 'sub': None}",[],1859-02-07T05:00:00+0000,article,None,Archives,"{'original': '', 'person': [], 'organization': None}",Archives,nyt://article/d5e4381c-f51e-5842-9b38-4d7ab663d2bf,0,nyt://article/d5e4381c-f51e-5842-9b38-4d7ab663d2bf
"RIDER.--In this City, on Saturday morning, Feb. 5, CHRISTOPHER RIDER. in the 69th year of his age. The friends of the family, and of his nephews. E. G. Burling and Samuel Osgood, are respectfully invited to attend his funeral. this day. (Monday.) at 1 1/2 o'clock P. M., from No. 217 West 19th st., dear the 8th av.  ",https://www.nytimes.com/1859/02/07/archives/died.html,,,5,The New York Times,[],"{'main': 'DIED.', 'kicker': '1', 'content_kicker': None, 'print_headline': 'DIED.', 'name': None, 'seo': None, 'sub': None}",[],1859-02-07T05:00:00+0000,article,None,Archives,"{'original': '', 'person': [], 'organization': None}",Archives,nyt://article/d8256414-ff26-5ae2-93e4-67c9a6bfe570,0,nyt://article/d8256414-ff26-5ae2-93e4-67c9a6bfe570
"The intelligence from Mexico, which we publish this morning, will be found extremely interesting, though it does not indicate any prospect of an charily solution of the difficult questions which embarrass that unhappy country.  ",https://www.nytimes.com/1859/02/07/archives/news-from-mexico.html,,,4,The New York Times,[],"{'main': 'News from Mexico.', 'kicker': '1', 'content_kicker': None, 'print_headline': 'News from Mexico.', 'name': None, 'seo': None, 'sub': None}",[],1859-02-07T05:00:00+0000,article,None,Archives,"{'original': '', 'person': [], 'organization': None}",Archives,nyt://article/e5139a0e-bff2-5c39-8454-29ca9d695745,0,nyt://article/e5139a0e-bff2-5c39-8454-29ca9d695745
"Lemuel Shattuck, Esq., a well known statistician and historical writer of Massachusetts, recently died at Boston, in his sixty-sixth year. The deceased in 1818 organized at Detroit the first Sabbath School ever opened in the State of Miehigan, and was its Superintendent four years.  ",https://www.nytimes.com/1859/02/07/archives/obituary.html,,,3,The New York Times,[],"{'main': 'OBITUARY', 'kicker': '1', 'content_kicker': None, 'print_headline': 'OBITUARY', 'name': None, 'seo': None, 'sub': None}",[],1859-02-07T05:00:00+0000,article,None,Archives,"{'original': '', 'person': [], 'organization': None}",Archives,nyt://article/e727e735-bc0e-5472-8092-75259eb97bfa,0,nyt://article/e727e735-bc0e-5472-8092-75259eb97bfa
"As the session draws to a closea good deal of anxiety is manifested in reference to the fate of the steam lincs whose contracts expire in October, for carrying the mails to California.The Pacific Mail Company, who have most at stake is in great trouble.  ",https://www.nytimes.com/1859/02/07/archives/the-california-mail-servicecontest-of-the-different-lines-to-the.html,,,2,The New York Times,[],"{'main': 'The California Mail Service--Contest of the Different Lines.; To the Editor of the New-York Times:', 'kicker': '1', 'content_kicker': None, 'print_headline': 'The California Mail Service--Contest of the Different Lines.; To the Editor of the New-York Times:', 'name': None, 'seo': None, 'sub': None}",[],1859-02-07T05:00:00+0000,article,None,Archives,"{'original': '', 'person': [], 'organization': None}",Archives,nyt://article/e836bb7a-449f-5061-a7e7-2e790244cad5,0,nyt://article/e836bb7a-449f-5061-a7e7-2e790244cad5
,https://www.nytimes.com/1859/02/07/archives/movements-of-ocean-steamers.html,,,8,The New York Times,[],"{'main': 'Movements of Ocean Steamers.', 'kicker': '1', 'content_kicker': None, 'print_headline': 'Movements of Ocean Steamers.', 'name': None, 'seo': None, 'sub': None}",[],1859-02-07T05:00:00+0000,article,None,Archives,"{'original': '', 'person': [], 'organization': None}",Archives,nyt://article/e91ddbb6-5829-5e39-9fb9-ecc90ec68518,0,nyt://article/e91ddbb6-5829-5e39-9fb9-ecc90ec68518
"To the Editor of the New-York Times: We are all in a state of terror here, and I learn that the inhabitants of Rye, Mamaroneck and Green wich are in quite as unpleasant a condition. I don't know what the result will be, but I seriously apprehend a stampede of the entire population of this section of country, unless there is a change for the better very soon.  ",https://www.nytimes.com/1859/02/07/archives/terrible-excitement-in-port-chester-rye-and-mamaroneck-wolyes-and.html,,,5,The New York Times,[],"{'main': 'Terrible Excitement in Port Chester, Rye and Mamaroneck.; WOLYES AND HYENAS PROWLING ABOUT--RUMOR THAT A MOTHER AND CHILD HAVE BEEN DEYOURED.', 'kicker': '1', 'content_kicker': None, 'print_headline': 'Terrible Excitement in Port Chester, Rye and Mamaroneck.; WOLYES AND HYENAS PROWLING ABOUT--RUMOR THAT A MOTHER AND CHILD HAVE BEEN DEYOURED.', 'name': None, 'seo': None, 'sub': None}",[],1859-02-07T05:00:00+0000,article,None,Archives,"{'original': '', 'person': [], 'organization': None}",Archives,nyt://article/ecbe6a2c-2f53-52b7-9642-6adff3e84f64,0,nyt://article/ecbe6a2c-2f53-52b7-9642-6adff3e84f64
"DOMINICAN REPUBLIC.--President SANTANA has just issued a decree prohibiting foreign vessels, after July 1, 1859, Participating is the coastwise trade of the Republic. The only exceptions are in favor of ports of difficult access: which are Barburuco,  ",https://www.nytimes.com/1859/02/07/archives/article-7-no-title.html,,,5,The New York Times,[],"{'main': 'Article 7 -- No Title', 'kicker': '1', 'content_kicker': None, 'print_headline': 'Article 7 -- No Title', 'name': None, 'seo': None, 'sub': None}",[],1859-02-07T05:00:00+0000,article,None,Archives,"{'original': '', 'person': [], 'organization': None}",Archives,nyt://article/f440cc06-205d-5ee4-bbeb-b5b92face9e4,0,nyt://article/f440cc06-205d-5ee4-bbeb-b5b92face9e4
ANOTHER VIRGINIA INSURRECTION.--There seems to be a very active and formidable rebellion on foot in Virginia against the National Administration. Both the leading organs of the Democratic Party at Richmond denounce the policy of the President with great vehemence.  ,https://www.nytimes.com/1859/02/07/archives/article-2-no-title.html,,,4,The New York Times,[],"{'main': 'Article 2 -- No Title', 'kicker': '1', 'content_kicker': None, 'print_headline': 'Article 2 -- No Title', 'name': None, 'seo': None, 'sub': None}",[],1859-02-07T05:00:00+0000,article,None,Archives,"{'original': '', 'person': [], 'organization': None}",Archives,nyt://article/fbaec62f-cf00-51bf-b223-7ff568173b24,0,nyt://article/fbaec62f-cf00-51bf-b223-7ff568173b24
"The Republican publishes a letter from Salt Lake, 14th inst., stating that Judges SINULAIR and CHADBAUGH will leave the Territory in the Spring, satisfied that their presence as Federal officers in administering laws is merely farcical.  ",https://www.nytimes.com/1859/02/07/archives/from-utah.html,,,8,The New York Times,[],"{'main': 'From Utah.', 'kicker': '1', 'content_kicker': None, 'print_headline': 'From Utah.', 'name': None, 'seo': None, 'sub': None}",[],1859-02-07T05:00:00+0000,article,None,Archives,"{'original': '', 'person': [], 'organization': None}",Archives,nyt://article/fc76e3fe-334b-5513-b7ba-45ac688f5a66,0,nyt://article/fc76e3fe-334b-5513-b7ba-45ac688f5a66
,https://www.nytimes.com/1859/02/08/archives/the-adams-express-robbery.html,,,5,The New York Times,[],"{'main': ""The Adams' Express Robbery."", 'kicker': '1', 'content_kicker': None, 'print_headline': ""The Adams' Express Robbery."", 'name': None, 'seo': None, 'sub': None}",[],1859-02-08T05:00:00+0000,article,None,Archives,"{'original': '', 'person': [], 'organization': None}",Archives,nyt://article/00351434-dbb9-56a3-b77d-61dc70fcd753,0,nyt://article/00351434-dbb9-56a3-b77d-61dc70fcd753
,https://www.nytimes.com/1859/02/08/archives/financial.html,,,7,The New York Times,[],"{'main': 'FINANCIAL.', 'kicker': '1', 'content_kicker': None, 'print_headline': 'FINANCIAL.', 'name': None, 'seo': None, 'sub': None}",[],1859-02-08T05:00:00+0000,article,None,Archives,"{'original': '', 'person': [], 'organization': None}",Archives,nyt://article/061e8345-77b5-5718-8be2-84b32fd70a65,0,nyt://article/061e8345-77b5-5718-8be2-84b32fd70a65
"The schooner Mercy, which arrived here last night, brings Part-au-Prince dates to Jan. 16. The revolution had extended to nearly all parts of tile Empire. At St. Marc some severe fighting had taken place, both on land and at sea. with cnsiderable loss of life. SOULOUQUE had been compelled to retreat. A naval engagement had taken place off St, Marc, six vessels taking part.  ",https://www.nytimes.com/1859/02/08/archives/later-from-hayti.html,,,5,The New York Times,[],"{'main': 'Later from Hayti.', 'kicker': '1', 'content_kicker': None, 'print_headline': 'Later from Hayti.', 'name': None, 'seo': None, 'sub': None}",[],1859-02-08T05:00:00+0000,article,None,Archives,"{'original': '', 'person': [], 'organization': None}",Archives,nyt://article/0b45ef62-3753-53eb-b7d2-24a18a882a9e,0,nyt://article/0b45ef62-3753-53eb-b7d2-24a18a882a9e
"PAY !--We understand that the Republican majority in the Legislature have at length taken the bull by the horns. It is a bull which gored that Party sadly a year ago last Fall. The animal's name is Taxation-a beast much dreaded by legislative majorities. But when debt exists, the best policy is to pay.  ",https://www.nytimes.com/1859/02/08/archives/article-4-no-title.html,,,4,The New York Times,[],"{'main': 'Article 4 -- No Title', 'kicker': '1', 'content_kicker': None, 'print_headline': 'Article 4 -- No Title', 'name': None, 'seo': None, 'sub': None}",[],1859-02-08T05:00:00+0000,article,None,Archives,"{'original': '', 'person': [], 'organization': None}",Archives,nyt://article/0dc9b946-7f9b-57e7-8ee5-bce07e6885ca,0,nyt://article/0dc9b946-7f9b-57e7-8ee5-bce07e6885ca
"The amendmnents made in the Senate to-day to the bill from the House, granting lands to the States for the purpose of endowing Agricultural Colleges, are not likely to jeopardize the consummation of the law. Mr. FORSYTH, our returned Minister to Mexico, finding that the President would neither take the responsibility of removing him formally from his missin, nor consent to his return to Mexico as Minister, has at length filed his resignation. S.  ",https://www.nytimes.com/1859/02/08/archives/news-by-telegraph-amendments-to-agricultural-colleges.html,,,4,The New York Times,[],"{'main': 'NEWS BY TELEGRAPH,; Amendments to Agricultural Colleges Bill--Registration of Mr. Forsyth--Annual Report of Foreign Commerce. FROM WASHINGTON.', 'kicker': '1', 'content_kicker': None, 'print_headline': 'NEWS BY TELEGRAPH,; Amendments to Agricultural Colleges Bill--Registration of Mr. Forsyth--Annual Report of Foreign Commerce. FROM WASHINGTON.', 'name': None, 'seo': None, 'sub': None}",[],1859-02-08T05:00:00+0000,article,None,Archives,"{'original': '', 'person': [], 'organization': None}",Archives,nyt://article/1525202e-d018-5db5-a35f-2a3149ec41da,0,nyt://article/1525202e-d018-5db5-a35f-2a3149ec41da
,https://www.nytimes.com/1859/02/08/archives/from-kansas-action-of-the-legislaturecall-for-a-new-constitutional.html,,,8,The New York Times,[],"{'main': 'FROM KANSAS.; Action of the Legislature--Call for a New Constitutional Convention--The Running Off of Slaves.', 'kicker': '1', 'content_kicker': None, 'print_headline': 'FROM KANSAS.; Action of the Legislature--Call for a New Constitutional Convention--The Running Off of Slaves.', 'name': None, 'seo': None, 'sub': None}",[],1859-02-08T05:00:00+0000,article,None,Archives,"{'original': '', 'person': [], 'organization': None}",Archives,nyt://article/172cbd18-13c1-5128-b604-aedfa21dada5,0,nyt://article/172cbd18-13c1-5128-b604-aedfa21dada5
,https://www.nytimes.com/1859/02/08/archives/miniature-almanacthis-day.html,,,8,The New York Times,[],"{'main': 'MINIATURE ALMANAC--THIS DAY.', 'kicker': '1', 'content_kicker': None, 'print_headline': 'MINIATURE ALMANAC--THIS DAY.', 'name': None, 'seo': None, 'sub': None}",[],1859-02-08T05:00:00+0000,article,None,Archives,"{'original': '', 'person': [], 'organization': None}",Archives,nyt://article/1830d0f8-cc90-50c2-9847-823e47c000da,0,nyt://article/1830d0f8-cc90-50c2-9847-823e47c000da
,https://www.nytimes.com/1859/02/08/archives/article-1-no-title.html,,,2,The New York Times,[],"{'main': 'Article 1 -- No Title', 'kicker': '1', 'content_kicker': None, 'print_headline': 'Article 1 -- No Title', 'name': None, 'seo': None, 'sub': None}",[],1859-02-08T05:00:00+0000,article,None,Archives,"{'original': '', 'person': [], 'organization': None}",Archives,nyt://article/18707905-f9ad-5a26-a542-3fbf051473ec,0,nyt://article/18707905-f9ad-5a26-a542-3fbf051473ec
"A TOUCHING RELIC OF ROBERT BURNS.--We (Boston Journal) saw to-day an autograph letter of the poet, addressed t Captain HAMILTON, of Damfries, S1 years ago. It is in the possession of a Boston Publisher, who also owns, among other precious originals, one of BURNS' love-letters to ""Clarinda,"" We have been kindly permitted to copy the letter to Captain HAMILTON:  ",https://www.nytimes.com/1859/02/08/archives/article-2-no-title.html,,,2,The New York Times,[],"{'main': 'Article 2 -- No Title', 'kicker': '1', 'content_kicker': None, 'print_headline': 'Article 2 -- No Title', 'name': None, 'seo': None, 'sub': None}",[],1859-02-08T05:00:00+0000,article,None,Archives,"{'original': '', 'person': [], 'organization': None}",Archives,nyt://article/1aca53ea-530f-5191-ba1a-01ccc5d0195e,0,nyt://article/1aca53ea-530f-5191-ba1a-01ccc5d0195e
,https://www.nytimes.com/1859/02/08/archives/insurance.html,,,7,The New York Times,[],"{'main': 'INSURANCE.', 'kicker': '1', 'content_kicker': None, 'print_headline': 'INSURANCE.', 'name': None, 'seo': None, 'sub': None}",[],1859-02-08T05:00:00+0000,article,None,Archives,"{'original': '', 'person': [], 'organization': None}",Archives,nyt://article/1b103762-77a9-56ab-906c-9807c84f0da6,0,nyt://article/1b103762-77a9-56ab-906c-9807c84f0da6
"GUARDING THE MORALS OF THE BOYS.--The conscript fathers at Albany are paying particular attention to the boys. One bill, which has been ordered to a third reading in the Assembly, inflicts fine and imprisonment upon all luckless urchina caught in the offence of trespassing on orchards, and appropriating the fruit growing therein.  ",https://www.nytimes.com/1859/02/08/archives/article-7-no-title.html,,,4,The New York Times,[],"{'main': 'Article 7 -- No Title', 'kicker': '1', 'content_kicker': None, 'print_headline': 'Article 7 -- No Title', 'name': None, 'seo': None, 'sub': None}",[],1859-02-08T05:00:00+0000,article,None,Archives,"{'original': '', 'person': [], 'organization': None}",Archives,nyt://article/1fa4f5b2-b169-5cda-be84-111b0db9e91e,0,nyt://article/1fa4f5b2-b169-5cda-be84-111b0db9e91e
"SPRINKLING SALT ON THE STREETS--The Committee on Streets of the Board of Councilmen me yesterday afternoon, to hear parties interested in the ordinance prohibiting the use of salt to clear snow from the streets. Col. DARLING, President of the Third-avenue Railroad Company, said that railroad companies should be excepted from the action of this ordinance.  ",https://www.nytimes.com/1859/02/08/archives/city-intelligence.html,,,8,The New York Times,[],"{'main': 'CITY INTELLIGENCE.', 'kicker': '1', 'content_kicker': None, 'print_headline': 'CITY INTELLIGENCE.', 'name': None, 'seo': None, 'sub': None}",[],1859-02-08T05:00:00+0000,article,None,Archives,"{'original': '', 'person': [], 'organization': None}",Archives,nyt://article/20cb4d59-636d-5622-a58f-4d94b4c0c35e,0,nyt://article/20cb4d59-636d-5622-a58f-4d94b4c0c35e
,https://www.nytimes.com/1859/02/08/archives/the-case-of-mrs-hartung.html,,,5,The New York Times,[],"{'main': 'The Case of Mrs. Hartung.', 'kicker': '1', 'content_kicker': None, 'print_headline': 'The Case of Mrs. Hartung.', 'name': None, 'seo': None, 'sub': None}",[],1859-02-08T05:00:00+0000,article,None,Archives,"{'original': '', 'person': [], 'organization': None}",Archives,nyt://article/21bfaf1a-83be-5e5e-bcd6-8e4f2a061bd9,0,nyt://article/21bfaf1a-83be-5e5e-bcd6-8e4f2a061bd9
"Street Commissioner SMITH has transmitted to the Common Council a report of the business transacted in his department since the cutting of the Gordian difficulty between Messrs. CONOVER and DEVILS, by the appointment of Mr. EDWARD COOPER, on the 19th of last April. The report vigorous, full of important suggestins, and bold in its i of the obstacles which still stand in the way of making this Department all that could be desire.  ",https://www.nytimes.com/1859/02/08/archives/the-street-commissioners-report.html,,,2,The New York Times,[],"{'main': ""The Street Commissioner's Report."", 'kicker': '1', 'content_kicker': None, 'print_headline': ""The Street Commissioner's Report."", 'name': None, 'seo': None, 'sub': None}",[],1859-02-08T05:00:00+0000,article,None,Archives,"{'original': '', 'person': [], 'organization': None}",Archives,nyt://article/22994bb0-b71e-59bb-9fee-dc8608403e95,0,nyt://article/22994bb0-b71e-59bb-9fee-dc8608403e95
"The question is, will our European neighbors permit this acquisition when the joint efforts of England and France alone are sufficient to prevent it? We may safely assume that these two controlling powers will use every effort to prevent this transfer: of territory, if they entertain a reasonable apprehension that it will probably endanger the permanency of their own dominion in the West Indies. Let us examine the grounds for such an apprehension.  ",https://www.nytimes.com/1859/02/08/archives/the-virginia-democracy-against-the-acquisition-of-cubaa-strong.html,,,2,The New York Times,[],"{'main': 'The Virginia Democracy Against the Acquisition of Cuba--A Strong Protest.', 'kicker': '1', 'content_kicker': None, 'print_headline': 'The Virginia Democracy Against the Acquisition of Cuba--A Strong Protest.', 'name': None, 'seo': None, 'sub': None}",[],1859-02-08T05:00:00+0000,article,None,Archives,"{'original': '', 'person': [], 'organization': None}",Archives,nyt://article/23b1a143-0a6c-5ed9-b248-70b8e5810acc,0,nyt://article/23b1a143-0a6c-5ed9-b248-70b8e5810acc
"CLASSICAL MATINEE.--Messrs. MASON and THOMAS will give their third classical matinee to-day, at Dodworth's Saloon, commencing at 2 o'clock. The programme opens with SCHUMANN'S Senate for Piano and violin, opus 105, followed by one of HAYDEN'S Quarters, an Etude by RUBENSTEIN, and a Quartet by MENDELSSOHN. It does not often happen that so many excellent curiosities are presented in one programme.  ",https://www.nytimes.com/1859/02/08/archives/amusements.html,,,4,The New York Times,[],"{'main': 'Amusements.', 'kicker': '1', 'content_kicker': None, 'print_headline': 'Amusements.', 'name': None, 'seo': None, 'sub': None}",[],1859-02-08T05:00:00+0000,article,None,Archives,"{'original': '', 'person': [], 'organization': None}",Archives,nyt://article/2cff0544-bf92-57de-bc4b-eff794ad7324,0,nyt://article/2cff0544-bf92-57de-bc4b-eff794ad7324
,https://www.nytimes.com/1859/02/08/archives/brig-melazzo-ashore.html,,,5,The New York Times,[],"{'main': 'Brig Melazzo Ashore.', 'kicker': '1', 'content_kicker': None, 'print_headline': 'Brig Melazzo Ashore.', 'name': None, 'seo': None, 'sub': None}",[],1859-02-08T05:00:00+0000,article,None,Archives,"{'original': '', 'person': [], 'organization': None}",Archives,nyt://article/2d3e5269-2493-56df-99e3-4b4afa5399ce,0,nyt://article/2d3e5269-2493-56df-99e3-4b4afa5399ce
